date,tweet
2019-07-27 19:59:57,"I do a fair number of clicker questions in class (btw, guided by  https://www.lifescied.org/doi/full/10.1187/cbe.10-08-0101 … ). I'd like to use even more retrieval practice, but class time is very full. Any suggestions on how to do it outside of class (say in our LMS) in such a way that students don't just Google?"
2019-07-27 19:59:57,Not at all!!! Google ok?
2019-07-27 19:59:54,一个连Google translate都不支援的语文... 我们观赏来干嘛？ #张念群 #是否新年挥春也要用爪夷文
2019-07-27 19:59:53,"..especially Omar is slow but insidious, her goal is 2 make her radical Muslim views urs. Just research Omar & you'll see her hatred 4 America (Not the America Omar wants 2 turn it into, ran by Muslim extremists. Don't take my word, Google her), Jews, israel, any 1 not her color"
2019-07-27 19:59:52,Fresh Start Home Sales- Rent To Own Homes on #Google  https://local.google.com/place?id=6200808749148260999&use=posts&lpsid=586289299372852774 …
2019-07-27 19:59:51,"if you’ve heard my voice,, do i sound like google translate?"
2019-07-27 19:59:50,"#PictureOfTheDay (#Google #Pixel2) + 6 Also-Rans —  July 27, 2019.  https://nhlifefree.com/2019/07/27/the-picture-of-the-day-google-pixel-2-6-also-rans-july-27-2019/ … #GooglePixel2 pic.twitter.com/EC8gw2SBWg"
2019-07-27 19:59:48,Google search update aims to show more diverse results from different domain names  http://bit.ly/2NRDOu2 
2019-07-27 19:59:48,At 12%.. about to see how fast this new Google Pixel 3 XL charges.. If it's anything faster than my old old LG I'll be impressed.
2019-07-27 19:59:47,Karna kamu aku jadi kepo google dan ngakak banget 😭😂🤣😂  pic.twitter.com/wlHxyd5Ckt
2019-07-27 19:59:46,"Bueno me perdí en la localización, (No había google cuando yo iba) pero lo he vistado y me encantó. Mi trabajo me llevó varias veces a Mexico y también iba de vacaciones por que es bello."
2019-07-27 19:59:46,"Google Photos Offline Version Released, It’s Gallery Go  http://twib.in/l/9M7MGzeeK8Ag  #Lagos #Technews #PhCity"
2019-07-27 19:59:46,For those who can't use Google drive for whatever reason. 😎 #TripleH #Rebelball19 pic.twitter.com/lK1CVsP6aK
2019-07-27 19:59:45,"Ya know where they are if you use Google Waze as your sat nav, even the mobiles (allegedly);👌😂😂"
2019-07-27 19:59:44,"Desde Google Fotos , pone crear vínculos y listo  pic.twitter.com/l8PVfXkRxY"
2019-07-27 19:59:44,From Discover on Google  https://www.espn.com/mlb/story/_/id/27269672/ortiz-hospital-following-three-surgeries …
2019-07-27 19:59:43,(口封じ、性的でない、でGoogle検索をかけている)
2019-07-27 19:59:42,"Mailchimp and the like do that to some extent, and while at Google, I played a role in developing the ""AMP"" format, which has now been integrated into emails -  https://amp.dev/documentation/guides-and-tutorials/learn/email-spec/amp-email-format/ …"
2019-07-27 19:59:40,"Google is the single most biased company in the world. And it's because they want to RULE the world. When I go to look up UNBIASED things, I TRY to get it on  http://DuckDuckGo.com "
2019-07-27 19:59:39,Por casualidad hay que usar un Google traslator?
2019-07-27 19:59:38,おはようございます。Google アカウントのユーザー名やパスワードはお分かりですか？ログインできなくなった場合は、こちらのトラブルシューティングの該当する問題を選択して、表示される手順をお試しください。 http://goo.gl/Fjqcic  この方法で問題は解決できましたか？
2019-07-27 19:59:38,瑠璃 雪女 瑠璃色の雪 - Google 検索  https://www.google.co.jp/search?q=%E7%91%A0%E7%92%83+%E9%9B%AA%E5%A5%B3+%E7%91%A0%E7%92%83%E8%89%B2%E3%81%AE%E9%9B%AA&tbm=isch&ved=2ahUKEwjOm-3dptbjAhUKdJQKHVoOBM0Q2-cCegQIABAC&oq=%E7%91%A0%E7%92%83+%E9%9B%AA%E5%A5%B3+%E7%91%A0%E7%92%83%E8%89%B2%E3%81%AE%E9%9B%AA&gs_l=mobile-gws-wiz-img.3...6829.10254..11423...7.0..0.98.842.9......0....1.........30i10.RIi7JgdVpPg&ei=5uQ8Xc6QE4ro0QTanJDoDA&bih=719&biw=414&client=safari&prmd=ivsn&hl=ja-jp …  瑠璃可愛いよ瑠璃
2019-07-27 19:59:36,"i guess this is a clear message from google telling me to sTOP WRITING and go to bed.  i've written 15K words so far, so that's a success at least... it's 2am, so yep, i should stop. oops.  https://twitter.com/larrycaring/status/1155265166554124289 …"
2019-07-27 19:59:35,Отличный бесплатный инструмент для поиска ключевых слов - 750+ ключей из поисковых подсказок Google @keywordtoolio https://keywordtool.io/ru 
2019-07-27 19:59:35,"🔥 Así es como Amazon superó a Microsoft, Apple y Google y ahora es la compañía más valiosa del mundo  https://www.grandesmedios.com/amazon-empresa-mas-valiosa/ …"
2019-07-27 19:59:34,Nature RemoとGoogle Homeの組合せでできますよ。実際使ってますが、快適ですw ほとんどのエアコンの赤外線信号に対応してます。   https://nature.global/jp/top 
2019-07-27 19:59:33,"In case u haven't heard nigga,,,,,,the.... UoN👌just google"
2019-07-27 19:59:31,"With respect, you're hearing criticism I'm not saying. Your game name is great. It's just hard to google."
2019-07-27 19:59:30,Hovås Strandbar on Google  https://local.google.com/place?id=16212023258613253732&use=posts&lpsid=6015211455011211668 …
2019-07-27 19:59:26,3浪イさんおはようなのだ〜！
2019-07-27 19:59:25,You Don't Know What You Don't Know!  The solution to software productivity isn't found in a Google search. Especially because we're often asking the wrong question. Let's create a plan to bring the right software answers to your team. Contact me at Dawn@TheSoftwarePro.com  pic.twitter.com/K6QvP4ZlxW
2019-07-27 19:59:25,"is, and then we got google which only lets us see about 3% of the internet! i hope the doj does breakup big tech"
2019-07-27 19:59:24,"Google, Facebook, etc is not free. They charge you your privacy. @RascalTweets #TLYAW"
2019-07-27 19:59:21,Registro Nacional e Mundial Blogs e Lojas virtuais  https://wbh.com.br  (31) 3773-8771 Whatsapp 31 99313-8558 SEO marketing para Google Agência de publicidade digital Criação de site Responsivo Escritórios em BH Belo Horizonte e Sete Lagoas ac0022  pic.twitter.com/EWPhrXcZru
2019-07-27 19:59:21,違う時案内したちゅごくの人Google翻訳でも無理だったからどうすればよかったのかめっちゃ手探りでついてきてーーって案内した うちのバスは逃した
2019-07-27 19:59:21,"I had to Google it, I never heard of the movie."
2019-07-27 19:59:20,"Aaaah mas aí não vou ser eu que jogo né... e sim o Google!! HAHAHAHA to na sorte, uma hora vou ter que melhorar né!"
2019-07-27 19:59:18,"como fazer pra não me apaixonar por mim mesma, Google Pesquisar"
2019-07-27 19:59:16,"Búsquelos, para eso está google, haga el esfuercito en lugar de dar un dato tan inverosímil como “un billón en publicidad”"
2019-07-27 19:59:11,I'm slowly stopping using google
2019-07-27 19:59:09,i had to google what a plum looks like because i forgot.
2019-07-27 19:59:09,Who’s going to tell #Google that this isn’t Ludacris  pic.twitter.com/3vwC80ecMe
2019-07-27 19:59:09,[ITmedia News] 10億人超えのGoogleフォトを支える人々が考えていること https://www.itmedia.co.jp/news/articles/1907/28/news013.html …
2019-07-27 19:59:05,How to Enable Caching with Google Firebase Hosting?  See:  https://isrg.me/DDmvh7  @isrgrajan #SundayMotivation #IsrgRajan #Firebase #Google #Hosting #Howto pic.twitter.com/EywViTkvQs
2019-07-27 19:59:04,"La nube de google me hace eso de comparar fotos y ver el antes/despues. Me pone foto de hace 3 años donde estaba hermosa y llena de vida, y las d ahora, posta q es t r i s t e"
2019-07-27 19:59:04,"The causes the have supported, including rolling back marriage equality, are textbook (or Google-able) discrimination."
2019-07-27 19:59:02,"Awalnya gw aneh kok hari minggu gini bahas pocong,eh ternyata si pocong masuk google maps:D  pic.twitter.com/5NTfNNUUcP"
2019-07-27 19:59:01,Clearly Google Translate was too much hard work. The End 😂  pic.twitter.com/ykUHgr2HJO
2019-07-27 19:59:01,Don't google a pet care question without reading this. @DrMartyBecker https://buff.ly/2MgwF44 
2019-07-27 19:59:01,エビデンスぞくぞく  Google純正ノート「Pixelbook 2」がベンチマークテストに出現？ - Engadget Japanese  https://engt.co/2ZnS0MA 
2019-07-27 19:58:56,Sono come mia madre che cerca le cure più disparate su Google nella speranza di poter far qualcosa.
2019-07-27 19:58:53,"Oh...and by the way... If population matters, in 2017 Baltimore had MORE MURDERS than NYC. Care to compare the pop. of the two? Google it if you like. Then google how many there are ever solved."
2019-07-27 19:58:52,"I just posted ""Google reCAPTCHA Keys Beginners Guide"" on Reddit   https://www.reddit.com/r/u_JMExclusives/comments/ciovdn/google_recaptcha_keys_beginners_guide/?utm_content=post&utm_medium=twitter&utm_source=share&utm_name=submit&utm_term=t3_ciovdn …"
2019-07-27 19:58:52,É assim que vc sustenta sua afirmação? Putz... provavelmente procurou no google e percebeu que iria se ferrar e achou melhor sair pela tangente... pelo menos entendeu o recado (espero).
2019-07-27 19:58:48,काम गर्दा गर्दै English बोल्न नि सारै गारो दिमाग मा Google सर्च  गरेर How to speak english मा Talk गर्न पर्छ #भुत
2019-07-27 19:58:41,My old ass had to Google what that was.
2019-07-27 19:58:37,Do Discover no Google  https://www.brasil247.com/brasil/portaria-666-e-imoral-e-inconstitucional-afirma-professora-da-usp …
2019-07-27 19:58:36,New Google Swipe to Visit feature holds potential for traffic bump for publishers whose pages support AMP (via @sejournal). http://ow.ly/ZMvK50ve8Di 
2019-07-27 19:58:36,Bah c'est leur but mais chez Android ils doivent juste faire leur synchronisation avec windows parceque google ils ont fait leur ChromeOS tout naze là
2019-07-27 19:58:35,"✅ DONE ✅  Roofing Replacement Angleton Tx.  No Money Upfront! Check our great reviews on BBB, GOOGLE & FACEBOOK - Free Estimate ☎️ 832-525-9679 ✅ http://HandalRoofing.com  #HandalRoofing #Roof #Roofer #Roofing #Realtor...  https://www.facebook.com/100001407423896/posts/2417490604974497/ …"
2019-07-27 19:58:34,Googleで調べたら中心暗点って出てきた…！  片目ずつ見て両目とも半分見えないなら脳神経、片目だけなら眼科っぽいよ！早く病院へ…！
2019-07-27 19:58:33,e google drive:  *ttps://drive.google.com/file/d/1tCNxKiMU3nP-LVFqktfrOj_as6hADBoS/view
2019-07-27 19:58:31,"Com a vulnerabilidade das caixas postais das operadoras qualquer pessoa teria suas contas do Google, Apple, Microsoft, qualquer site ou aplicativo que utilizassem verificação em duas etapas utilizando o código por voz. Se fosse utilizado por SMS a invasão não teria acontecido!"
2019-07-27 19:58:30,@DannyDuncan69 So I was at a Best Buy and I saw that this fridge had google on it so I pulled up  http://dannyduncan69.com  everyone go get ur merch and tour tickets pic.twitter.com/mRQYNBsxKW
2019-07-27 19:58:29,google is a thing.
2019-07-27 19:58:28,"You just posting random 'homless' pics from google images?  Here, check out my pics of beautiful Baltimore  pic.twitter.com/oklsQ94kE5"
2019-07-27 19:58:28,I actually can’t find why he is trending. All I see is people tweeting things like this and google says nothing.
2019-07-27 19:58:27,"Como no hubo goulash toco coger camino a la próxima recomendación de San Google Salvador, patrono omnipotente del viajero con simcard! em Ferenciek tere  https://www.instagram.com/p/B0cIHeigeAh/?igshid=1dly0r352app1 …"
2019-07-27 19:58:25,"Wasnt a Tesla fan, I thought, but test drove one the other day. UNREAL! Didn’t see design issues at all. Really want model x!!  Great job Elon, amazing product.  Partner with Apple or google so you have unlimited liquidity!"
2019-07-27 19:58:24,wait then who are they talking about then in general? I need the details. Apparently you’re everyone’s google so — No comment  https://curiouscat.me/roselavelles/post/940844200?t=1564271904 …
2019-07-27 19:58:21,"Ué, não sabe usar o Google? Pesquisa ae mané, esse Guarani q recebe Mesada acham q são alguma coisa, vivem numa bolha com as mentiras q só eles acreditam"
2019-07-27 19:58:20,Discover（Google）から  https://lineblog.me/kanosisters/archives/13231133.html …
2019-07-27 19:58:19,não sei porque estou reclamando de fanfic no twitter eu tenho fanfic gore de minecraft escrita no meu google docs
2019-07-27 19:58:18,This documentary is absolutely mind blowing! 🤯🤯🤯🤯 @netflix @Twitter @Google @POTUS #SaturdayThoughts https://twitter.com/NetflixUK/status/1154076408890712064 …
2019-07-27 19:58:15,(I should have google “Neo-Adamites” before I put it on Twitter cause I just found there were some in like the 1300-1500s called the Brethren of the Free Spirit so that’s a fun thing I now need to learn more about)
2019-07-27 19:58:15,False. A simple google search yields numerous news accounts of grown men sexually assaulting children in women’s restrooms. I don’t think taking away the red flag - man in women’s restroom- is a good idea if you care about women& children’s safety.
2019-07-27 19:58:10,"Outlook email wasn’t bad, but constantly having to sign in with two separate screens (one for username/another for password) was too cumbersome.    Google News is now supplementing an RSS feed through the new Reeder app as well. Definitely need some news from outside my bubble!"
2019-07-27 19:58:09,You might have!! Maybe they will google it!
2019-07-27 19:58:08,Alguien que sepa algo de ed. Física? Necesito las reglas de voley y Google es una poronga 🤦🏻‍♀️
2019-07-27 19:58:07,Googleのコンピューター科学者はなぜ我が子をオープンソース化したのか？  https://gigazine.net/news/20190726-open-sourcing-baby-saving-lydia/ … #スマートニュース
2019-07-27 19:58:07,SEO marketing para Google  https://wbh.com.br  Escritórios em BH Belo Horizonte e Sete Lagoas (31) 3773-8771 Whatsapp 31 99313-8558 criação de sites hospedagem e divulgação Criação de site Responsivo Sete Lagoas Agência de publicidade digital Mg0016 pic.twitter.com/q9k52esZ4N
2019-07-27 19:58:07,Hey @roarkclarke! Already signed for season five! Woot!  From Discover on Google  https://www.engadget.com/2019/07/27/amazon-the-expanse-season-5/ …
2019-07-27 19:58:05,What about the collusion between MSM Google and the Dem Party? Nobody wants to talk about the biggest elephant in the room.   How many millions of votes did they sway the Dems way? 90% negative coverage on Trump has effect.
2019-07-27 19:58:04,Thank you so much. This is all the help Google offers:  pic.twitter.com/w5oLDj9Mj8
2019-07-27 19:58:01,"And reading. OMG I’m beginning to remember the joys of reading. Like, a whole book. Nonfiction. Not google news or silly little blogs. You read each page from left to right. Word after word. Start to end (or starting at end is fun too). Some light summer reading for CA road trip.  pic.twitter.com/QklvzNRnKh"
2019-07-27 19:58:00,"Apple contractors 'regularly hear confidential details' on Siri recordings  https://www.theguardian.com/technology/2019/jul/26/apple-contractors-regularly-hear-confidential-details-on-siri-recordings … Apple acknowledges that a select portion of recordings are heard by contractors to analyze for improvements, which is where they claimed to be different than Google and Amazon."
2019-07-27 19:58:00,🚨MTV VIDEO MUSIC AWARDS D-30🚨  Tutorial to vote: 1. Go to here  http://www.mtv.com/vma/vote/  2. Log in by using &lt;Google> <Twitter> or <Email Address> 3. Go to <Best K-pop> section 4. You can vote up to 10 times per category so vote EXO everyday.  #MGMAVOTE #EXO @weareoneEXO pic.twitter.com/yABazjwpKr
2019-07-27 19:57:58,eu em 2016 comendo 24 sushis + tempurá: aeeHOOOO TOCA PO PAI TÁ TRANQUILO TÁ FAVORÁVEL 🤙 CHAMA | eu em 2019 comendo 16 sushis: (Pesquisa Google) o estômago humano pode se romper? [buscar]
2019-07-27 19:57:58,serase já tem Fênix Negra leg em HD no Google?
2019-07-27 19:57:57,I’m actually laughing bc my dumb ass was totally confident that’s how it was spelled I just had to google the correct way bc I was confused
2019-07-27 19:57:56,"Selain untuk browsing, Google juga sering digunakan untuk spellchecking."
2019-07-27 19:57:55,AND WE DREW THE MOONS AS ACCURATE TO GOOGLE IMAGES SHOWS AS POSSIBLE AHHHHH
2019-07-27 19:57:54,"if it’s pics use google photos,, it saved my life"
2019-07-27 19:57:53,en verdad 2019 es el año en que Google empezó a cobrar por búsquedas con sus propios deditos o qué chingadxs
2019-07-27 19:57:52,nn c ok google
2019-07-27 19:57:52,Ask google!
2019-07-27 19:57:52,Do Discover no Google  https://www.diariodocentrodomundo.com.br/o-procurador-sem-escrupulos-dallagnol-e-um-compulsivo-por-dinheiro-por-moises-mendes/ …
2019-07-27 19:57:52,"Dear Google, How do I train my dogs not to pee on each other's heads?  Sincerely, Concerned dad who is sick of using my wet wipes on my dog's heads."
2019-07-27 19:57:51,Acho que essa noite eu não durmo já to procurando aqui no google todas as orações possíveis para este momento
2019-07-27 19:57:50,"sério às vezes eu esqueço a altura dos idols vo atrás no google e fico em CHOQUE, tipo hoje eu quase morri descobrindo que o mingyu tem 187 e não 182 como eu pensava que ele tinha essa porra ta uma casa"
