date,tweet
2019-09-13 19:36:20,"Just google ""sweden stock photos of women"""
2019-09-13 19:24:03,"▶ AO Indicators For HDFC Bank Limited (NYSE:HDB) Touch -1.19621029 - Manville Messenger: AO Indicators For HDFC Bank Limited (NYSE:HDB) Touch -1.19621029  Manville Messenger When setting up a personal stock investment strategy, individual…  http://dlvr.it/RD3svB  GOOGLE"
2019-09-13 19:22:48,"Google ended 2016 with $60.7 billion in untaxed money held overseas, the company said in a regulatory filing.  https://lnkd.in/e6quJfH   Under US tax code Bermuda HCs do not have to pay tax on Capital Gains invested in US stock markets - on publicly traded… https://lnkd.in/emWjsJM "
2019-09-13 18:27:03,▶ Hot Stock Roundup: HDFC Bank Limited (HDB) - NEWS CONTROL: Hot Stock Roundup: HDFC Bank Limited (HDB)  NEWS CONTROL HDFC Bank Limited (HDB):. HDFC Bank Limited (HDB) share price soared 1.22% and ceased at $105 after the market close on…  http://dlvr.it/RD3mFW  GOOGLE
2019-09-13 18:22:31,"#Hey19YearOldMe Forget that art degree your studying for  and join those nerds in the computer lab with those IBM punch cards. ...and if you ever hear of a stock called Google,  invest all your money in it"
2019-09-13 18:20:35,That’s true.   I taking it one step at a time. I finally got all of my immediate dad side of the family to restart investing again.   The last time they did our broker convinced them to sell their Google stock before they took off 🥴   They are still pissed about that.
2019-09-13 17:49:45,"Want FREE stocks? Open an account in the next 24 hours and get a free stock. Receive another stock from companies like Apple, Starbucks or Google when you make your first deposit. Use my link to sign up now!  https://act.webull.com/promotion/invitation/share.html?inviteCode=l3DwrNoFF63M …"
2019-09-13 17:21:45,Just waiting for them to start slowing down my phone and sabotaging my battery life.  Then I’m either going to Samsung or Google.  I would be shorting apple stock if I had a margin account.  pic.twitter.com/RirkhooKx1
2019-09-13 16:55:05,"Android dans sa version stock, avec la Google suite est équivalente a iOS et ses apps, si ce n'est mieux !"
2019-09-13 16:51:45,"Notice , Twitter is the main source of news communications.  It’s everywhere.  Twitter will be going rampant for the 2020 Presidential race.  Buy the stock before it happens.  Advertisers are going to use $twtr more than any other social media.  @Apple or @Google should buy twtr  https://twitter.com/CNNPolitics/status/1172612197647863808 …"
2019-09-13 16:50:15,"Aw xD Naja die kriegst du auch, wenn du gegen den Typen im 3. Stock spielst. Der, der unter der Brücke steht. Sonst google mal cc freaks quest, die haben auch alle gute Karten"
2019-09-13 16:47:18,"#Hey19YearOldMe buy apple stock. And when something called ""Google"" and ""Amazon"" come along, buy that stock too. I'll catch up with you on our private island. Thanks"
2019-09-13 16:46:58,"Does congress really have to prove that amazon, Facebook and google engaged in anti competitive behavior? My question is, how would a break up of services affect the stock prices ? #amazon #AmazonPrime #facebook #FacebookAds #google #GoogleExposed"
2019-09-13 16:43:30,"#Hey19YearOldMe You have no idea what I'm talking about, but buy stock in Google."
2019-09-13 16:30:33,"▶ HDFC Bank to Launch Finance Unit's IPO in 2020 Financial Year - News18: HDFC Bank to Launch Finance Unit's IPO in 2020 Financial Year  News18 If the IPO goes through, HDB Financial will become the fifth HDFC group firm to be listed on stock…  http://dlvr.it/RD3V98  GOOGLE"
2019-09-13 16:15:15,Respectful Google starts the apocalypse  6 pm in Creno's. Ashley Weiss reporting for Stock Market station.
2019-09-13 15:46:27,Solomon Thomas and some Google stock
2019-09-13 14:47:56,"Not so sure. Read the top three hits on google for “liquidation preference ipo” - all of them say its irrelevant for an IPO, as no preferred stock is being issued."
2019-09-13 14:26:48,Le London Stock Exchange rejette l'offre de rachat de la Bourse de Hong Kong Depuis Discover sur Google  https://www.lesechos.fr/finance-marches/marches-financiers/la-bourse-de-londres-rejette-loffre-de-rachat-de-hong-kong-1131473 …
2019-09-13 14:00:40,"""They told me the day i ordered a book, it was out of stock. Told me what day it would come and threw in the tabs. Very good service!"" says Craig on Google, via @Birdeye_ https://birdeye.com/contractor-training-center-153851784621978/review/1980533265132111299 …"
2019-09-13 13:52:09,It’s intersting to “google translate” some of the posts onto Climeon forum. The bigger pessimism the better time to buy the stock. Yesterday’s post at StockholmDirekt might be a “sign” of it.  https://www.avanza.se/placera/forum/forum/climeon.html … pic.twitter.com/BcxCLsDMX1
2019-09-13 13:44:34,"The idea of the big 4 = Google, Apple, Amazon, Facebook is out of date. Msft should replace FB. Msft stock has tripled since 2016, hence skyrocketing mkt cap while Google & Apple's somewhat flat. FB’s stock has doubled over 3 years, tho mkt cap now only half of the real big 4."
2019-09-13 13:37:10,It’s intersting to “google translate” some of the posts onto SaltX forum. The stock has just been waiting for any fundamental news to explode to the upside.  https://www.avanza.se/placera/forum/forum/saltx.html … pic.twitter.com/6ydFUVRoaf
2019-09-13 13:09:24,"One of the patients today said “ You are a very friendly doctor”. Are doctors not friendly these day? Just wondering. Did quick Google search in images, found alot of them but in stock photos only."
2019-09-13 12:47:24,Sticking With Google Stock Amid Antitrust Probes Will Pay Off |  http://Investing.com   http://bit.ly/2LvCsSC  #autonomousCar #selfDrivingCar
2019-09-13 12:43:44,"Want FREE stocks? Open an account in the next 24 hours and get a free stock. Receive another stock from companies like Apple, Starbucks or Google when you make your first deposit. Use my link to sign up now!  https://act.webull.com/promotion/invitation/share.html?inviteCode=Yp9PkELVNSy5 …"
2019-09-13 12:40:04,@Argos_Online any idea when you'll have the Google Home Hub Max in stock please?
2019-09-13 12:32:32,"Buy stock in Amazon, Facebook and Google. #Hey19YearOldMe"
2019-09-13 12:21:55,"Want FREE stocks? Open an account in the next 24 hours and get a free stock. Receive another stock from companies like Apple, Starbucks or Google when you make your first deposit. Use my link to sign up now!  https://act.webull.com/promotion/invitation/share.html?inviteCode=tNFpwN2XUqcC …"
2019-09-13 12:14:08,"People tend to criticize #Google and/or #Apple for running out of stock, but what about @Nike?  They released the #AdaptHuarache this morning & within #Under10Seconds the reselling bots got all sizes and colorways?! 🤬 #ThingsThatReallyGrindMyGears #ThinkOfTheChildren @nikestore pic.twitter.com/FMygFEbRD0"
2019-09-13 12:01:44,"They need you in South Africa Harry. This brilliant movement the very educated public has devised: Google, F.A.N.G Stocks (on the U.S. Stock Exchange &t) pay %2 for the sake of developement of programs viz. Women who have been raped. Must succeed. My friend."
2019-09-13 11:55:34,"Opinion ""Sticking With Google Stock Amid Antitrust Probes Will Pay Off""   http://www.investing.com/analysis/sticking-with-google-stock-amid-antitrust-probes-will-pay-off-200464257 …"
2019-09-13 11:47:19,"IAM Platform Curated Tweet:  Serverless Architecture Market to Witness Huge Growth by 2023 : Google, IBM Corporation, Oracle Corporation – Stock Market Pioneer    https://blog.iammarketingmedia.com/serverless-architecture-market-to-witness-huge-growth-by-2023-google-ibm-corporation-oracle-corporation-stock-market-pioneer/?utm_campaign=twitter&utm_medium=twitter&utm_source=twitter … #business #Computer #Computing #data #DataTransfer #Internet #TopInfluence #IAMPlatform"
2019-09-13 11:32:06,Buy Google stock! #Hey19YearOldMe
2019-09-13 11:06:01,Google translated my way to chicken stock with the nice grocery store employee today
2019-09-13 09:57:28,"Yahoo Finance: Auto Stock Roundup: Ford's Europe Electric Plans, General Motors' Deal With Google.  https://finance.yahoo.com/news/auto-stock-roundup-fords-europe-093409724.html …  via @GoogleNews"
2019-09-13 09:43:00,"They’re not holding the top as far as market cap to Amazon & Microsoft & maybe Google in the future  However, Cook has always done an excellent job of managing the business& using buybacks/dividend increases with their cash piles to keep pumping the stock higher over time 👏 👏"
2019-09-13 09:12:43,"Bitmoji notecards for staff. Created in google slides. Printed in house on card stock. Tied with a simple ribbon. Cost effective, personal and practical! #principalsinaction #principalsofinstagram #momsasprincipals #leadlap #leadlit  https://ift.tt/305VmI5  pic.twitter.com/rIhGatgcDF"
2019-09-13 08:50:02,"London Stock Exchange rejects Hong Kong takeover offer  CNBC London Stock Exchange has rejected Hong Kong Exchange's $39 billion takeover offer, opting to stick with its planned purchase of data and analytics group ...View full coverage on Google News  http://dlvr.it/RD1v1m "
2019-09-13 08:38:53,"You don’t pay for it. Amazon, Google, Facebook, etc. pay for it by actually paying their taxes. No cent comes out of your pocket to be put into other peoples pockets. It’s like you’re buying stock in America just for being here and getting a check for your investment every month"
2019-09-13 08:32:50,Tout a fait personnellement je préfère Android particulièrement Android stock que l'on a chez Google mais il est vrai que iOS est plus instinctif en terme de prise en main que Android
2019-09-13 08:05:30,USA business shakes down all. Makes product in SLAVE labor countries. Than dumps into America to sell to USA citizens they refuse to HIRE. Stock mkt celebrates!  Business Owners: Google ‘Killing’ Companies Using ‘Shakedown’ Ad Tactics  http://bit.ly/2I64j9M  via @BreitbartNews
2019-09-13 07:45:00,SEO and the Stock Market: How to Profit from Google Penalties |  http://Detailed.com  from @viperchill https://Detailed.com/ 
2019-09-13 07:43:06,"🍑 𝓕𝓻𝓮𝓮𝓫𝓲𝓮𝓼   •°  Est ce que vous préféreriez que je fasse un google doc où vous pouvez reserver les freebies que j'offre (je garderai toujours un mini stock à donner à des randoms) ou vous préféreriez que je fasse au premier à me voir, premier à avoir ?  #GOT7inParis"
2019-09-13 07:38:33,"Auto Stock Roundup: Ford's Europe Electric Plans, General Motors' Deal With Google  http://dlvr.it/RD1gm6  pic.twitter.com/TyQVSwBaiv"
2019-09-13 07:30:05,"Auto Stock Roundup: Ford's Europe Electric Plans, General Motors' Deal With Google  http://stock-market-newsfeed.blogspot.com/2019/09/auto-stock-roundup-fords-europe.html …"
2019-09-13 06:49:18,"Auto Stock Roundup: Ford’s Europe Electric Plans, General Motors’ Deal With Google  http://noahblaine.com/2019/09/13/auto-stock-roundup-fords-europe-electric-plans-general-motors-deal-with-google/ …"
2019-09-13 06:42:44,"Every Week i try to find a stock that could break out after #earnings I have identified $FDX as a candidate for #BigMove based on its weekly chart last price = $173.51 i will record the prices of Oct 4, $148P & $190C AMC in google sheets for U to see and judge Not an advice No DD  pic.twitter.com/d6vGMmhwZD"
2019-09-13 05:56:54,Give is stock google experience
2019-09-13 05:48:56,"Update: being advised to keep using the existing phone (which is burning itself up from the inside and probably dangerous to use) because Google has ""stock issues"". If Google can't get me a replacement, then can you at least refund my original order so I can buy something else?"
2019-09-13 05:17:12,"Whether a phone is based on MIUI or iOS (or any other stock or customised OS), best to use Google apps for all the needs wherever possible. Keep synching with Google on. That way switching to another phone won't be much of a headache."
2019-09-13 05:08:24,AI+ NEWS * Sticking With Google Stock Amid Antitrust Probes Will Pay Off –  http://Investing.com   https://ainews.spxbot.com/2019/09/13/sticking-with-google-stock-amid-antitrust-probes-will-pay-off-investing-com/ …
2019-09-13 04:43:22,Sticking With Google Stock Amid Antitrust Probes Will Pay Off  https://ift.tt/2Qa6NKP  #Forex #Bolsa #NoticiaBolsa #Forex21 #ForexNews #ForexTrading pic.twitter.com/PNT464k5jI
2019-09-13 04:38:43,Sticking With Google Stock Amid Antitrust Probes Will Pay Off -  https://invst.ly/5gm47 
2019-09-13 04:29:12,Avengers Endgame Google Play Digital HD Code - 3.99 (Limited Stock) $3.99  https://dealssupply.co/2ZTACnn  pic.twitter.com/pS4VQYhuqL
2019-09-13 04:26:39,"Now I'm over the dread 60 I love the Australian stock saddles,  google them if you haven't seen one,  armchair comfort!"
2019-09-13 04:25:37,Google search trends chart shows some Co-relation between Bitcoin and Stock market. via /r/Bitcoin  https://ift.tt/2Ltyjyz 
2019-09-13 04:17:55,"Wieso auch ein Huawei, und nicht irgendwas mit nahm am Stock Android? Man kann den ""Google Rotz"" übrigens meistens zumindest deaktivieren."
2019-09-13 03:56:06,▶ HDFC AMC’s Prashant Jain explains why slowdown will not affect stock market much - The Financial Express: HDFC AMC’s Prashant Jain explains why slowdown will not affect stock market much  The Financial Express Even as the stock market remains…  http://dlvr.it/RD14S8  GOOGLE
2019-09-13 03:53:25,"Avengers Endgame Google Play Digital HD Code - 3.99 (Limited Stock) $3.99  Thumb Score: +22  Will port via MoviesAnywhere.  This is just one of the many sites I purchase digital codes from. Everyone probably already owns Avengers Endgame, but if you don't - this is a good pr…  pic.twitter.com/YIJLsGBu4z"
2019-09-13 03:40:03,▶ HDFC AMC’s Prashant Jain explains why slowdown will not affect stock market much - Financial Express: HDFC AMC’s Prashant Jain explains why slowdown will not affect stock market much  Financial Express Even as the stock market remains amid the…  http://dlvr.it/RD12kW  GOOGLE
2019-09-13 03:25:04,"Nothing should get in the way of you stocking up.  Not even Friday the 13th superstition, traffic jam or the party mood should interfere with your plans to stock up.  Absolutely nothing!  Get the  Kikuubo Online App from either the google playstore or Appstore & #Tap2Stock pic.twitter.com/zomGg7Fi30"
2019-09-13 03:01:55,Avengers Endgame Google Play Digital HD Code - 3.99 (Limited Stock) $3.99 -  https://ift.tt/2Qaje9w  pic.twitter.com/8vwaobdzYg
2019-09-13 02:47:05,That grey Google search widget looks horrible compared to stock
2019-09-13 01:51:23,Is he getting what 64 million retweets a day  No he gets and others  Say 6000 a day with @YouTube @Google take down business websites modifying views  Shadow banning  You have problem in stock market ceos
2019-09-13 01:37:58,"Yeah, Lancers were a blast to drive, interiors were painfully outdated near the end though.  Google search says 286-hp stock, so it had to had some mods.. but at 450-hp that thing must have been a beast."
2019-09-13 01:04:27,"Want FREE stocks? Open an account in the next 24 hours and get a free stock. Receive another stock from companies like Apple, Starbucks or Google when you make your first deposit. Use my link to sign up now!  https://act.webull.com/promotion/invitation/share.html?inviteCode=LWvjYCSgfZ79 …"
2019-09-13 00:47:47,"Calamity Ayourb, your children will grow up to see this video and know how shallow you are as a father. How much are you paid to be foolish and become a laughing stock? Basic economics you are finding it hard to know. Please google the definition of VAT.  https://twitter.com/ose_anenih/status/1172264738472046592 …"
2019-09-13 00:34:36,Your article says Loves stock is down. And what even is this site. Not even legitimate. This is like a 6th page on google article
2019-09-13 00:21:27,Glad I don’t own any google stock!!
2019-09-13 00:00:14,Google  http://usdedtclock.org  those numbers move faster than the stock market 😳
