date,tweet
2019-06-30 19:56:26,"But in the stock app, Google has a better quiality image and is super crispy and very detailed. Also the iPhone smooths the face in a selfie and that's upon you. Hope you choose the best option for you. Both are excelent phones with downsides and advantages"
2019-06-30 19:28:58,"Yes, every layer had own agenda selling out election: power, money, religion, gov. contracts, tech. experiment, geo politics, oil, satelite control, stock market, business monopoly...Google ABC is a player, Amazon, Twitter (jack) etc"
2019-06-30 18:07:30,The best-performing tech stock of 2019 isn’t Google or Amazon – it’s a 113-year-old printer company  http://bit.ly/2NkRYUu 
2019-06-30 17:16:40," https://www.fedsdatacenter.com/federal-pay-rates/ … … for NON-CLASSIFIED workers! Also not #JeffBezos, 245,804 / 1,080.91 equals 227.404686792 in stock if all money is put instock for $GOOG (#GOOGLE)! $AMAZN is 28,836 / 1,893.63 for 15.227895629 in $AMZN stock. It's not worth it! FU #Amazon! #MacKenzeBezos"
2019-06-30 17:15:09,"LOL that ""Crazy in X"" country accounts trying to promote some dodgy online gambling site and using basically a stock image of fat stack money in an envelope that only takes like 2 seconds in a Google Image search to see if it's fake."
2019-06-30 16:52:00,That's why I have #Gmail! #ThankYou #Google! Your stock is a better buy $GOOG than $AMZN! You #Suck #Amazon.  You #JeffBezos never treated you wife #MackenzieBezos with respect.  #Amazon stock is #SH1T on cheap!  It's not worth it!
2019-06-30 16:40:36,"If an account looks suspicious I'll do a Google image search on the profile pic. If it's from a stock photo or a random pic of someone who clearly has nothing to do with the account, it's suspicious."
2019-06-30 16:40:02,"🤣🤣🤣🤣 Banning Huawei in the first place WAS the mistake.  US tech companies stock prices have been falling ever since, their revenues were also falling.  Intel, Google, Qualcomm and a few others were literally begging Trump to reverse it 😂  https://twitter.com/guardian/status/1145420286919159808 …"
2019-06-30 16:36:10,"Here is your chance to get in on the stock market like I did. +FREE Stock & trades.   **Top FREE Finance App in the Google Play/Apple Store**  Join Robinhood and we'll both get a stock like Apple, Ford, or Sprint for free. Make sure you use my link.  https://share.robinhood.com/casieb12 "
2019-06-30 15:18:04,"Dont you know. Recently he left the 405 Crore in Google Stock by saying a line ""I already getting paid Enough"". He don't know how to make a body but know how to run The World #Google . This is the simplicity of the Sunder Pichai Sir. Two Legends of INDIA together."
2019-06-30 15:16:35,Eher dennoch nicht. Alleine schon die Google Benachrichtigung darunter deutet schon auf Android mit Google Diensten hin (also kein Stock AOSP). Aber klar geht das auch per App auf einem iPhone
2019-06-30 15:08:18,You know that you're starting to hate Apple when you install a bunch of third-party/Google alternatives to their stock apps 😬
2019-06-30 15:05:41,"I screwed up the directions hardcore lmao. Right click, save burned hand image, go to google images, upload image to image search and you’ll get a bunch of the same hand which is a stock photo used for “air conditioning burns.” Noting, the photo is older than the “Antifa” issue."
2019-06-30 14:15:20,"Stock Google android eben nur noch bedingt und insgesamt viel zu teuer, Design finde ich einen erheblichen Rückschritt zum Nexus5x obwohl das eh Geschmackssache eines jeden selbst ist. Dazu dann noch der bekloppte Name Pixel, sozusagen als Krönchen obendrauf."
2019-06-30 13:52:59,Hahahaha a stock google photo !! LIARS !!!
2019-06-30 13:51:07,"This is Google stock footage of a chemical burn.  When they have to lie, they really have nothing left.  https://twitter.com/javier_pan01/status/1145147908662149120?s=21 …"
2019-06-30 13:15:34,[Request] A tweak to remove the stock photos in iMessage and/or replace it with google photos?  https://redd.it/c7fuki  pic.twitter.com/9sljhqXO4k
2019-06-30 12:13:16,25 Sites Where You Can Get Superb Free Stock Images  You always need free stock images for your blog or social media The days of using Google Image Search to find images to download is over. ... Free #publishing and #writing advice. http://rviv.ly/WCPiXm 
2019-06-30 11:41:37,"#Patriots need to dump Google Search immediately. Move to  http://duckduckgo.com  for your Searches. Their results are unbiased and, best of all, no tracking you around the Internet. I changed several years ago. I own no stock & do not work for them ...   https://spectator.org/the-google-fascists/ …"
2019-06-30 11:32:05,"▶ VK Sharma of HDFC Securities recommends a buy on Titan, BEML, Bajaj Finserv & RIL - CNBCTV18: VK Sharma of HDFC Securities recommends a buy on Titan, BEML, Bajaj Finserv & RIL  CNBCTV18 The latest analysis and commentary by stock market guru VK…  http://dlvr.it/R7YD2B  GOOGLE"
2019-06-30 10:03:35,"You calling into question my patriotism, over me laughing at your bullshit list is funny! Carrier, Ford and GM to name a few, then Hyundai  and the F35 make a complete laughing stock out of your google skills! You've been sold a dud, with that bloated bald git in the White House"
2019-06-30 09:41:26,"Brad naman, paano naging Chinese companies ang Google, Facebook, Amazon, Apple, Microsoft, at Twitter?   Nasa China ba CEO nila at ang stock exchange nila?   Yan ba turo sayo ni Duterte? 😂😂🤣"
2019-06-30 09:23:47,"Software engineers employed by such zombies face a choice. Stay in hope the company will take off, turning stock options into gold.  Or quit and take one of the plentiful jobs at other startups or giants like Atlasssian, Apple and Google."
2019-06-30 09:22:44,"OMG you got it!! Yeah I know, you need the Gcam port and it does a better job than stock in some situations. A famous Google Camera mod expert will be getting an OP7 Pro soon, so we should be getting a pretty good version soon. Right now they're all over the place"
2019-06-30 09:02:46,"Galaxies are honest terrible, their software on top of android is just bad and gets slow over time. If you want the best Android experience its best to go Google pixels stock android or Oneplus's OxygenOS these 2 are the best. Ive tried all types of androids and software matters"
2019-06-30 08:58:49,#Repost -ing yet another early Photoshop editing work of mine from my deviantArt account. . Featuring the stunning Misa Campo. . Stock photo found through the use of Google search engine. . . . #Photoshop #DigitalArt…  https://www.instagram.com/p/BzVbKkGB7OH/?igshid=p1kka7aie2ow …
2019-06-30 08:43:39,"In the US, dual-class and multiclass stock structures have been around for some time.  E.g., Google (Alphabet Inc) has three classes:  Alphabet Inc Class A shares (GOOGL) - one vote / share  Class C (GOOG) - no voting rights  Class B - 10 votes / share (not publicly traded)"
2019-06-30 08:23:23,Google Bacon Jam. Friends of mine  just released a bacon stock. Adelaide based.
2019-06-30 08:15:54,Curvy Google starts the apocalypse  1 am in milky way. Toni Hall  reporting for Stock Market station.
2019-06-30 08:15:33,"💥 FLASH 💥 ✅ Bombilla Wifi, ACCEWIT Bombilla LED inteligente RGB Multicolor 7W E27 Control de Voz, 650LM Smart Bombilla Funciona con Alexa Echo Google, para Casa D.  ❌ PVP: 38.99 EUR ♻ Precio reaco: Sin stock ⏰ Oferta FLASH: 19.99 EUR  💳  https://amzn.to/31Yq8Rf  📊 Evoluc"
2019-06-30 08:10:09,Wixgle on #Google:  https://posts.gle/bYgEa  #realsestate #success #successstories #realestatebusiness #nyc #california #luxury #estate #properties #sale #rent #tobuy #tinyhouses #house #mansions #buildings #united #states #habits #tofollow #stock
2019-06-30 05:58:20,Agency uses stock footage and wins cannes lion award.. Have they not heard of Google image search? Also stock is highly influenced by another artist.  https://twitter.com/Adweek/status/1143284670341234688 … pic.twitter.com/TEtetbrRCZ
2019-06-30 05:52:08,"Es geht um die Aussage überflüssig, in wie fern ist ein Google Pixel denn überflüssig? Stock google android, top Kamera, Cloud Speicher, langer software support und die schnellsten updates, schönes Design. Bis auf die Screen to body ratio sinds echt richtig gute Smartphones"
2019-06-30 05:17:16,"Also, swiping direction etc changes over time. I want the interaction to be the same after I hit share so I don't have to learn a new interaction in every app. I really hate the Google Photos share sheet as well as the Maps one. The need to go back to stock."
2019-06-30 04:13:02,"Yeah, it's a pirated stock image that the troll lifted from FB or Google images."
2019-06-30 03:02:27,Google Sheets for Stock and Portfolio Monitoring   http://www.stanleysuen.com/2018/03/google-sheets-for-stock-and-portfolio.html …
2019-06-30 02:21:28,"Ya want to know what will hit online sites the hardest? If you know anyone who has money in the Stock Market for Google, Facebook, or Twitter have the people sell. Remember, Money Talks and Bull Chit Walks."
2019-06-30 02:16:33,#Repost -ing my very amateur drawing on a whiteboard during free class (all of my students weren't present at the time) . Featuring the amazing Sasha Grey . Reference stock photo found through the use of Google…  https://www.instagram.com/p/BzUtHmYhhjA/?igshid=bf20qy4s06n0 …
2019-06-30 02:11:45,"My answer to If someone made a post on Reddit that caused 20,000 people to all Google the same Stock Price Chart ($YY) because the price was 69.69, would Yahoo Finance's SEO rank it at the top due to the artificial weekend traffic?  https://www.quora.com/If-someone-made-a-post-on-Reddit-that-caused-20-000-people-to-all-Google-the-same-Stock-Price-Chart-YY-because-the-price-was-69-69-would-Yahoo-Finances-SEO-rank-it-at-the-top-due-to-the-artificial-weekend-traffic/answer/Ashton-Ellsworth-1?ch=2&srid=uTKMu …"
2019-06-30 02:07:26,They should be officially endorsed by senior management for whatever they do regardless of how it impacts Google's profits and not only should their jobs be secure their salaries should be guaranteed even if their actions cause Google's stock to plummet.  I'm with you.
2019-06-30 01:45:58,Google Sheets for Stock and Portfolio Monitoring   http://www.stanleysuen.com/2018/03/google-sheets-for-stock-and-portfolio.html …
2019-06-30 01:45:51,"My answer to If someone made a post on Reddit that caused 20,000 people to all Google the same Stock Price Chart ($YY) because the price was 69.69, would Yahoo Finance's SEO rank it at the top due to the artificial weekend traffic?  https://www.quora.com/If-someone-made-a-post-on-Reddit-that-caused-20-000-people-to-all-Google-the-same-Stock-Price-Chart-YY-because-the-price-was-69-69-would-Yahoo-Finances-SEO-rank-it-at-the-top-due-to-the-artificial-weekend-traffic/answer/Ashton-Ellsworth-1?srid=uTKMu …"
2019-06-30 01:14:07,"stock 腕時計 - Google Search  https://ift.tt/2RO9oaG  Google 【楽天市場】Stock（腕時計）の通販  https://ift.tt/2vN4Ubl .  June 30, 2019 at 02:13PM"
2019-06-30 01:11:05,"As we all know Indians are most intelligent and smart thinkers. Google CEO is Indian, and other examples you already know from our ancient time. But In stock market you are trying to beat indian, Have you imagined that? so You need to be more smarter than an average smart indian."
2019-06-30 01:03:05,"9/7. I do NOT believe current crop of FB, TW, GOOGLE, YOUTUBE, et al CAN successfully be reigned in vis a vis their treason & squashing of conservative perspectives. TRASH them all & start over maybe with broad citizen ownership. i.e. distribute stock to all voters in last elect  https://twitter.com/HawleyMO/status/1143863088753577985 …"
