date,tweet
2019-06-07 18:37:51,Stock Android brings a ton of extra @Google bloatware instead. It's not better... Lol
2019-06-07 18:34:54,"I'm sorry to keep yelling about #AvengersEndgame but my Google alert just got me this quote:  “Black Widow sacrifices herself. Tony sacrifices himself. Steve, whose stock in trade is sacrificing himself, manages not to. It's a nice reversal there,” Markus said of the deaths."
2019-06-07 18:26:57,I bought stock in Google today. I only bought 1 share but I'm happy to be part of a company I love so much.
2019-06-07 18:11:23,Google hannity’s opinion on the stock market when Obama was pres and the market was high.
2019-06-07 17:48:06,Uber is the Walmart of transportation... the Enron of the stock market and the Google of customer service. Why would anyone have anything to do with Uber?
2019-06-07 16:54:50,"My smartphones were always Google Nexus phones for that stock android flavor. Until my 5X melted and they ended the line. I switched to OnePlus for my current phone, but the budget Pixel (like the 3a) is making me notice again. Maybe next year if they do like a Pixel 4a."
2019-06-07 16:43:51,"Oh yah, all of my stuff is custom made. I dont use any google stock images. All of my patterns, designs, colors, etc are all made by hand for each layout!"
2019-06-07 16:40:46,Reviewing these?   Wonder how stock-Androidable they are. Could at least set Google Launcher.
2019-06-07 16:37:32,"Assignment: Additional Question:  The attached excel file has monthly adjusted stock prices for Google and Standard & Poor's Composite Index (S&P 500, the market) from August 24, 2007 to July 2, 2012.  a. Calcula has been published on Adroit Writing -  https://adroitwriting.com/blog/additional-question-the-attached-excel-file-has-monthly-adjusted-stock-prices-for-google-and-standard-poors-composite-index-sp-500-the-market-from-august-24-2007-to-july-2-2012-a/ …"
2019-06-07 15:48:08,~ see Baidu stock price. see Google stock price.
2019-06-07 15:42:52,"Ma mère est du genre à bousiller un disque dur parce qu'elle possède plus de 25 000 000 de fichiers différente qu'elle stock dans des dossiers, sous dossier, de sous dossier, etc. Je viens de lui mettre un SSD de 120 Go et je lui ai expliqué comment se servir de Google drive"
2019-06-07 15:10:50,"If you have any good inside embrace your new country and people there. Work for their prosperity. Work for anybody there to reach healthcare services freely like in France, Germany and Turkey. Google’s mcap is many times higher than the entire mcap of Istanbul stock exchange."
2019-06-07 15:07:45,"Yo compré un Huawei hace unos 3 meses, ayer se descargaron varias actualizaciones d Google Play entre ellas faceb00k, recuerdo leí que Google continuaría c/equipos q ya están en stock ó fueron recién vendi2, respecto a FB Mark Zucks no se caracteriza x su disposición es medio wey"
2019-06-07 15:07:40,"Second, neither the Google Now Launcher nor the Google Pixel Launcher are compatible. There are lots of aftermarket launchers with similar look and feel, but I'd rather have the choice of a stock launcher.  Apart from that, everything continues to work very well."
2019-06-07 14:55:14,I thought they were good at things like algorithms and data? Maybe I should be shorting Google stock.  https://twitter.com/techreview/status/1136990048186802177 …
2019-06-07 14:39:59,Google openly shits on Trump's Huawei ban. Their stock is up over 2% today.  https://twitter.com/Reuters/status/1136865509071343617 …
2019-06-07 14:01:30,"@Chromagon: 'The #Stadia is another Google+, Google Glass, etc. stock holder gimmick, and it will most likely suffer the same fate. I feel like people are completely overlooking the actual logistics of operating this th…  pic.twitter.com/onRITOauXU, see more  http://tweetedtimes.com/v/1910?s=tnp "
2019-06-07 13:59:21,If you could go ahead and cite one I'm happy to take a look.   A quick Google search shows vox holding steady around 42million views a month over the last 6 months. It's stock has stayed reasonably healthy at around 80/85 dollars a share with one notable drop and a quick rebound
2019-06-07 13:52:46,"So question of the day to @YouTube @TeamYouTube @Google - with the stock market at a high , economic growth at a high and more people creating awesome content event the democratic asking for higher minimum wage. How about a pay raise to ad revenue 25% to content creators #standup"
2019-06-07 13:32:50,"Look up Mark Dice on the YouTube's search, then you'll get Mark Dice, but no longer a list of his on the results page, but you'll see a list of mockery against him, all brought to you by Google, owner of YouTube which are owned by Alphabet inc listed on US stock market. #WWG1WGA"
2019-06-07 12:48:11,"Kamera Google pixel, os stock Android, batre 10 jam, ram 8 giga, layar 120hz, rom 1 terra."
2019-06-07 12:44:34,CEO of Google is asking why his stock is up a couple days after fucking over Trump. He just can't believe it.
2019-06-07 12:32:43,"Yep, haha! I took some stock fire from google images and messed around with it on Photoshop. Wasn’t too hard to do actually."
2019-06-07 11:37:21,"Tech stock rally is fierce today. Microsoft back above $1 trillion market cap. Ironic that as investors worry about regulatory crackdown on Apple, Amazon, Facebook & Alphabet/Google, Microsoft seen as more immune to that threat. Been there, done that! $MSFT $AAPL $AMZN $FB $GOOGL"
2019-06-07 10:58:29,"Here, here. Exactly correct. Executives for companies like Google and Facebook are too busy trying to maximize their stock portfolio. They won't be prepared for 2020 either but will say they will do better in 2024. Same old, same old bullshit."
2019-06-07 10:43:03,"also i see you illustrators, who complain about stock illustrations becoming a thing but don't bat an eye at stock photography, or using whatever copyrighted images they found on google for reference/texture in their illustrations"
2019-06-07 10:26:52,I've had it for a while. Just Google S10 stock wallpapers
2019-06-07 10:12:25,Launch a fake anti-trust investigation and then follow it up by boosting their stock price.  I'm sure Google is terrified.  https://twitter.com/GinSecurities/status/1136999046248374280 …
2019-06-07 10:07:57,Google stock is also up 1% today after they banned his supporters a couple days ago.  What a coincidence!  https://twitter.com/GinSecurities/status/1136997940826910720 …
2019-06-07 09:35:03,“ vans classic “   sz : 37/38   🏷: 260ghc  📍GEO TAG : sneaker hub [ uber / google maps ]   📱: 0200371637   in stock and selling now   pick up from the store or have it delivered @ a fee  pic.twitter.com/7KT8Iwn4Ez
2019-06-07 09:03:14,""" Facebook, Amazon, Netflix and Google parent Alphabet — has lost nearly half a trillion dollars in market value since each stock's 52-week high. Alphabet has been the biggest loser, shedding $173 billion since April'  https://twitter.com/CNBC/status/1136980474881028097 …"
2019-06-07 09:01:04,"Hey @Google @GoogleUK, This is how @Argos_Online are selling your new Pixel 3A. Click and collect, asked for a different one an apparently no more in stock.  pic.twitter.com/Gem3jdrOOz"
2019-06-07 08:21:11,ATV vibes got me feeling some type of way this weekend !!   beach or nah ?!   either way or summer stock will be in soon   📍GEO TAG : sneaker hub [ uber / google maps ]   📱: 0200371637 @ UPSA  https://www.instagram.com/p/ByaIkrJJLcR/?igshid=k72fg99xy9jy …
2019-06-07 07:19:49,"The #Stadia is another Google+, Google Glass, etc. stock holder gimmick, and it will most likely suffer the same fate. I feel like people are completely overlooking the actual logistics of operating this thing.  pic.twitter.com/A21HBb2dyp"
2019-06-07 07:08:48,"Friday June 7 - Morning Brew:     Beyond's Stock Is Red Meat;       Don’t Judge a Buyout by Its Cover;      Cloudy With a Chance of Google;      Ajit Pai Wants to Clean Up Your ""Recents"" Tab     Via @MorningBrew  https://www.morningbrew.com/latest/archive/2019/06/07/red-meat/ …"
2019-06-07 06:45:09,"There is a new post. (FANG stocks- Facebook, Amazon, Netflix, and Google- portend risk for stock market) has been published on  http://Biedex.com  | Trading Ideas, Stocks, Commodities, Forex and Cryptocurrency, Market Analysis -  https://www.biedex.com/market-news/stock-markets/fang-stocks-facebook-amazon-netflix-and-google-portend-risk-for-stock-market/ …"
2019-06-07 06:39:41,Here is how little the biz model has to do with mj stock performance. Prices are correlated with google searches. Ps the biz model is fantastic as there’s ultra growth.  pic.twitter.com/KAinMPKJKY
2019-06-07 06:04:24,OnePlus 7 Pro Stock Camera vs Google Camera comparison  https://www.fonearena.com/blog/283766/oneplus-7-pro-stock-camera-vs-google-camera-comparison.html …
2019-06-07 06:00:53,"And if Bezos tried to sell his AMZN common stock for cash, what do they think would happen to AMZN common stock.   We don't have to imagine it.   What happened after that guy Sanjit Pichai sold several million dollars worth of Google stock?  It later took a shit on us."
2019-06-07 05:47:13,OnePlus 7 Pro Stock Camera vs Google Camera comparison  http://bit.ly/2MymJVi 
2019-06-07 05:44:19,OnePlus 7 Pro Stock Camera vs Google Camera comparison  https://2fa.in/2XxbKfQ  pic.twitter.com/STzNfY3Bnr
2019-06-07 05:42:09,OnePlus 7 Pro Stock Camera vs Google Camera comparison  http://bit.ly/2MymJVi  #tech
2019-06-07 05:03:59,"Google Pixel XL 32gb / 128gb ready stock ya. Bayar harini, esok terus dapat  https://twitter.com/NaufalAntezem/status/1136899623254028288 …"
2019-06-07 04:52:20,"Cause it has stock android, and google has to give the latest update asap cause nokia invest  majority of money to the software portion of their phone. But the company like realme, invest the majority of money to hardware portion so in terms of software their smart phone 🤢🤢🤢🤢"
2019-06-07 04:50:01,"""The threat of government action became more real, driving down their stock prices. The House Judiciary Committee announced a broad antitrust investigation into big tech.And the two top federal antitrust agencies agreed to divide oversight over Apple, Amazon, Facebook and Google""  https://twitter.com/FrankPasquale/status/1136614310950649856 …"
2019-06-07 04:45:29,"Thank you for your interest in Huawei. App upgrades can be supported Existing users including those have been sold or products still in stock will not be affected. Security patches can be upgraded as well, please refer to the Google statement for details."
2019-06-07 04:22:09,"Sukacita dmaklumkan tempahan sudah dibuka, READY STOCK :  Google Pixel 32 gb (RM 580 Google Pixel 128 gb (RM 680)   Google Pixel XL 32gb (RM 680) Google Pixel XL 128GB (RM 780)  Tempahan menerusi whatsapp : 01139253571 atau terus klik link whatsapp kami :  https://wa.me/601139253571  pic.twitter.com/tbC3EEExwK"
2019-06-07 04:13:36,I bought a GOOGLE Stock just to flex on em’
2019-06-07 03:59:51,Kalau Huawei dah boleh bekerjasama dgn Google balik tolong la pakai stock Android. EMUI is shet
2019-06-07 03:53:34,"2) @google does have a plan for replacing faulty devices, but has not informed their consumers about it 3) Google has been so inundated with faulty phones, they've not been able to keep up with the stock demand for faulty devices #GooglePixel3a"
2019-06-07 03:47:32,"What I find interesting is when you ask @google why they are sending me a refurbished device, they say ""the replacement devices are provided as refurbished that completely depends on the stock availability"" My phone was 7 months old. Can Google answer me why there is no stock?"
2019-06-07 03:39:23,Check out our new article: Looking for Royalty-Free Stock Images Without Watermark? [30+ websites list]  https://lttr.ai/Dg8l  #StockImages #Google #Watermark #Royaltyfree #OnlineTools pic.twitter.com/MMeWVvui7u
2019-06-07 03:27:35,"Conseil #3 : Utilisez au maximum les thèmes sombres.  Mettez Twitter en mode sombre, les apps Google (désolé Huawei 🤭), ou même votre système.  Sur MIUI, par exemple, vous pouvez installer le thème ""Stock[Black Mode]"" qui fait très bien l'affaire si vous n'avez pas le dark mode.  pic.twitter.com/0yzqY1kqfE"
2019-06-07 03:07:04,▶ Buy Sun Pharma; target of Rs 600: HDFC Securities -  http://Moneycontrol.com : Buy Sun Pharma; target of Rs 600: HDFC Securities   http://Moneycontrol.com  HDFC Securities is bullish on Sun Pharma has recommended buy rating on the stock with a…  http://dlvr.it/R69vGD  GOOGLE
2019-06-07 03:03:53,Google Sheets for Stock and Portfolio Monitoring   http://www.stanleysuen.com/2018/03/google-sheets-for-stock-and-portfolio.html …
2019-06-07 02:47:06,"Hello please find the unroll here: Thread by @tayooye: ""THREAD: Why you should NOT buy Google, Facebook, GE, Exxon, or MTN stock. Friends, colleagues, and family members often […]""  https://threadreaderapp.com/thread/1136591631505920000.html … Talk to you soon. 🤖"
2019-06-07 02:39:41,Google takes a controlling interest in Dell. Stock plummets.
2019-06-07 02:36:20,GOOGLE CLASS C STOCK TRADES IN A STEEP DOWNTREND  http://www.forexintel.net  . #forex #google #cfds #stocks #tradingonline #forexmarket #tradingsignals #forexsignals #investing #profit #money pic.twitter.com/BFPFY9BDiN
2019-06-07 01:43:24,Google Sheets for Stock and Portfolio Monitoring   http://www.stanleysuen.com/2018/03/google-sheets-for-stock-and-portfolio.html …
2019-06-07 01:20:42,"You have no idea what you are talking about. YT has a valuation close to $100 billion and is owned by Alphabet (Google). I would dump my stock in Goog immediately because I believe the YT issue will cause a massive decline in profits for Goog, because they rely on YT profits."
2019-06-07 01:19:54,"Keep in mind the business is a start up backed by Google Amazon and heavily funded by the same banks that funded Uber, the stocks when they went public were taking people from 10,000 in stock to 500,000-1 million worth of stock."
2019-06-07 00:37:34,"Although, I wouldn’t mind going back just a bit before 2004.  I’d have saved up all my minimum wage money and bought as much Google stock as I could.  What?  Five years of being broke and unemployed sucks."
2019-06-07 00:05:58,"Google is also a private company. I think you may be confusing the fact that it publicly buys and sells its stock as something other than just another private company. If it's not government owned, then it's privately owned. By 1 or 2, or 300,000! BUT it has rights! Go figger!"
