date,tweet
2019-03-16 19:53:24,"Mmmm... 🤤 Yes, please!  I switched a few years back from the Nexus 6P to a Galaxy S8; I'm ready to come back to stock Google."
2019-03-16 19:40:02,"▶ Jai Bala positive on RIL, HUL; expects Nifty to hit new high soon - CNBCTV18: Jai Bala positive on RIL, HUL; expects Nifty to hit new high soon  CNBCTV18 The Indian stock market has seen significant price action this week, and, with crossing…  http://dlvr.it/R0zFfh  GOOGLE"
2019-03-16 19:37:34,"sebagai andro user yang terpaksa hijrah ke ios, pertama kali yang kulakukan adalah uninstall:  garageband stock apple watch imaps dst  lalu install apps yg google based 🤣🤣"
2019-03-16 19:36:49,#JustStop  Don't you have anything better to do? Are you trying to manipulate Google's stock prices with your propaganda?
2019-03-16 19:36:29,"Please view this ad:  Learn to Trade the Stock Market,  https://lnkd.in/gVgdSRW   Download the application from the Google Play Store.   https://lnkd.in/dA4rQhv   https://lnkd.in/gKZKZ7h "
2019-03-16 19:18:00,"The US Government has apparently accused Google of working with the Chinese military.  Will the federal government be banning Google from its networks, as with Huawei? Will this have a devastating effect on GOOG stock?  …or is it “just Trump”?"
2019-03-16 19:11:00,Right! One is still a respected activist and the other is the laughing stock of the entire world! Smooth google.
2019-03-16 18:59:32,"Red, buy Yahoo, Microsoft, Apple, and Google stock when IPO'd. Billionaire time."
2019-03-16 18:50:34,"The largest tech company by market cap at the end of the 20th century was Microsoft. At the end of 2018 it was...Microsoft.  If u had topped up on that stock & ignored Web 2.0, 3.0, Google, Amazon and Facebook you would not have done too badly..."
2019-03-16 18:50:02,"Stock market! Get your stock market! Hot off the press with a killer referral program!  ***Top FREE Finance App in the Google Play/Apple Store***  Join Robinhood and we'll both get a stock like Apple, Ford, or Sprint for free. Make sure you use my link.  https://share.robinhood.com/casieb12 "
2019-03-16 18:48:42,Literally found this pic on Google image search and used MS Paint to slap some stock images on top lmao  pic.twitter.com/A2OVK6gSX1
2019-03-16 18:21:12,Sell your Google stock!!!
2019-03-16 18:08:52,J'ai regardé sur Google du coup il fait 79 kg Il est pas si stock que ça
2019-03-16 18:03:20,Google bought China's military? I'm confused.  Google bought Hillary Clinton? I'm confused even further.  Did Google stock drop because they didn't buy into Donnie's delusions?
2019-03-16 17:55:20,"That would actually be bad for you. Assuming that you work, your 401k/other retirement plan is invested, google is such a large company that if everyone who believed this tweet stopped using it, the stock market would crash and you would lose your life savings. #downwithDonald"
2019-03-16 17:51:26,"...to a device and checking for installed software, then you need to think again. Indeed, on stock Android, the Google Play store knows, and the Apple store knows, *every single app installed*, including VPNs."
2019-03-16 17:47:48,Daaaaang. I wouldn't wanna be anywhere near google stock rn.
2019-03-16 17:46:00,They way previously to get stock experience on a Samsung was the Google  experience launcher. Don't know if it still exists.
2019-03-16 17:35:32,Welp. I’ve got stock on Google so I’m just gonna go ahead and count my losses for the week.  https://twitter.com/realDonaldTrump/status/1107025689486737410 …
2019-03-16 17:30:39,"Domino’s stock has outperformed Google, Facebook, Apple, and Amazon this decade  https://qz.com/938620/  via @qz  Interesting. Really really interesting"
2019-03-16 17:23:59,"The Google corporation knows what to do, they're not fools by any means. Of they choose not to help you, it's cause they've somehow figured out your an idiot, and idiocy brings down the stock prices."
2019-03-16 17:13:41,"Bon par contre deux ""problèmes"":  - Je me dis que je vais pas tout acheter, qu'il faut que je fasse des choix et prennent en priorité celles qui me font le plus envie … Sauf que c'est exactement celles en rupture de stock xD - La traduction française est faite par google trad :o"
2019-03-16 16:36:04,Reason I can’t use the stock launcher is because I have grown accustomed to swiping left for my Google feed.
2019-03-16 15:38:03," https://www.youtube.com/watch?v=9iLUsSl5uR4 …  Are we overhyping Google's recent software additions, or are people failing to appreciate how far stock android has come.  #stockandroid #pureandroid #AndroidQ pic.twitter.com/1r4KNqVlzE"
2019-03-16 15:34:03,▶ New Vernon Capital Holdings Ii Stake in Hdfc Bank LTD (HDB) Decreased by $2.31 Million; Ringcentral (RNG) Shareholder Tudor Investment Et Al Has Cut Stake by $5.88 Million as Stock Value Rose - The FinHeadLines: New Vernon Capital Holdings Ii…  http://dlvr.it/R0yq7P  GOOGLE
2019-03-16 15:20:04,okay and ? i used a stock off google and erased the text from it and replaced it with my own?
2019-03-16 14:47:33,"Do yourself a favor and divest yourself of Google stock and use DuckDuckGo as your search engine. Google is “Spy Central of the World”. Stop using their apps, they collect and sell every scrap of data they can find on you."
2019-03-16 14:41:59,@GlamLifeGuru Google Express has both Fiona Stiles foundations. Specifically the seller Graceful beauty. So you can stock up while they have it! ❤❤❤
2019-03-16 14:40:06,Google photos are not stock photography! #thatcc #truth #googleit https://thatcc.com/ 
2019-03-16 14:36:02,▶ HDFC Bank Limited (NYSE:HDB) Stock Sees The Needle Move 7.69% - Olla Journal: HDFC Bank Limited (NYSE:HDB) Stock Sees The Needle Move 7.69%  Olla Journal HDFC Bank Limited (NYSE:HDB) closed at $111.98 after seeing 683712 shares trade hands…  http://dlvr.it/R0yhyy  GOOGLE
2019-03-16 14:01:44,"#Fundraising: For stock photos of galas don't google #blacktie; it's drawings of tuxedos. Google ""Arrogant white people"" or ""obnoxious white people"" & you get gala pics. Thus when your #gala is in your newsletter or the press, readers see it & think Arrogant White People. Try it."
2019-03-16 13:38:15,Stock oxygen rom( rooted n have google sans product font )
2019-03-16 13:28:23,Google Camera or stock?
2019-03-16 13:23:19,"Be careful with the FAANG stock phenomenom (Facebook, Apple, Amazon, Netflix, Google). They we're partially responsible for leading the stock market up, but can also be accounted for leading the market down. Specially Facebook and Apple with all the issues they've been having."
2019-03-16 13:15:58,The @lawnchairapp launcher is great. But I won't be replacing it with the stock oxygen os launcher. Lawnchair could use the app hide in app drawer and Google cards on the home page to attract more OnePlus users.
2019-03-16 13:12:19,"When you do a search in Google, if you choose relevance, you will more than likely get news about that company, if you choose by date, then all the stock news about that company piles in to the search results..."
2019-03-16 12:49:46,champion sweatpants   In stock and selling now   Ghc 160.00   Available and selling now   📱: 0200371637   Pick up from our store or have it delivered   📍GEO TAG : sneaker hub [ uber / google map ]  pic.twitter.com/s4FFUMqfyg
2019-03-16 12:33:06,"I know I probably do not want to ask, but how come every google search comes up with no stock or in the 100's. What did I miss?"
2019-03-16 12:33:02,"1RS. Hello Friends, I am Fortunate, I am Grateful and I want to Share: Have you not taken advantage of investments like Amazon, Google, Facebook or Apple before quoting on the Stock Exchange? Do not worry, ShopperClub is your new opportunity ...  https://www.shopperclub.net/gabrieljose21  llevo 7pts"
2019-03-16 12:13:48,Now back in stock! Bayonet or screw fit.. they also work with Alexa and Google Home .. visit website link in our bio. #wifiledbulbs #ledbulb #ledbulbs #alexa #googlehome #wifiled #wifi #led #googleplay #appstore #smartbulb #smartbulbs  http://www.ateball.co.uk  pic.twitter.com/Ij4t6q1lks
2019-03-16 11:30:35,"Η stock κάμερα του #GalaxyS10, δεν έχει ανταγωνισμό . Αλλά με το Google Camera App, γίνεται ακόμα καλύτερη.  https://busted.gr/i-google-camera-veltionei-aisthita-tin-stock-kamera-ton-galaxy-s10/ …"
2019-03-16 11:27:16,"Google ""bulbasaur 1:1 resin"" and see which website still has it stocked because it's out of stock from where I got it"
2019-03-16 10:27:21,Great talk w ⁦@tseides⁩ and Thomas Russo ... Google v Amazon ... Aperol spritzers ... and “the stock doesn’t know you own it” - ergo take emotions out of your investments!   https://itunes.apple.com/us/podcast/capital-allocators/id1223764016?mt=2&i=1000431526020 …
2019-03-16 10:14:01,If i had the chance then i would choose to be the CEO of Samsung. I would like to Merge ONE UI AND PURE STOCK ANDROID and make a SKIN LIKE OXYGEN OS... Collaborate with Google to provide Google camera and AI FEATURES TO ALL THE PHONES. EXTEND EXYNOS CHIPS TO THE MAX.
2019-03-16 09:40:29,"It provides an OS with no features, no customisation, no freedom and no innovation. And stock still comes preloaded with a ton of Google bloatware. HMD's phones are even worse as they can't be rooted. The Pixel experience is a bad experience. That's why the phones are a flop."
2019-03-16 09:10:21,"Tradingview only has price data from after the bankruptcy. When I saw it on Google, remembering trading around $1 in '08, and I saw 0.0034, I was like, wow down 99.66%, but then I saw the 2008 price was ~$1300. So that means stock sharks kept the management alive with dilution."
2019-03-16 08:29:52,"No Sajid! *You* need to stop inflaming community divisions with your #racist & #Islamophobic posturing in the context of #Brexit, your leader’s dismal #UK & #International ‘laughing-stock standing & your own political ambitions! It’s not Facebook’s fault! It’s #racists like you! pic.twitter.com/xNQnH4StDU"
2019-03-16 07:56:21,#Repost @risky6877 (get_repost) ・・・ Still on my favorite referrals  and one of the best things I've ever found them Google is getting this free stock…  https://www.instagram.com/risky687/p/BvEXwPkAD--6gui5xZYph_eJYl928BCW8EEAMo0/?utm_source=ig_twitter_share&igshid=tsp3ptp2hqcl …
2019-03-16 07:20:33,▶ Price Performance Review on Shares of HDFC Bank Limited (HDFCBANK.NS): Move 4.06% - Stock News Oracle: Price Performance Review on Shares of HDFC Bank Limited (HDFCBANK.NS): Move 4.06%  Stock News Oracle Taking a closer look at shares of HDFC…  http://dlvr.it/R0xljh  GOOGLE
2019-03-16 07:03:46,"Sanika Stock Market Consultancy & Training Center on #Google  https://search.google.com/local/posts?q=Sanika+Stock+Market+Consultancy+%26+Training+Center+RSC+Road+Number+51+B-5,+Plot+no.563,+Sector+5+Charkop,+Kandivali+West+Sai-Shradha+Society&ludocid=15007517021948509168#lkt=LocalPoiPosts&lpstate=pid:4212661359815673508&trex=m_t:lcl_akp,rc_f:nav,rc_ludocids:15007517021948509168 …"
2019-03-16 06:49:35,"Sanika Stock Market Consultancy & Training Center on #Google  https://search.google.com/local/posts?q=Sanika+Stock+Market+Consultancy+%26+Training+Center+RSC+Road+Number+51+B-5,+Plot+no.563,+Sector+5+Charkop,+Kandivali+West+Sai-Shradha+Society&ludocid=15007517021948509168#lkt=LocalPoiPosts&lpstate=pid:7014009461962347917&trex=m_t:lcl_akp,rc_f:nav,rc_ludocids:15007517021948509168 …"
2019-03-16 05:35:39,Will camera 2 API be enabled in android pie stable update at least ! You guys have provided such a good sensor and stock camera is not so good . Please give us the option to enable camera 2 API . With Google camera the phone is beast.
2019-03-16 05:23:22,buildings (Also home to Google Thailand). ●     You’ll not be just an employee but a co-entrepreneur with stock options. ●     You will get medical insurance and 22 vacation days.
2019-03-16 05:13:24,ALL FNO STOCK BUT SPOT PRICE OF CASH MARKET WITH BUY SELL SIGNAL IF ANYONE HELP TO GET LIVE DATA OF FNO IN GOOGLE SHEET THEN I CAN DO BETTER    https://docs.google.com/spreadsheets/d/e/2PACX-1vQOSobAvrh7t2NdfmP4UKEkIW-ZmAlw8awwRo2NB9usSpuUs2FzVndoCZCqRMXqcv2XizCafN0B-txT/pubhtml …
2019-03-16 04:22:07,bought a 6GB RAM MI A2 with stock android 8.1 and the keyboard lags like anything. Had been using redmi note 3 from 3 years without any issues. @Android @MiIndiaSupport @Google
2019-03-16 03:53:52,Is this a google stock image? You did not make those. Did you? 😳😍
2019-03-16 02:21:21,"Es gibt kein besseres Argument, als einen Stock. Kreuzworträtsel Deutsch kostenlos,Google Play App  https://play.google.com/store/apps/details?id=com.fgcos.crossword_de_kreuzwortratsel …"
2019-03-16 01:32:28,That's right. Let's play this game @Twitter @facebook @Google @YouTube @SanFranValley Have fun when da stock drops.  https://www.youtube.com/watch?v=rDgokTyrzMc … @Timcast @DonutOperator @Tracey_AIU @benshapiro @joerogan @CNN @scrowder https://www.youtube.com/watch?v=rDgokTyrzMc …
2019-03-16 01:02:01,Google Sheets for Stock and Portfolio Monitoring   http://www.stanleysuen.com/2018/03/google-sheets-for-stock-and-portfolio.html …
2019-03-16 00:35:39,Aquaman HD Mary Poppins 4K Mary Poppins Google Play HD Mary Poppins Movies Anywhere HD Spider Man Into the Spider Verse HD   All in stock now at  http://uvcodeshop.com 
2019-03-16 00:03:23,Why Google's $5 billion fine didn't move Alphabet stock  http://rss.cnn.com/~r/rss/cnn_freevideo/~3/_gK7EwEG9bQ/index.html?6JH0H … pic.twitter.com/mYae3ytzwz
