date,tweet
2019-04-19 19:57:54,3/ Frankly things are worse. The fad for dual-class stock to retain control for founding stockholders after going public insulates companies like Google from public shareholder control. /end $googl $goog https://jebkinnison.com/2017/08/14/the-monopoly-curse-bad-management-at-google/comment-page-1/ …
2019-04-19 19:00:49,"The year is 2075 and a million options for stock data exist, but someone, someone will complain about Google Finance not working as wanted.  pic.twitter.com/sfSxryA6Nj"
2019-04-19 18:57:27,"Is Google Stock A Buy Right Now? Here&#039;s What Earnings, Charts Show  http://bit.ly/2vcMZci "
2019-04-19 18:56:06,Google Pixel 3 XL. The display top middle notch is NOT an issue. Stock android everyday.  pic.twitter.com/fqIMS2qSWf
2019-04-19 18:51:37,Puedes instalar la camara del htc en el redmi o mi A2 la camara mejora a comparación de la stock en video si es mejor que la camara de google el procesado es similar  pic.twitter.com/mXYKOgR4th
2019-04-19 18:23:27,Stock & Stable on #Google  https://local.google.com/place?id=10546519931383663128&use=posts&lpsid=1108108116890710274 …
2019-04-19 18:13:51,"At FB, I've used the following: Samsung S3, Google Nexus 5, Galaxy S6 Edge, and now the Pixel 3. That seems like a healthy combination of trying out a stock experience (Nexus/Pixel), vs a popular variant (Galaxy)."
2019-04-19 17:56:29,"We're sorry the Red Wing Rover boots are out of stock on our site, Ross. We're not able to update google with the status of our items. Google will show that we have the item on our website but the link won't be taken away if the item is out of stock. (1/2)"
2019-04-19 17:32:06,Hey @asos whoever manages your Google Shopping needs to stop wasting money on out of stock products  pic.twitter.com/owJMMp3CiS
2019-04-19 16:58:41,step 2 is to google search company name and ticker to find out news  step 3 is to look at SEC filings  step 4 is to look up the stock on stocktwits and yahoo conversations and the $ticker on twitter
2019-04-19 16:53:34,And I immediately switch my default search engine as Google stock slides to sell nationwide.
2019-04-19 16:12:19,My stock in Google literally just quadrupled!!! Allah bless capitalism!!!
2019-04-19 16:06:00,A dress I really want is out of stock  Devin “why don’t you just google the part number and see if they sell it somewhere else”  Lol guys are funny
2019-04-19 15:59:43,"Hey bro, listen. I’m a dude. That avi? It’s some stock image I found on google. I’ve been dating Linda for a few months now and didn’t want my real identity out there"
2019-04-19 15:44:55,I own google stock so I turn all my ad blockers off so that I can make them some money.
2019-04-19 15:24:01,"Ticwatch PRO Smartwatch Wear OS by Google  Kupon: JSGEBAAA Cena: $ 209,99 (ok. 795,84 PLN) Limit: 50 Wysyłka z magazynu: ✅ [HK Stock] 👍😍  http://j.mp/2UZFkNl  #GeekBuying #TanioNaAli #vk pic.twitter.com/kzayD3xu9y"
2019-04-19 15:23:16,"Me: *looks up ""laptop stock image""*  Google images:  pic.twitter.com/fMPbXX8ARk"
2019-04-19 15:14:22,"If I recall correctly, it was a stock design from Google which I recolored to be white and adjusted to look like it was part of the original design."
2019-04-19 14:57:47,"!!! CUSTOM MADE SHIRTS !!!  • Boleh design ikut citarasa (google je design yg nak) • Quality really good, 100% cotton • Ready stock  • Various colors and sizes  • XS - XXXL • Heatpressed printing  • Design tahan lama  ✓ Short Sleeve RM30 ✓ Long Sleeve RM35  pic.twitter.com/HbylMYLHzz"
2019-04-19 14:57:30,"Is Google Stock A Buy Right Now? Here&#039;s What Earnings, Charts Show  http://bit.ly/2Pj4fpD "
2019-04-19 14:27:41,Update: $99 Moto G6 is currently out of stock on the Google Fi Store  https://9to5google.com/2019/04/17/google-fi-store-moto-lg/ … pic.twitter.com/EzpFklR8Ss
2019-04-19 14:17:29,"Hey 👋 At the moment we don't stock Google phones, If we did stock them in the future you can check out our website where they will be released. Lou"
2019-04-19 14:10:04,"Kemudian tersadar, sekarang HP Android resmi yg masuk Indonesia yg pake stock ROM dari Google cuma tinggal Xiaomi ya?"
2019-04-19 13:02:34,"Dadle like a la fotillo, os podeis logear con google y envia la primera foto de stock que salga la mia es esta."
2019-04-19 11:36:22,@SpotifyCares I qualified for my Free Google Home Mini two weeks ago when I signed up for a subscription. When I went to check out there were none in stock. Now I've lost the email with the redemption code. Help!
2019-04-19 11:35:04,"- streetviews from google maps bc it's easier than googling images of local houses. Google stock images of trees, clothing, grass and fill in the sketch so it looks believable enough when I blur it. Then I exported it and gave it to our compositor to render it in scene.  pic.twitter.com/oQnyoiHvF3"
2019-04-19 11:30:12,google sad stock photos now  pic.twitter.com/ASzk6njJAV
2019-04-19 11:04:47,Stock Market Technical Analysis Course - Nse Bse Invest Growth on Google  https://local.google.com/place?id=17146232387573220915&use=posts&lpsid=7226121254943570789 …
2019-04-19 10:59:03,"1RS. Hello Friends, I am Fortunate, I am Grateful and I want to Share: Have you not taken advantage of investments like Amazon, Google, Facebook or Apple before quoting on the Stock Exchange? Do not worry, ShopperClub is your new opportunity ...  https://www.shopperclub.net/fx05fer  llevo 7pts"
2019-04-19 10:52:08,I spent a solid 5 minutes trying to figure out why my Google Spreadsheet wouldn't update stock prices today. :-(
2019-04-19 10:11:28,Une Google Home Mini offerte pour tous les possesseurs d'un compte Spotify Famille jusqu'au 14 mai 2019. (Il y a de nouveau du stock !)  🥳🥳🥳  https://outhman.fr/2019/03/google-home-gratuit-spotify-famille/ …
2019-04-19 09:04:52,"$TTCM i may post percentages,gains and losses throughout the day on this stock. But make no doubt about it i’m long on this stock. #AR #Apple #Google #iOS #Android #TechNews #future Arks will be a game changer for #socialmedia"
2019-04-19 06:33:41,Tesla selling cars Waymo selling stock. Google selling Adverts. Repeat Tesla selling Cars #EV...
2019-04-19 05:52:34,Xiaomi Redmi Note 7 Stock Camera vs Google Camera comparison  http://bit.ly/2ZpSv9J  pic.twitter.com/YjbcHOVZkM
2019-04-19 03:56:15,"Adonis had to travel on a Pacer because he let the franchise that prevented any new stock being introduced or any other improvements than had already been signed off. I suggest you do a Google search for Class 195 and Class 331 trains, then you won't be a clueless idiot!"
2019-04-19 03:25:18,Google Camera vs Stock Camera Samsung Galaxy s7 Edge | Note Fe  http://phoneheadline.com/2019/04/19/google-camera-vs-stock-camera-samsung-galaxy-s7-edge-note-fe/ … Google Camera vs Stock Camera Samsung Galaxy s7 Edge | Note Fe. Google Camera vs Samsung Camera For Samsung S7 Edge Di Vidio kali ini...  pic.twitter.com/GiPmicqzZ4
2019-04-19 03:09:15,Read about Liquid Bees in google/youtube. It is a ETF/Stock that give fixed returns like savings account. Your can buy LiquidBeeS ETF like a stock in your trading account & then pledge it to get Margin for trading. You can Trade + will get ~7% extra per year
2019-04-19 03:02:42,"RT StanfordGSB ""For many entrepreneurs, it is a dream on par with finding the Holy Grail: an initial public stock offering that can turn a startup into the next Google and a founder into a mega-millionaire.   Yet, for all that money and drama, do IPO…  https://www.gsb.stanford.edu/insights/are-ipos-good-innovation …"""
2019-04-19 02:38:33,▶ Buy Laurus Labs; target of Rs 535: HDFC Securities -  http://Moneycontrol.com : Buy Laurus Labs; target of Rs 535: HDFC Securities   http://Moneycontrol.com  HDFC Securities is bullish on Laurus Labs has recommended buy rating on the stock with a…  http://dlvr.it/R36KBm  GOOGLE
2019-04-19 01:55:40,"🅾 Enchufe Inteligente Wifi, Slitinto Inalámbrico Smart Mini Monitor de Energía del Zócalo del Interruptor Compatible con Alexa/Google Asistente/IFTTT, n.  ❌ Antes: 99.99 EUR ♻ Reacondicionado: Sin stock 🔥 Precio oferta: 25.99 EUR 💥 🎟 CUPÓN: FRGD2FPL  🔰"
2019-04-19 01:21:00,Google Sheets for Stock and Portfolio Monitoring   http://www.stanleysuen.com/2018/03/google-sheets-for-stock-and-portfolio.html …
2019-04-19 01:12:02,"Top 5 Dividend Yield Stocks in Singapore (2019): So I was looking around for great Singapore dividend stocks to put my SRS funds in the past week. And I must say, when you google “Top Dividend Yield Stock Singapore” or “Best Dividend Yield Stocks…  http://dlvr.it/R368xj  pic.twitter.com/0o4vdiLwiN"
2019-04-19 00:32:02,Xiaomi Redmi Note 7 Stock Camera vs Google Camera comparison  https://2fa.in/2XvOTRL  pic.twitter.com/jsu8xV85ba
2019-04-19 00:31:05,Xiaomi Redmi Note 7 Stock Camera vs Google Camera comparison  http://bit.ly/2IvbHNJ 
2019-04-19 00:26:14,Xiaomi Redmi Note 7 Stock Camera vs Google Camera comparison  http://bit.ly/2IvbHNJ  #tech
2019-04-19 00:09:54,"This is similar to the situation on the open source mobile OS Android today, where the downstream OEM can very effectively create their own design language, branding, and UI for all of the stock apps. But you don't get Google Maps or Twitter on Samsung phones looking like One UI."
