date,tweet
2019-02-15 18:21:33,▶ First Trust Bank LTD Holding in Hdfc Bank LTD (HDB) Has Raised as Stock Value Declined; Interactive Financial Advisors Has Boosted Its Position in  http://Amazon.Com  (AMZN) as Valuation Declined - Port Courier: First Trust Bank LTD Holding…  http://dlvr.it/Qz0Zmk  GOOGLE
2019-02-15 17:32:53,"mgm resorts stock price - Google Search  https://www.google.com/search?source=hp&ei=qz1nXPijAbC50PEPgsea0A8&q=mgm+resorts+stock+price&oq=mgm+resorts&gs_l=mobile-gws-wiz-hp.1.0.35i39l2j0l3.1597.11324..12856...7.0..5.1232.9550.0j7j4j2j3j0j1j4......0....1.......5..0i131j46j46i275.iO_-1_ioluo … - President Sisi, start here.  Start buying.  Call, Sylvester Stallone.  Ask him, why isn't..."
2019-02-15 17:09:47,Google Stock: Cloud Computing Business Eyeing Software Makers? -  #IT
2019-02-15 17:05:02,▶ Ruths Hospitality Group (RUTH) Holding Has Boosted by Cadence Capital Management Llc; Johnston Asset Management Trimmed Holding in Hdfc Bank LTD (HDB) by $73.43 Million as Stock Value Declined - The Hi New Ulm: Ruths Hospitality Group (RUTH)…  http://dlvr.it/Qz0NQL  GOOGLE
2019-02-15 17:03:34,"I sent a friend/teacher a email! Email is about Alphabet Inc.(""Google"") - Class A stock is dropping! Body says Alphabet Inc.(""Google"") - Class A (GOOGL) price at close, 2019-02-15, is 1118.88. from  https://finance.yahoo.com/q?s=GOOGL  via IFTTT"
2019-02-15 17:00:22,"Tallery Gallery apps and integration coming soon. Access all your brand and stock images right into your WordPress, Google App and MSoffice account. -  https://tallery.gallery   Retweet * Like * Reply  #Bloggers #ContentMarketing #WordPress #GoogleAddons #ContentWriters pic.twitter.com/cLqb7pFQQ2"
2019-02-15 17:00:22,"In Stock! Sonoff PIR PIR2 Wireless Dual Infrared detector Motion Sensor smart Home Smart Security Alarm System for Alexa Google Home NGN 5,115.00 Click here to order now...  https://pooo.st/I3OSo   Contact: +2348149980966. Website:  http://www.basmall.com.ng  #africa #nigeria pic.twitter.com/177NuXQzDk"
2019-02-15 16:57:32,google-this-is-bogus-as-hell-one-of-the-fathers-of-the-internet-blasts-google-for-how-chromecast-behaves-on-his-home-network   https://ideasjungle.com/google-this-is-bogus-as-hell-one-of-the-fathers-of-the-internet-blasts-google-for-how-chromecast-behaves-on-his-home-network/ … #ideas #business #news #stock
2019-02-15 16:47:52,WE 👏🏻 NEED 👏🏻 A 👏🏻 STOCK 👏🏻 CAR 👏🏻 EMOJI 👏🏻  CC: @Emojipedia 🎧 LISTEN TO THE FULL #DJD Web:  http://bit.ly/2H17XzJ    iTunes:  https://apple.co/2Fkf9Wd  Google:  http://bit.ly/2Hw7l8d  pic.twitter.com/73CFv262Af
2019-02-15 16:13:52,25 Sites Where You Can Get Superb Free Stock Images  You always need free stock images for your blog or social media sites The days of using Google Image Search to find images to download is ... Free #publishing and #writing advice. http://rviv.ly/WCPiXm 
2019-02-15 16:11:41,71-presidents-day-tech-deals-that-are-worth-your-time-from-google-amazon-apple-and-more   https://ideasjungle.com/71-presidents-day-tech-deals-that-are-worth-your-time-from-google-amazon-apple-and-more/ … #ideas #business #news #stock
2019-02-15 14:33:33,"▶ Schlumberger LTD (SLB) Stock Price Declined While Glenview State Bank Trust Boosted Stake by $602,700; Hdfc Bank LTD Ads Each Repr 3 Inr10(Mgt) (HDB) Share Value Declined While Gilder Gagnon Howe & Co Has Lifted Stake by $1.94 Million - The…  http://dlvr.it/Qyzwy9  GOOGLE"
2019-02-15 14:32:10,"I hear the original Google cafeteria workers got rich on stock, but that doesn’t help current Silicon Valley cafeteria workers who don’t get those same benefits and can’t afford thousands of dollars for a studio apartment. Public policy shouldn’t be structured around outliers."
2019-02-15 14:28:00,They took these stock images from Google and put them together and they pat themselves on the back afterwards...
2019-02-15 13:46:01,"1RS. Hello Friends, I am Fortunate, I am Grateful and I want to Share: Have you not taken advantage of investments like Amazon, Google, Facebook or Apple before quoting on the Stock Exchange? Do not worry, ShopperClub is your new opportunity ...  https://www.shopperclub.net/woodoochile  llevo 4pts"
2019-02-15 13:35:03,"▶ Don't Miss This Stock: Devon Energy Corporation (DVN), HDFC Bank Limited (HDB) - News Stays On Track: Don't Miss This Stock: Devon Energy Corporation (DVN), HDFC Bank Limited (HDB)  News Stays On Track Devon Energy Corporation (DVN) Daily…  http://dlvr.it/QyzkxP  GOOGLE"
2019-02-15 13:30:27,"Tallery Gallery apps and integration coming soon. Access all your brand and stock images right into your WordPress, Google App and MSoffice account. -  https://tallery.gallery   Retweet * Like * Reply  #Bloggers #ContentMarketing #WordPress #GoogleAddons #ContentWriters pic.twitter.com/kxm09VV4Rg"
2019-02-15 13:29:06,Posting a stock image from Google won't make it yours! FAKE DOCTOR. Man up  pic.twitter.com/arObPKOzss
2019-02-15 13:15:16,I found the image on google years ago and just got it printed to stock on my wall haha
2019-02-15 12:55:56,XD “generic white men stock photos” google search came back with similar results.  https://twitter.com/sadydoyle/status/1095901607663992838 …
2019-02-15 12:53:12,"Okay, ich finde die Helligkeitsanzeige wirklich gelungen. @Google könnte das für Stock @Android Geräte wie bsplw. @madebygoogle übernehmen und etwas anpassen (%-Symbol hinzufügen). 👍 cc: @davey_burke @lockheimer 🥰 https://twitter.com/SmartDroidDE/status/1096298567675899904 …"
2019-02-15 12:38:47,"Not name calling, im 40 if you're that much older than me you might know how to use google! I watched the GOP asked the CEO how to use google, thought you might be in the same boat? Either way, you missed my point, white rich americans make the USA a laughing stock!"
2019-02-15 12:28:04,I know. The past is always so much more complicated than we are taught. Ok here's one! I would buy stock in Google and in Apple as soon as they went public! 😂
2019-02-15 12:00:37,"Tallery Gallery apps and integration coming soon. Access all your brand and stock images right into your WordPress, Google App and MSoffice account. -  https://tallery.gallery   Retweet * Like * Reply  #Bloggers #ContentMarketing #WordPress #GoogleAddons #ContentWriters pic.twitter.com/cpYT5EpfPq"
2019-02-15 11:19:35,this honestly looks like some stock image from google who did this we need to talk  pic.twitter.com/n3LykLOfNy
2019-02-15 10:54:26,@jaimani @IndiaPOCO need night sight like Google camera..stock camera night sight vs gcam night sight. Thanks to BSG for port  pic.twitter.com/c2MKKqadeg
2019-02-15 10:48:30,"This is a weird posting. Photo is a stock image from  https://images.pexels.com/photos/1802856/pexels-photo-1802856.jpeg …. Steffany Brown (unique name, different pic) became a Developer Programs Engineer at Google after completing tuition-free developer training at ADA Developers Academy @adaacademy and a paid internship."
2019-02-15 10:42:48,Google camera me stock camera se achhe photo nhi aayenge
2019-02-15 10:02:42,Tried to capture that je ne sais quoi...but came out funky instead...#funky3s 📸 cred: Google search-free stock imgs . . . . . #funky3s #Adobedraw #adobedrawing #adobedrawapp…  https://www.instagram.com/p/Bt6CBwKFT5e/?utm_source=ig_twitter_share&igshid=9f4l5myalplr …
2019-02-15 09:28:12,$FTEG has great news this morning  https://www.otcmarkets.com/stock/FTEG/news/For-The-Earth-Corporation-has-Completed-the-Acquisition-with-Vliso-AI-CHOW-Vending-Machine-Division?id=218619 … #cbd #hemp #Cannabis #products #brokers #stockmarket #stock #stockstowatch #shortsqueeze #Investor #Reuters #bloomberg #thestreet #forbes #nytimes #cnn #ihub #google
2019-02-15 09:12:59,Here goes a good book on the subject: technical Analysis and stock market profits by Richard Schabacker. $500 on Amazon or free on pdf if you google it
2019-02-15 08:49:29,a-former-google-exec-who-asks-job-candidates-about-the-chapters-of-their-life-story-is-listening-closely-for-a-common-red-flag   https://ideasjungle.com/a-former-google-exec-who-asks-job-candidates-about-the-chapters-of-their-life-story-is-listening-closely-for-a-common-red-flag/ … #ideas #business #news #stock
2019-02-15 08:34:44,And to put to bed your factless argument about expansion.  They ALL DID STOCK BUY BACKS!!!  GOOGLE'S FUCKING FREE!  TRY IT!
2019-02-15 08:00:41,Here's what's happening to stocks today (02/15): $XPO: @SprucePointCap Win $CGC: Cult Stock Earnings $APHA: Redeems Itself $TRUE: Monthly Users ⬇️ $ACOR: No More Guidance $OSTK: Deal Rumor $MRIN: Nice Run-up on Google Deal $FUV: The Tesla of Oregon - follow to watch the full show
2019-02-15 07:45:59,Google Image search for 'paleontologist stock photo' - you won't be disappointed ;)
2019-02-15 07:14:44,"I guess u r a noob user or zero knowledge about apps. Mi phone has ads but not in the core apps.   I always use stock google aps, like phone, contact, Pixel launcher etc.  Use Gaana/SonyLiv etc instead of mi Music and video they cant provide paid content without adv."
2019-02-15 05:56:54,"A Basing Growth Stock, And Google Cloud Computing -  #cloud"
2019-02-15 05:40:28,"Dow futures sharply lower after weak data - CNBC  Dow futures sharply lower after weak data  CNBC  U.S. stock futures lower as investors fret over economy, politics  MarketWatch  View full coverage on Google News   https://www.cnbc.com/2019/02/15/stocks-trump-speech-us-china-trade-and-earnings-in-focus.html …"
2019-02-15 03:39:27,Google Stock: Cloud Computing Business Eyeing Software Makers? -  #cloud_computing #cloud_computing
2019-02-15 03:28:25,As I said I actually have a life outside of twitter and guess what I have have normal friends also and no some jumped up wannabe that thinks she's actually going to make a difference not many give an actually fuck about what she says she's a laughing stock
2019-02-15 03:21:54,"If you're on #MIUI & love using the Stock SMS app, NEVER install & try Google's Message app. It edits out all the sender names for Service SMS & then the MIUI Yellow Pages feature on Messaging app stops working! You can't go back! Learnt it the hard way! 😥 @MIUI_India @miuirom"
2019-02-15 03:13:03,"▶ HDFC Bank Ltd. | stock & share price update with analysis | 2019-02-15 - Outlook India: HDFC Bank Ltd. | stock & share price update with analysis | 2019-02-15  Outlook India With an opening price of Rs. 2107.35 , HDFC Bank Ltd. started the day…  http://dlvr.it/QyxhlC  GOOGLE"
2019-02-15 01:38:02,Google Sheets for Stock and Portfolio Monitoring   http://www.stanleysuen.com/2018/03/google-sheets-for-stock-and-portfolio.html …
2019-02-15 00:00:20,Buy Netflix (NFLX) Stock on the Dip While You Still Can?  http://twib.in/l/zKE75MpMAbyx  via @al3atri #OneDirectionBestFans-RihannaBestFans-harrybestfans-FavBreakoutArtistHarryStyles-OneDirectionBestFans-#FelizMartes #Google
