date,tweet
2019-08-08 19:56:12,Roku (ROKU) Stock Soars Over 20% After Q2 Earnings: What's Next?  http://twib.in/l/nXp7dRdK6r65  via @al3atri #Google #phone
2019-08-08 19:27:47,"Tech stock returns since the bull market began in 2009:  Netflix:        +5,643% Amazon:     +2,930% Expedia:     +2,300% Nvidia:        +1,966% Apple:         +1,856% Salesforce: +1,762% Adobe:        +1,674% Microsoft:   +1,075% eBay:             +862% Google:         +729%"
2019-08-08 19:22:52,Buy GOOGLE stock when it was ten bucks a share....
2019-08-08 19:12:01,"Investor's Business Daily: AMD Stock Rockets As Google, Twitter Adopt Its New Data-Center Chips.  https://buff.ly/2KF41qS "
2019-08-08 18:25:38,Smart Plug Compatible with Alexa and Google Assistant $5.99 after code 50EYWIBN  https://amzn.to/31rkq98  *Prices and stock are subject to change at any time. Codes can expire at anytime. #ad
2019-08-08 18:10:08,"Investment club is considering a new stock to invest in. Do you have a favorite not named Apple, Facebk,Netflix,Amazon,Google?"
2019-08-08 17:59:46,"New post (AMD Stock Rockets As Google, Twitter Adopt Its New Data-Center Chips - Investor's Business Daily) has been published on Making Passive Income 2019 -  https://newsprofixpro.com/makingpassiveincome2019/2019/08/08/amd-stock-rockets-as-google-twitter-adopt-its-new-data-center-chips-investors-business-daily/ …"
2019-08-08 17:49:24,"AMD Scores Twitter And Google As EPYC Customers, Stock Up 15%  https://wccftech.com/amd-scores-twitter-and-google-as-epyc-customers-shares-up-15/ …"
2019-08-08 16:43:33,A Huawei Flop Is Fuel for Google Stock (Mike Stenger/Money Morning)  http://dlvr.it/R9w1Dk 
2019-08-08 16:21:22,Stock market had a major comeback today. Our leading stock gains came from Amazon $AMZN and Google $GOOGL. Each stock had over a $30+ gain in share price.
2019-08-08 15:49:46,Cuando publicistas una licenciatura en finanzas y pones de fondo el dashboard de Google Analytics (analítica de sitios web) al parecer no les alcanzó para una imagen premium de stock o al diseñador le dio flojera conocer los software de finanzas.  pic.twitter.com/F1i2dsbJPi
2019-08-08 15:44:30,Buy stock in Microsoft google apple amazon and and stop picking your nose and wiping in on your brothers bed #5YearOldSelfie pic.twitter.com/hsmBN8D973
2019-08-08 15:42:43,"I'm hoping I never have to explain why ""goat skull stock photo"" is in my google history, but if anyone asks, it's @Hydra_Lord's fault."
2019-08-08 14:37:19,"Day 8: Apocalypse ""Whoops""  Explosion was not made by me, I just found it on a stock page in  Google Images.  #OutfitAugust #OutfitAugust2019 #Eespurr pic.twitter.com/1kZdgTeZuQ"
2019-08-08 14:14:06,"AMD Scores Twitter And Google As EPYC Customers, Stock Up 15%  https://wccftech.com/amd-scores-twitter-and-google-as-epyc-customers-shares-up-15/ …"
2019-08-08 14:08:35,"AMD Scores Twitter And Google As EPYC Customers, Stock Up 15%  https://wccftech.com/amd-scores-twitter-and-google-as-epyc-customers-shares-up-15/ …"
2019-08-08 14:05:32,"IAM Platform Curated Tweet:  AMD Stock Rockets As Google, Twitter Adopt Its New Data-Center Chips – Investor’s Business Daily    https://blog.iammarketingmedia.com/amd-stock-rockets-as-google-twitter-adopt-its-new-data-center-chips-investors-business-daily/?utm_campaign=financial-technology&utm_medium=twitter&utm_source=twitter … #TopInfluence #banking #Finance #FinancialTechnology #money"
2019-08-08 13:53:13,"I feel like Stock Android has definitely losts it way. I’m not sure what Google is trying to aim for these days. Then again, maybe it’ll be fixed in the official release? (Not holding my breath)"
2019-08-08 13:50:43,"#AMD Stock Rockets As Google, Twitter Adopt Its New Data-Center Chips - Investor's Business Daily  https://www.investors.com/news/technology/amd-stock-rockets-as-google-twitter-adopt-its-new-data-center-chips/ …"
2019-08-08 13:27:09,IAM Platform Curated Tweet:  AMD Stock Rising on the Back Of Deals with Google and Twitter – Market Realist    https://blog.iammarketingmedia.com/amd-stock-rising-on-the-back-of-deals-with-google-and-twitter-market-realist/?utm_campaign=technology-movers-shakers&utm_medium=twitter&utm_source=twitter … #TopInfluence #CEO #Facebook #LinkedIn #Perescope
2019-08-08 13:23:50,"#AMD Scores #EPYC Win Capturing Google And Twitter With Zen 2 Server CPUs, Stock Soars 15%  https://hothardware.com/news/amd-epyc-win-google-twitter-zen-2-server-cpus#AAJCqQpRucDOFijQ.02 … via @HotHardware"
2019-08-08 13:10:51,"AMD Scores Twitter And Google As EPYC Customers, Stock Up 15%  https://wccftech.com/amd-scores-twitter-and-google-as-epyc-customers-shares-up-15/ …"
2019-08-08 13:00:11,"AMD Scores Twitter And Google As EPYC Customers, Stock Up 15%  http://dlvr.it/R9vS0j  pic.twitter.com/AOvoLfx230"
2019-08-08 12:57:12,"How is @DuckDuckGo different from searching with @Google? Try “vintage graphics” on both. Google delivers a bunch of retro, fake vintage templates and stock art. #DuckDuckGo returns authentic vintage graphics. Interesting. #SearchEngine pic.twitter.com/i1eqdm4MQI"
2019-08-08 12:55:28,RT stock_family: SquadGuy2 I need you to understand something what is BS google Samsung Sony Microsoft Twitter Amazon all working with them you sound ridiculous 🛑Dump #Robinhood for #stockoptions:  http://bit.ly/tastyworks4you  🛑 #options #stockmarket #day…  https://ift.tt/2YeDeY5 
2019-08-08 12:53:55,"AMD Stock Rockets As Google, Twitter Adopt Its New Data-Center Chips | Investor's Business Daily  https://www.investors.com/news/technology/amd-stock-rockets-as-google-twitter-adopt-its-new-data-center-chips/ …"
2019-08-08 12:52:51,"Oh yeah shoulda held longer but I re entered in another position! Also have a few amd stock, seeing great results out of them today. They announced news with their new server chips, and Google being a new customer of theirs... great future potential with that company."
2019-08-08 12:51:54,"AMD Stock Rockets As Google, Twitter Adopt Its New Data-Center Chips  https://finance.yahoo.com/m/c1c57d5a-16cc-31d2-ad5e-48c9174056d5/amd-stock-rockets-as-google%2C.html?soc_src=strm&soc_trk=tw … via @YahooFinance"
2019-08-08 12:45:12,"AMD Stock Rockets As Google, Twitter Adopt Its New Data-Center Chips  https://www.investors.com/news/technology/amd-stock-rockets-as-google-twitter-adopt-its-new-data-center-chips/ … $AMD pic.twitter.com/YK0gp8cBlY"
2019-08-08 12:14:42,"What are you going to do about it? Talk/Tweet?  Maybe you should assault the second amendment. That seems to be the only thing you actually do.   Donald (Bump Stock Owners are Felons) Trump Donald (Take the guns first, go through due process second) Trump"
2019-08-08 11:59:28,A fine won't scare or stop them. Congress & DOJ won't levy a fine big enough to bring change. FB's stock went UP when they were _only_ fined $5B for Cambridge. The fines are seen as a cost of doing biz & co's like Google & FB can pay MM to lawyers to negotiate fines down  https://twitter.com/randfish/status/1159177176907804672 …
2019-08-08 11:46:03,Ever wonder why most investors under-perform the stock market averages? Lauren Templeton explains how getting to know our brain can help us make better decisions.   Watch the video and read the full transcript of her 2017 Google Talk here:   https://geoinvesting.com/investing-templeton-way-transcript/ …
2019-08-08 11:36:32,"Xiaomi Mi A3 64Gb Disponible, en stock.  Características:  El Xiaomi Mi A3 es la tercera generación de la serie A con la misma filosofía que sus predecesores: actualizaciones directas de Google gracias al programa…  https://www.instagram.com/p/B06INw3gtaf/?igshid=uhazns7v00ww …"
2019-08-08 11:32:19,"Go buy a boat load of Google stock and become an activist investoror failing that think of YouTube as a club and as a member you must abide by their rules, the club house is in fact their servers and data centers. If you don’t abide by the rules your membership is revoked"
2019-08-08 11:27:32,vans old school classic   sz : 38   🏷 Ghc 240.00   in stock and selling now   📍GEO TAG : sneaker hub [ uber / google maps ]   📱: 0200371637   ~locate our shop on the main upsa road close to maxxis…  https://www.instagram.com/p/B06HLwOpAJG/?igshid=1tw8znctbnhq4 …
2019-08-08 11:15:16,Does investing it count as spending? I’d buy a bunch of Apple and Google stock
2019-08-08 11:02:22,"Here is your chance to get in on the stock market like I did. +FREE Stock & trades.   **Top FREE Finance App in the Google Play/Apple Store**  Join Robinhood and we'll both get a stock like Apple, Ford, or Sprint for free. Make sure you use my link.  https://share.robinhood.com/casieb12 "
2019-08-08 10:49:42,"What QSR stock has outperformed Google, Netflix, Amazon, Apple and Facebook (FAANG stocks) 2010-2018?  Hint: it’s not Tim Horton’s or Starbucks"
2019-08-08 10:37:34,AMD Stock Rose Due to Deals with Google and Twitter (Neha Gupta/Market Realist)  http://dlvr.it/R9tzmX 
2019-08-08 10:11:54,Saw an ad on Crunchyroll yesterday that was the ad equivalent of a stock photo. It was incredible. It was for some app for housing loans.  Also there's an ad for Google Fi that uses Umbrella Corporation clips and it was the dumbest thing I've ever seen.
2019-08-08 09:54:59,"Oi, celebrity worship's a hell of a drug. He was a stock 90's Bad Boy whose behavior stagnated. What I listed is no secret. BUT: [Depp = violent] =/= [Heard =/= violent]. I'm not wasting more time so here are my sources, then I'm done. There are  many more and Google exists 1/3  pic.twitter.com/95JviZIP0N"
2019-08-08 09:46:33,"""I'm gonna buy Google stock, injecting cash so the company will be more profitable and increase the value of my investment over time!""  ""Actually you are literally just renovating my friend's house."""
2019-08-08 09:39:24,"Shit gets real wild when a company just gives you stock.  I know someone at Google who isn't an exec and they just slide her 5 figures of stock every year, vests every 3."
2019-08-08 09:12:40,Merck stock up 64% in 14 months $MRK $TWTR $FB $JNJ CubaNu Restaurant & Lounge on #Google  https://local.google.com/place?id=8543692812954674058&use=posts&lpsid=6033010921901098066 …
2019-08-08 09:01:20,"a piada é o tipo de foto com bué pessoas a rir e quês e a olhar para baixo, não tem nada a ver com isso 🤦‍♂️ se procurares no google imagens stock de fotos de grupo encontras milhares igual a essa"
2019-08-08 08:58:20,Not much longer. Google Facebook and Twitter stock values are the leading indicator for a failed orchestration of election meddling.
2019-08-08 08:41:15,"Just did a Google image search on a corporate headshot that looked like a stock photo.   Sure enough, this ""person"" works across the world at law firms, a cosmetology school, and is running for some kind of office. WHAT A LIFE."
2019-08-08 08:04:22,My favorite episode yet... nothing better than old stock car racing stories from those that lived it... it's greatness was born out of good old fashioned hard work and commitment
2019-08-08 07:57:52,Encore une situation cocasse dans laquelle j'ai appris une formule excel/Google sheets : faire un tableur pour gérer le stock de lait maternel au congélateur 😅
2019-08-08 07:57:10,My new installation NEWSPEAK 2019 is a stock market style ticker tape of Orwell’s 1984 as priced by Google Ads. Showing after dark @edfringe Data Lates   https://www.designinformatics.org/event/data-lates/ … #linguisticcapitalism #whatarewordsworth https://twitter.com/DesignInf/status/1159198976425582593 …
2019-08-08 07:19:05,"@benshapiro is too busy retweeting them , as “experts “ when Stock Market moves ... Helpful Hint : Google their predictions for a Trump Economy in 2016  https://twitter.com/EmeraldRobinson/status/1159266524701560833 …"
2019-08-08 06:53:49,"Great reviews again from our customers on Google ... Check out the deals we have .. cars to suit your budget .. loads of stock, get in touch  https://www.instagram.com/p/B05n3PKHLdG/?igshid=c75t0ivpx882 …"
2019-08-08 06:06:15,Are you a service provider looking for a market for your inputs? Let us convert your stock to cash in one easy step – just get in touch with us. Just a click away on web -  http://www.ebagropamoja.org  download app from google play store -  https://play.google.com/store/apps/details?id=com.trendpro.ebagropamoja … pic.twitter.com/KJv9nBvTAL
2019-08-08 06:01:30,The newest stock Android on Google phones has it. I just got it a couple of months back on my OnePlus device.
2019-08-08 04:48:13,"#ANZU #BIDS  I am a big fan of Bidstack & have been surprised by the stock trading downwards.  I came across this when looking for a reason why, it may not be linked to the fall but interesting anyway.  google Anzu gaming for more info.  https://twitter.com/Anzu_io/status/1158844957446332421 …"
2019-08-08 04:35:25,After your father racial rants and all this war mongering regarding kashmir how do u expect that stock market will go up.. And plus since when stock market is the standard to judge a economy?? Kindly google your govt’s end result and lets compare it at IK’s tenure. #AAZisracist
2019-08-08 04:32:08,C’est peu probable mais si ça arrive je stock le jeu dans mes disques dur externes ;)
2019-08-08 04:29:45,Et le jour où l’éditeur/constructeur/service qui stock ton jeu décide de débrancher le câble ton jeu que tu possèdes disparaîtra sans pouvoir rien y faire.
2019-08-08 04:29:20,"The other one is when I look at the list of ingredients and I have to google half of them. nope. i have an onion, a tin of tomatoes and a stock cube. Go."
2019-08-08 04:25:10,If it can help a stock image appear as unique (and therefore actually rank in Google image search) I'm onboard.
2019-08-08 04:19:08,"💥 FLASH + CUPON 💥 ✅ AUKEY Soporte Móvil Coche 2 Unidades Rejillas del Aire 360 Grados Rotación Soporte Teléfono Coche Ventilación para iPhone XS/XS MAX, Google Pixel 3 .  ❌ PVP: 19.99 EUR ♻ Precio reaco: Sin stock 🔥 Precio oferta: 6.0 EUR 💥 🎟 CUPÓN: MEQKIRG8  💳"
2019-08-08 03:57:29,Please don't launch new products if you don't have enough stock locally. There are a lot of frustrated Lenovo customers due to delayed shipping. Google once if you don't believe me.
2019-08-08 03:38:38,"Yeah google is just crap for phones, imo you should just buy a near stock android oem phone, that will probably only be worse than the pixel in images..."
2019-08-08 02:37:09,This is the most gangster sh*t I’ve ever seen..”writing stories for them in PowerPoint w/ Google stock photos.” Congrats Papa Lee!
2019-08-08 01:06:09,adidas x undefeated pureBoost Go   sz : 40-45   🏷: ghc 320   in stock and selling now   📍GEO TAG : sneaker hub [ uber / google maps ]   📱: 0200371637   ~locate our shop on the main upsa road close to…  https://www.instagram.com/p/B05AEMRpkCj/?igshid=fp44rnc1sfm3 …
