date,tweet
2019-05-21 19:44:01,"Google Misses Revenue Estimates, Has Worst Day on Stock Market Since 2012  http://feedproxy.google.com/~r/entrepreneur/latest/~3/OFNnUluujt0/333081 …"
2019-05-21 19:15:45,Los dispositivos Huawei en el mercado (vendidos y en stock) seguirán funcionando con NORMALIDAD. Las Google Apps SI funcionan en los Huawei (soy usuario) y te lo digo con seguridad. Hay mucha desinformación al respecto.
2019-05-21 19:10:00,"It's a trollbot account with a stock image, it's all over Google if you do a reverse image search, and it should be gone in a minute😊"
2019-05-21 19:08:20,"""Android de Google y dormir tranquilos"" es asumir que AOSP no es Android? Que risa. La mayoría de los fabricantes chinos te dan un Android stock de fabrica y ni se calientan en seguir los baseline security updates... Es más seguro un AOSP sin play store pero c updates frecuentes"
2019-05-21 19:04:54,"Creo que los poseedores de un móvil de #HUAWEI vamos a salir ganando con todo este asunto, #HUAWEI no va a dejar como ladrillos a todos los miles de dispositivos que tiene en stock junto con todos los que ha vendido a nivel mundial sin una opción que tendría que ser atractiva .."
2019-05-21 18:17:30,"I wonder what @Huawei has to loose when the market share is still in the growth phase. @Google ban is going to create a resilient China. I’ve noticed the developing world has taken on #Samsung, Vivo and #HuaWei well. Still a stock I would buy... #tradewar #china pic.twitter.com/4XXArlkLyQ"
2019-05-21 18:01:28,New post (Google Changes Abortion Ad Policy) has been published on easy stock market -  http://easy-stock-market.com/google-changes-abortion-ad-policy …
2019-05-21 17:36:39,This from the article that Sony stock dropped 12% in March because of these competing streaming offering from Google. So it makes since they partnered with MS (stock went up) and talk streaming for next gen  https://www.fool.com/investing/2019/04/08/why-sony-stock-dropped-12-in-march.aspx … pic.twitter.com/0PNi1LpEPY
2019-05-21 17:36:00,"""If your mother and father had invested in Apple in the 1980s, Google in the 1990s, and Netflix in the 2000s and left you with $20 million dollars in highly-appreciated stock upon their passing, I would love to hang out with you on your yacht.""   https://www.physicianonfire.com/suboptimal-assets/ …"
2019-05-21 17:13:14,"A important thing to remember is that methane has a ""short"" lifecycle once we hit peak live stock methane will reduce in 20 years.  I've also found if you Google into the anti meat climate scientists you tend to find a vegan (look for yourself don't take my word for it)."
2019-05-21 17:02:17,“Is said to stock”??? It’s not a fucking rumour. They do. It’s a simple google search. Do you pay these “reporters”?  https://twitter.com/LivEchonews/status/1130941334313947136 …
2019-05-21 16:24:28,Google confirmed yesterday before the ban was lifted that phones already sold and those in stock will not be affected.
2019-05-21 16:21:57,"A cool gain day, but the markets are still volatile.  A trade deal could send the markets up, or a tweet could send the market in a tail spin. Stay vigilant.  @Google $GOOGL is our highest performing stock with a $9.78 gain per share.  The stock currently stands at $1154.44 per."
2019-05-21 16:05:24,"It can be changed in stock also, if any app has quick tiles, it shows in the quick settings.. eg - files app by google etc etc"
2019-05-21 15:08:52,"Huawei y Google han informado que los teléfonos que actualmente están en el mercado y los que están en stock seguirán recibiendo actualizaciones, sobre todo de seguridad, pero en ningún momento han mencionado actualizaciones de sistema operativo   https://www.unocero.com/noticias/bloqueo-huawei-fecha/ …"
2019-05-21 14:42:50,"Google searches for ""cancel HBO subscription"" have massively spiked since the series finale of #GameOfThrones aired this past Sunday. This could result in a sizeable shock to parent company AT&T stock $T. http://ow.ly/5pY430oN8SX "
2019-05-21 13:37:47,"- cerca de 70 carros; - classes: Turismo, Stock, Tunado, GT, Formula, Protótipo e Grupo 7; - 12 locais: China, Malásia, Japão, UK, Espanha, USA, Cuba e Austrália; - Desafios com Fernando Alonso; - 6 tipos de corrida; - Online com 16 jogadores; - PS4, Xone, PC e Google Stadia."
2019-05-21 12:49:37,Average. Bet that includes the top tier with stock options in the green getting millions and skewing the numbers.
2019-05-21 12:36:08,"CRAMER ALERT:   ""TRUMP WILL BE RE-ELECTED BUT ONLY IF AMERICANS IRA ACCOUNTS ARE BIG AND GROWING. AND THE STOCK MARKET IS BOOMING""  I agree with Cramer, Trump must quit persecuting Huawei in favor of Google the criminal company that sells our info."
2019-05-21 12:32:04,"Alphabet : Google Cloud, Informatica Team Up to Tame Data #Alphabet #Stock #MarketScreener  http://marketscreener.com/ALPHABET-24203373/news/Alphabet-Google-Cloud-Informatica-Team-Up-to-Tame-Data-28634262/ … pic.twitter.com/MXIX6lBArP"
2019-05-21 12:22:46,Hey @Google @GoogleIndia @Android please give a new update for files for stock Android users .!!
2019-05-21 11:53:10,ViaSat : Google Stadia and online gaming over satellite #ViaSat #Stock #MarketScreener  http://marketscreener.com/VIASAT-INC-11323/news/ViaSat-Google-Stadia-and-online-gaming-over-satellite-28634074/ … pic.twitter.com/jlnqdIweo4
2019-05-21 11:33:09,Google 10 back in stock. Go get it ASAP
2019-05-21 11:28:08,Huawei continues to provide security updates and after-sales services for all existing Huawei and Honor smartphones and tablets that are sold and are still in stock.
2019-05-21 11:26:22,Google Stock Market Symbol: luxury google stock market symbol or as many of you know i love…  https://goo.gl/fb/UJfMHg 
2019-05-21 11:14:50,Spring cleaning is also for reviewing and discarting investigative tools... When you realize that the under-the-radar series of stock photos purchased from an amateur website last year are are now all over Google Image... 😳
2019-05-21 11:13:04,@Google entzieht @HuaweiMobile die Stock-Android-Lizenz. Mein Mate 20 Pro 30Minuten Später: Hey du kannst mich nun Updaten.🙂
2019-05-21 11:02:14,"ehehehe, I mean, even though it amuses me to read, I still very commonly take pictures of myself in a pose for poses that I cannot easily find on stock photos or through google, from the commissioner perspective, I think it's quite the effective tool X'D"
2019-05-21 10:52:01,"CRAMER:   ""TRUMP WILL BE RE-ELECTED BUT ONLY IF AMERICANS IRA ACCOUNTS ARE BIG AND GROWING. AND THE STOCK MARKET IS BOOMING""  I agree with Cramer, Trump must quit persecuting Huawei in favor of Google the criminal company that sells our info."
2019-05-21 10:24:12,"(2/2) ""Since 2014 TAE Technologies has worked with Google..."" ""The Government of Russia🇷🇺, through the joint-stock company Rusnano, invested in Tri Alpha Energy in October 2012, and Anatoly Chubais, Rusnano CEO, became a board member."" /end  https://en.wikipedia.org/wiki/TAE_Technologies …"
2019-05-21 10:20:02,"▶ HDFC Bank (HDB) in Focus: Stock Moves 6% Higher - Nasdaq: HDFC Bank (HDB) in Focus: Stock Moves 6% Higher  Nasdaq HDFC Bank LimitedHDB was a big mover last session, as the company saw its shares rise nearly 6% on the day. The move came on solid…  http://dlvr.it/R57Rf6  GOOGLE"
2019-05-21 10:19:43,"Going broke, lucky if it’s a $30 billion valuation, $80 billion is so ridiculous. This is a $30 stock price for at least 6 months plus, Google can step in with autonomous vehicles and crush Uber and Lyft"
2019-05-21 10:16:18,"It’s not Google’s decision. The US Government has put sanctions on US-based companies doing business with Huawei. Intel, Qualcomm, and every other American company doesn’t have a choice.   Google’s stock dropped because of the ban; they’re losing here too."
2019-05-21 10:09:47,"Makes sense, @Uber is screwed no matter what happens to stock.... 🤷‍♂️ imo"
2019-05-21 10:07:43,I think #morganstanley is invested in Uber which has a 80 bill valuation & could be worried about #tsla robotaxis project.  So could be #adam Jonas is manipulating #tsla stock. @elonmusk
2019-05-21 09:53:10,"Some super shady things are going on rn with Wall Street. You don’t produce the safest, ‘best’, ‘cheapest’, car that everyone loves with the brand power Tesla has and have the stock slip this much. I’m not sure what is happening behind the scenes but I’m sure we’ll find out soon."
2019-05-21 09:42:31,Get TradeHawk Mobile in the App Store or on Google Play!  Unlimited Stock and Options trading for one low monthly price
2019-05-21 09:35:38,"Walk barefoot or touch a tree.  The answer is right under your feet. Start your earthing and grounding discovery via a Google Search. When you are ready to take the leap, we have all grounding sheets sizes in stock  http://bit.ly/2ZziJ9H  via @getground…  http://bit.ly/2LYG1mM  pic.twitter.com/aogYYSfTEH"
2019-05-21 09:35:14,"De hecho tú Huawei quedará perfectamente funcional, Google seguirá dando soporte a todos los Huawei que ya estén vendidos o en stock en tiendas, aún que, lo que qu fa en duda, es si se actualizaran a Android Q"
2019-05-21 09:34:21,"Walk barefoot or touch a tree.  The answer is right under your feet. Start your earthing and grounding discovery via a Google Search. When you are ready to take the leap, we have all grounding sheets sizes in stock  http://bit.ly/2ZziJ9H  via @getground…  http://bit.ly/2LYG1mM  pic.twitter.com/SbqJyFMaVd"
2019-05-21 09:33:23,"Walk barefoot or touch a tree.  The answer is right under your feet. Start your earthing and grounding discovery via a Google Search. When you are ready to take the leap, we have all grounding sheets sizes in stock  http://bit.ly/2ZziJ9H  via @getground…  http://bit.ly/2LYG1mM  pic.twitter.com/SdmU3tu0Ic"
2019-05-21 09:33:12,"Walk barefoot or touch a tree.  The answer is right under your feet. Start your earthing and grounding discovery via a Google Search. When you are ready to take the leap, we have all grounding sheets sizes in stock  http://bit.ly/2ZziJ9H  via @getground…  http://bit.ly/2LYG1mM  pic.twitter.com/wTJzjGCpzK"
2019-05-21 09:20:00,"Google cuts off the partnerships with Huawei.  Now, how can they make Android-like OS with a proper UI and stock experience considering all the OS in China usually sucks & looks cheap af? Trade wars really do China that bad, yeah?"
2019-05-21 09:06:30,"Dua hari dah google, qualcomm dan android stock saham jatuh, klu berterusan blh jadi kena uturn blk"
2019-05-21 09:05:20,Can't they strike a partnership with say Lineage OS or some Custom OSes (like @oneplus did with cyanogen) which are based on AOSP. It's a win win situation for users & developers. Users get stock android experience from EMUI and situation settles for @HuaweiMobile #huawei #google
2019-05-21 08:45:39,I don’t see Tesla selling. Stock is artificially low with GF3 being built and the semi and Y on the way
2019-05-21 08:42:10,@Walmart every single one of you Google ads lead to items out of stock.
2019-05-21 08:30:24,"Hi Peter, Huawei have confirmed they will continue to provide updates and after-sales services to all existing Huawei products along with those that are still in stock globally. The updates include security, google apps & non-google apps."
2019-05-21 08:05:39,$KOPN Kopin - Google Embeds Kopin Microdisplay in New Glass Enterprise Edition 2 From our Stock News Alerts App
2019-05-21 07:51:52,Google stock price
2019-05-21 07:47:18,"Hi Anthony, Huawei has confirmed that they will continue to provide updates & after-sales services to all existing Huawei products along with those that are still in stock globally. The updates include security, google apps & non-google apps, so there’s no cause for concern."
2019-05-21 07:47:10,"CRAMER:  ""TRUMP WILL BE RE-ELECTED BUT ONLY IF AMERICANS IRA ACCOUNTS ARE BIG AND GROWING. AND THE STOCK MARKET IS BOOMING"" I agree with Cramer, Trump must quit persecuting Huawei in favor of Google the criminal company that sells our info."
2019-05-21 07:46:08,"Hi Shane, Huawei has confirmed that they will continue to provide updates & after-sales services to all existing Huawei products along with those that are still in stock globally. The updates include security, google apps & non-google apps, so there’s no cause for concern."
2019-05-21 07:42:05,I was almost won over by the idea of getting a Huawei... luckily this happened before I bought one. Samsung or Google all the way. Even a OnePlus sounds tempting. All I ask for is stock Android. A Xiaomi also sounds nice.
2019-05-21 07:39:08,"Hi Jerry, Huawei has confirmed that they will continue to provide updates & after-sales services to all existing Huawei products along with those that are still in stock globally. The updates include security, google apps & non-google apps, so there’s no cause for concern."
2019-05-21 07:26:00,"Hi there, Huawei has now confirmed that they will continue to provide updates & after-sales services to all existing Huawei products along with those that are still in stock globally. The updates include security, google apps & non-google apps, so there’s no cause for concern."
2019-05-21 07:25:00,"Hi Conor, Huawei has now confirmed that they will continue to provide updates & after-sales services to all existing Huawei products along with those that are still in stock globally. The updates include security, google apps & non-google apps. Hope this puts your mind at rest."
2019-05-21 07:23:44,"Hi Zohar, Huawei has confirmed that they will continue to provide updates & after-sales services to all existing Huawei products along with those that are still in stock globally. The updates include security, google apps & non-google apps, so there’s no cause for concern."
2019-05-21 07:22:56,"Hi Thomas, Huawei have confirmed that they will continue to provide updates & after-sales services to all existing Huawei products along with those that are still in stock globally. The updates include security, google apps & non-google apps, so there’s no cause for concern."
2019-05-21 07:22:35,"Hi Anna, Huawei has confirmed that they will continue to provide updates & after-sales services to all existing Huawei products along with those that are still in stock globally. The updates include security, google apps & non-google apps, so there’s no cause for concern."
2019-05-21 07:21:38,"Aujourd'hui sur le terrain d'Anderlecht, match marketing digital pour les #BNPDigitalDays 💪🚀☀️⚽️ #Google #GoogleDigitalAtelier (@ Stade Constant Vanden Stock in Anderlecht, Bruxelles-Capitale)  https://www.swarmapp.com/mathiaservyn/checkin/5ce3d1f4872f7d002cc4ca96?s=tMoKxfDBW9_3wqNvuouRitdv0jk&ref=tw …"
2019-05-21 07:19:06,"Alphabet : Huawei accuses U.S. of bullying, says working with Google to counter ban #Alphabet #Stock #MarketScreener  http://marketscreener.com/ALPHABET-24203373/news/Alphabet-Huawei-accuses-U-S-of-bullying-says-working-with-Google-to-counter-ban-28631645/ … pic.twitter.com/JjrtCE1Zuk"
2019-05-21 06:50:49,Stock Android (Mi A3) without Ads at 18k. I'll add - Google has to iron out niggles in Android One mobiles. Despite no bloatware most Android One mobiles lag due to lack of optimization. This is Google's responsibility.
2019-05-21 06:42:07,Alphabet : Huawei senior executive working with Google to counter U.S. ban #Alphabet #Stock #MarketScreener  http://marketscreener.com/ALPHABET-24203373/news/Alphabet-Huawei-senior-executive-working-with-Google-to-counter-U-S-ban-28631397/ … pic.twitter.com/9g7yyhXYH4
2019-05-21 06:41:11,"Thanks to Huawei ban, the tech stocks dropping, beginning another week of losses. #Huawei #Google #investing #MobilePhone #stock #market  https://www.wasteyourtime.co/2019/05/huawei-banned-from-us-market/ …"
2019-05-21 06:37:01,"We rank page 1 on Google for a range of keywords relating to used and surplus plastic equipment and material. When potential buyers look for used or surplus stock on Google, they find it on PlastikCity. List your used equipment or surplus material now >  https://www.plastikcity.co.uk/trading-post/used-surplus-plastic-equipment-material … pic.twitter.com/i3gSLZnwNE"
2019-05-21 06:22:06,"If you ever have heard the aphorism ""men never stop to ask directions,"" that happened to me on a journey to Rudolph, Wisconsin to view the newly dedicated statue of stock car racing legend Dick Trickle. A Google...  https://www.facebook.com/kevin.lillard/posts/10161788323505574 …"
2019-05-21 06:07:56,Sanika Stock Market Consultancy & Training Center on #Google  https://local.google.com/place?id=15007517021948509168&use=posts&lpsid=394244520306745193 …
2019-05-21 05:57:16,I thought the same so put it through Google Search by Image and its not a stock image and only other references are to the same article.
2019-05-21 05:55:49,"I managed to filter out your answer and am now informed about the product that is now out of stock. (permanently)  Also webshop owners, if your store mostly contains products that are out of stock, you're simply having a showcase to trick google into indexing you."
2019-05-21 05:15:47,"Android and google are American companies  And huawei is Chinese  There are many conflicts  In btw America and china If America stop these Chinese stock exchange will be Face loss, because huawei is the second largest mobile phone developers"
2019-05-21 04:35:16,Unit 51 advertising being the “official after party for Grampian Pride” and using the same google stock imagine of two masculine white men kissing as last year 🙄
2019-05-21 04:29:49,Let's take a look this album. ^ ^  D-CRUNCH . ~ ALBUM: 2ND MINI ALBUM ‘ARE YOU READY ? M0527’ ~ DETAILS (check on google for details): **CD **84P PHOTOBOOK **2PCS RANDOM PHOTOCARD **1PCS RANDOM POSTER (WHILE STOCK…  https://www.instagram.com/p/Bxt8lG1gWZV/?igshid=da9jq8o5rwsp …
2019-05-21 04:26:19,BREAKING NEWS: Huawei stock price tumbles as Google announces Android license ban. Willie Revillame takes advantage and buys out the controlling stock and renames it to Huawawei.
2019-05-21 04:22:47,"Hi Barbara, Huawei will continue to provide security updates and after-sales services to all existing Huawei smartphone and tablet products, covering those that have been sold and that are still in stock globally. This includes updating of Google Apps and Non-Google apps. Thanks"
2019-05-21 03:53:13,"Bob Marley was buried with a guitar,a bible and some weed.someone top up him I guess he's already out of stock.#JKIA #Ruto #GMITM #goldscam #Huawei #Google #TuesdayThoughts #TuesdayThoughts #TuesdayMotivation #MathsGCSE #Mikarol #IFBDrive #IgnitionDRIVE #Ifb"
2019-05-21 03:13:14,"On Google, Narendra Modi’s stock continues to rise  Sneha_Alexander reports  Read here:  http://bit.ly/2JRfRj5   pic.twitter.com/3xLzNiH1oO -livemint"
2019-05-21 03:10:00,"On Google, Narendra Modi’s stock continues to rise  @Sneha_Alexander reports  Read here:  http://bit.ly/2JRfRj5  pic.twitter.com/IFmC2MXIGY"
2019-05-21 03:02:38,Han wohi stock Android hoty hn Google pixel ko sb sy pehly milta hay qk banaty wohi hn phr Nokia OnePlus etc jo jo stock Android hn or OEM Android m Huawei ko pehly milta tha phr Samsung or oppo vivo dety he nh hn
2019-05-21 02:45:26,"RT VRtrendfollower ""of making a big move.  #Google, #Yahoo, #Amazon had made tremendous opening moves and continued up for many, many months thereafter.  I'm looking for the stock to give me a set-up that creates a bullish pattern: Consolidation, High Channel, Retracement Wo…"
2019-05-21 02:43:43,"of making a big move.  #Google, #Yahoo, #Amazon had made tremendous opening moves and continued up for many, many months thereafter.  I'm looking for the stock to give me a set-up that creates a bullish pattern: Consolidation, High Channel, Retracement Work,... Continue 2/4"
2019-05-21 02:35:25,"Investors weren’t happy. Tech shares — including in Google’s parent, Alphabet, as well as in Apple and Qualcomm — led a decline in the broader U.S. stock market.The Chinese government suggested Huawei could take up a legal challenge.  https://nyti.ms/2Yzrm2w "
2019-05-21 02:29:28,Siapa suka ni  Stock cam vs google camera  #realme3pro
2019-05-21 02:10:29,"💥 OFERTA 💥 ✅ TP-Link - Bombilla Inteligente LED, Bombilla WiFi sin Necesidad de hub, Luz Blanca Cálida Regulable, Compatible con Amazon Alexa y Google Home, 800lm .  ❌ PVP: 24.99 EUR ♻ Precio reaco: Sin stock 🔥 Precio oferta: 14.99 EUR 💥 💳  https://amzn.to/2wcfuHP  📊 E"
2019-05-21 02:08:07,It's nothing to worry about. As android is still open source Huawei will still have access to AOSP which is the open source version of Android. Which runs parallel to stock android by Google. It'll just be up to Huwawei to make sure it's up to date with the latest stuff.
2019-05-21 02:00:23,Realme 3 pro stock vs google camera
2019-05-21 01:37:50,Teruk gak google punya stock turun sbb huawei...
2019-05-21 01:24:43,Google Sheets for Stock and Portfolio Monitoring   http://www.stanleysuen.com/2018/03/google-sheets-for-stock-and-portfolio.html …
2019-05-21 01:23:42,Huawei senza più aggiornamenti Google per le app e per il sistema operativo. I dispositivi venduti fino ad aprile e gli stock in vendita sembra funzioneranno ugualmente. Per il sistema Android 10 Q dubbi. @aicostorg @consumatoriaico @avvmissimi
2019-05-21 01:22:10,Anyone google reverse search her image yet and found the stock photo company?
2019-05-21 01:18:03,"1RS. Hello Friends, I am Fortunate, I am Grateful and I want to Share: Have you not taken advantage of investments like Amazon, Google, Facebook or Apple before quoting on the Stock Exchange? Do not worry, ShopperClub is your new opportunity ...  https://www.shopperclub.net/marisol190517  llevo 7pts"
2019-05-21 01:10:54,She may be a stock photog a middle age white woman I found on Google.......but she is so much more😂😂😂
2019-05-21 00:43:40,I’d do a google reverse image search for the lass in the pictures but I’m on my phone 😕 I’m expecting to find a stock image for the first one.
2019-05-21 00:39:36,"Los que están en stock tiene el sistema de Google , pero los que van a salir nop ( mate x y esas cosas ) aunque tengan sistema operativo nuevo es que no tiene todas las aplicaciones que todos consumen"
2019-05-21 00:23:42,1. #OnePlus7Pro stock cam 2. Google camera port  Gcam retains the fine details of the subject whereas the stock op7 cam slightly over exposes the images. May a OTA update could fix some quirks with the stock cam  pic.twitter.com/LcnuWNSYsT
2019-05-21 00:13:29,"No Google will provide support for existing devices / devices in stock however future device will be affected also, current Huawei devices might not get the next android with gapps .."
