date,tweet
2019-04-07 19:44:01,The date Google tells me that the STOCK EXCHANGE in  wall st began trading is  17 May 1792  Again info on Google. If this is incorrect  Please let me know.  Thank You.  (Just pointless things that sprang to my mind)  https://twitter.com/u9D4wNmil1g5wyQ/status/1115036568488685568 …
2019-04-07 18:46:34,"Here is your chance to get in on the stock market like I did. +FREE Stock & trades.   **Top FREE Finance App in the Google Play/Apple Store**  Join Robinhood and we'll both get a stock like Apple, Ford, or Sprint for free. Make sure you use my link.  https://share.robinhood.com/casieb12 "
2019-04-07 17:45:02,▶ Temasek Holdings Private LTD Cut Its Hdfc Bank LTD (HDB) Position as Valuation Rose; Profit Investment Management Trimmed Crocs (CROX) Holding as Stock Declined - The Hi New Ulm: Temasek Holdings Private LTD Cut Its Hdfc Bank LTD (HDB) Position…  http://dlvr.it/R2M6fN  GOOGLE
2019-04-07 16:55:51,Just google free stock photo. And I literally use an app from phone for that.
2019-04-07 16:47:02,▶ HDFC Bank Limited (NYSE:HDB): Taking a Closer Look at This Stock – Stock Standard - Stock Standard: HDFC Bank Limited (NYSE:HDB): Taking a Closer Look at This Stock – Stock Standard  Stock Standard Tracking recent action on shares of HDFC Bank…  http://dlvr.it/R2M1PR  GOOGLE
2019-04-07 16:18:01,"Full Stack Software Engineer at @thebaseapp - ( $95K - $115K plus stock options ) - ( golang, python, react, vuejs, aws, google cloud, agile, lean, sendgrid, twilio, deep learning, machine learning, devops, kubernetes ) - details 👇 https://buff.ly/2TVIdKk "
2019-04-07 15:21:33,You know nothing about that sale.  How much stock did Rosatom already own before that sale?  Why did the sale trigger a national security vote?  What happened a few years after that sale? Go ahead and Google it  ....I know you can't answer off the top of your head.
2019-04-07 15:15:54,My downloading has finished!  Google drive link is given above in the link just download and watch it?
2019-04-07 14:47:49,"Add in a paid off mortgage, some Amazon, Apple, Google, Intel stock options and I’m straight... you ain’t never got to hear from me again  https://twitter.com/Karnythia/status/1114740976898195456 …"
2019-04-07 14:27:38,Stock photo from google  pic.twitter.com/Gaia1mxhXV
2019-04-07 13:48:28,hey @meathead is there any type of study that compares water/beer/stock bath for bratwurst? I'm curious if the   beer bath actually adds anything to the sausage or just water would be sufficient. I couldn't find it via a quick google search.
2019-04-07 13:43:30,"Ah ok. Yeah so the dividends are not in any way linked to a players contract.   Football Index the platform offer dividends which they can pay from the commission they generate in sales.   A player you own in FI, is in FI. It’s not the same as owning Google or Apple stock"
2019-04-07 13:33:52,Yes! Someone asked for pictures of my trip to victoria falls and I basically had 1 picture which seems like a stock photo taken from google 🤣
2019-04-07 12:56:29,"2r2. Tapi tkpa kal. Nnt mi9 tu kau install google cam port, pstu compare dgn stock cam. Aku pkai google cam je dkt poco"
2019-04-07 12:20:06,Lol stock photos and Google. But for height comparisons... Google. 😅
2019-04-07 11:44:23,#XSG not many people know the huge potential of this stock. Microfibre pollution from UK washing machines is a major issue and also worldwide. A quick Google search shows many countries with strict regulation in place to prevent microfibre pollution. Xsg has unique tech  pic.twitter.com/jj4N7ICid8
2019-04-07 11:19:10,"Stock photo when you google ""ask dad for money"" lol"
2019-04-07 11:18:40,the background for the teasers look like those stock photos in google
2019-04-07 11:13:43,Angelic Google starts the apocalypse  1 pm in Burger King. Roger Higgins reporting for Stock Market station.
2019-04-07 10:38:33,"Take Kevin Systrom, see attached! Awesome story! Early days at Google, Twitter, others! Created Instagram! He, and 13 employees, sold it for $1B in cash and stock, to Facebook! And again, his employees went making s living wage!   https://en.wikipedia.org/wiki/Kevin_Systrom …"
2019-04-07 10:04:03,"It’s fine if want to complain about the standard of your education, it seems you’d have a fantastic case to do so but google is available on the device you’re using to make yourself a laughing stock on twitter, at some point you have to take responsibility for your ignorance."
2019-04-07 09:01:41,"If you care about your privacy, stop using products of Google and alike. I’m using /e/ instead of stock Android on my mobile. It keeps my data private and works great.  https://e.foundation "
2019-04-07 08:54:20,"I can't believe it, but the person I ended up sitting next to on the train uses a Google pickle. I think it's a Pixel 2-XL, though.  I still dream of the day Google copies Samsung Galaxy Note features, but on top of the stock Android UX rather than Samsung One UI."
2019-04-07 07:58:05,Buy stock in google
2019-04-07 07:46:32,"▶ Stock analyst Ashwani Gujral recommends buying HDFC, Axis Bank, & HDFC Bank - CNBCTV18: Stock analyst Ashwani Gujral recommends buying HDFC, Axis Bank, & HDFC Bank  CNBCTV18 The latest analysis and commentary by stock market guru Ashwani Gujral…  http://dlvr.it/R2KyrR  GOOGLE"
2019-04-07 07:14:15,Nice 📸 This looks like a stock image you’d see if you typed “family lunch” into a Google! #photogenic
2019-04-07 04:58:33,"Hi, aphids can appear in Spring before their predators wake up. If you want to boost your stock of ladybirds they can be purchased. Just google them for retailers. Visit your local independent garden centre for other options the staff offer great advice."
2019-04-07 04:16:22,"💥 CUPONAZO 💥 ✅ AUKEY Soporte Móvil Coche Rejillas del Aire 360 Grados Rotación Soporte Teléfono Coche Ventilación para iPhone XS / XS Max, Google Pixel 3 XL, Samsung.  ❌ PVP: 8.99 EUR ♻ Precio reaco: Sin stock 🔥 Precio oferta: 5.9 EUR 💥 🎟 CUPÓN: RLZ4KBS4  💳"
2019-04-07 03:50:26,I took a google maps picture and have a link to another picture.   It's like 1 mile long and looks like floating city from the bridge I cross to get to the city.  I feel like they just blurred it out and said it was on lake erie instead. stock photo:  https://www.alamy.com/stock-photo-frenchmans-island-oneida-lake-new-york-in-wintertime-82267207.htm … pic.twitter.com/JVdCR1RcqB
2019-04-07 02:16:24,Random stock photo I found on google when searching for zombie line art. I felt like coloring something different last night and so I ventured into the horror genre. Copic and colored pencil mix. I used pencil to get that gritty texture and such.  pic.twitter.com/eUEu3fAhQ7
2019-04-07 01:31:42,"moodboard based designs are a good concept, but unfortunately a majority of artists take their aesthetic photos off google and don't credit source... I don't wanna be like those people.   I use stock photos, but I think it'd be fun to also draw lil' aesthetic images myself."
2019-04-07 01:19:33,👏🏻  Only got $2500 worth of stock right now.  Google Play Account recharge with Giftcards!  You can either get the code if your GP Account is chinese or let me enter it for ya  https://twitter.com/DarkGintas/status/1114270199027568641 …
2019-04-07 01:11:01,Google Sheets for Stock and Portfolio Monitoring   http://www.stanleysuen.com/2018/03/google-sheets-for-stock-and-portfolio.html …
2019-04-07 00:29:58,"That’s all you’d tell yourself?? I’d say Jace life sucks, your gay, punch anyone in the throat that picks on you, tell mom and dad to invest in AOL, and GOOGLE, they’ll know when to dump AOL stock, and make sure you always talk about a thief named Donald Trump!"
