date,tweet
2019-09-02 19:58:50,5/ @Google has 10:1 super-voting equity for its founders. @Snapchat doesn’t give shareholders any voting rights. Investors buy stock in these companies every day. As they should. These are great companies
2019-09-02 19:41:16,"Not a good idea! Did you know that Google, Amazon, Twitter, MSFT, and Facebook make up 25% of the total US stock market value. Trump will never cave to the evil left."
2019-09-02 18:25:34,"A ver al final tampoco hay muchos graciosetes pero si que son gilipolleces. En plan, fotos de stock bajadas de una búsqueda random en google y puestas a vender. Cuando puedes poner tus propias imágenes como fondo... Sencillamente ridículo."
2019-09-02 18:25:18,I originally had some other music to this video but you know the Instagram copyright rules blocked it so LOL we'll just enjoy it with stock google music for now ha ha Ha.  Here’s a little glimpse from our Dance…  https://www.instagram.com/p/B17OeapnRVG/?igshid=1ji0835n0odbu …
2019-09-02 17:33:25,"gotcha, it just looks like a google stock image to me lmao"
2019-09-02 15:37:13,"I have no clue. Sorry I’m not much help! If you’re looking in-store, maybe ask about it/if their stock of phones are the ones that have google play store."
2019-09-02 14:38:05,"""Very professional they immediately let me know that the item that I bought was out of stock and they would find it and get it to me as soon as possible which they."" says Robert on Google, via @Birdeye_ https://birdeye.com/corvette-mods-149497861339262/review/1971247465131276252 …"
2019-09-02 14:11:44,"Google image search is so full of stock images that it's impossible to find any good references, particularly for lighting or authentic expressions."
2019-09-02 13:53:12,"With Upwork's Stock Down, Will Google Acquire Before Microsoft? – USA Herald:  https://usaherald.com/upworks-stock-will-google-acquire-microsoft/#.XW1W_LVXLYk.twitter …"
2019-09-02 12:52:13,tbh using a wix shop site is quite cool but too much work to be done hfjsnfndn ill probably just list all the items im selling on an spreadsheet for stock tracking and then a google form for buyers
2019-09-02 12:10:59,"OK google,  how do you get your mom to stop selling stock?"
2019-09-02 12:01:33,"Insider Buying: Scientific Digital Imaging plc (LON:SDI) Insider Acquires 50,000 Shares of Stock - Slater Sentinel  http://dlvr.it/RCL589   (Google News)"
2019-09-02 11:47:32,Did you search for middle eastern people on Google stock images and just picked the most accurate
2019-09-02 11:31:27,"Brilliant. The burners are incredibly sloppy but also incredibly intricate at the same time. The use of identical language, replying by accident through the burner and the stock google images are just classic."
2019-09-02 10:40:36,"Create your own dry erase place value mats: Recreate it using your favorite program (I would use Google Sheets), print on card stock or if you have access to a poster maker use that, then laminate. I find that self-made mats hold up well & can be customized to fit your Ss needs."
2019-09-02 10:18:01,"Google ended 2016 with $60.7 billion in untaxed money held overseas, the company said in a regulatory filing.  https://lnkd.in/e6quJfH   Under US tax code Bermuda HCs do not have to pay tax on Capital Gains invested in US stock markets - on publicly traded… https://lnkd.in/e-bNdGU "
2019-09-02 10:14:34,"me da gracia los q en google maps preguntan cosas tipo ""tienen zapatillas marrones?"" ""hola cuanto me sale una remera rosa?"" ESTAS EN GOOGLE MAPS INUTILLLLL preguntas pertinentes a la ubicación o datos del local en general, no se puede saber el stock. dios q imbeciles"
2019-09-02 10:10:23,Antara Android UI yang aku suka  1. Oxygen OS - OnePlus 2. One UI - Samsung 3. Stock Android - Google Pixel 4. Sense UI - HTC  Android UI yang aku tak suka 1. Color OS - OPPO 2. FuntouchOS - VIVO 3. MIUI - Xiaomi 4. EMUI - Huawei 5. Magic UI - Honor
2019-09-02 10:04:47,The first stock photo for the “knuckle sandwich” google search is super distressing  pic.twitter.com/2HBZwyI7m2
2019-09-02 09:55:09,Huawei Announces The Launch Date Of Its New Flagship Phone Mate 30 #Crypto #aapl #aaplstock #aaplstockprice #apple #applestock #googl #googlstock #googlstockprice #google #googlestock #googlestockprice #huawei #huaweimate30  https://www.coinspeaker.com/huawei-launch-date-mate-30 … pic.twitter.com/Bp8zpWjizj
2019-09-02 09:45:55,Haha google says it’s so it must be true. You will be claiming next Jimmy never did anything wrong... I’ve had my flu jab invite this morning should I race there now just in case they run out. Should I also stock up on oxygen just in case that vanishes after brexit
2019-09-02 08:47:36,"bruh its 2019. no warranty on the S7 Edge haha. Loving the screen size tbh. It's much faster than the stock rom, and my lenovo a6000 on Lineage lmao. Very usable. And Google Pay is enough, since its accepted pretty much everywhere around here."
2019-09-02 08:40:20,You can get good stock music simply google search it.  I'd suggest trying some of the sites.  Also we don't take unsolicited creative ideas.  We want great creators who are executing their own ideas in their own spaces.
2019-09-02 08:18:11,Are you running low on stock? Grow your stock today.  Download the STOKISHA APP on Google Play Store or Dial *483*67# on USSD.  pic.twitter.com/2Cl36qsWip
2019-09-02 08:01:25,Hi. That variant of the Google Pixel 3a XL is currently out of stock and no longer available on the gift with purchase offer. You can see our range of available devices at  https://shop.ee.co.uk/  :) - Mark J
2019-09-02 06:40:10,"Coucou, je réitère. Rien sur google books, ils l'ont bien à la bibliothèque centrale de Bordeaux, mais je suis en deadline mode et j'ai hélas pas trop le temps d'aller faire un aller retour pour 2 phrases, donc si quelqu'un a ça en stock je serai très, très content. Merci !  https://twitter.com/thejba/status/1168420632956219393 …"
2019-09-02 05:25:29,"Merdeka Promo 🇲🇾 *promo until stock finish  4 unit available each model.   Package include : Phone, 3rd party charger, box, manual guidelines, OTG   COD : Sri Rampai,KL (Prefer COD) Warranty : 1month by me (2020 with Google international)  For fast deal :   http://wa.me/+601119781916  pic.twitter.com/8InVcNhRPO – at Din Tai Fung (鼎泰豐)"
2019-09-02 05:10:32,▶ HDFC Bank Ltd. | stock & share price update with analysis | 2019-09-02 - Outlook India: HDFC Bank Ltd. | stock & share price update with analysis | 2019-09-02  Outlook India After crossing the day high of Rs.2260.00 at falling as low as…  http://dlvr.it/RCJxHG  GOOGLE
2019-09-02 04:20:57,"First from where to download themes ? Secondly it came with one theme when i applied it icons are the same and font is also the same as stock one, i applied google sans, i downloaded it and copied it to hex/fonts folder"
2019-09-02 04:03:36,@sundarpichai @Google should give android users choice of going with Stock #Android including #Google #Phone for security reasons. I am sure people will be willing to pay for the stock Android app.   https://www.slashgear.com/why-dont-more-manufacturers-offer-stock-android-01589335/amp/#referrer= https%3A%2F%2Fwww.google.com&amp_tf=From%20%251%24s …
2019-09-02 03:51:34,"that is the most obvious troll account ive ever seen in my life. its some ugly male incel hiding behind a dumb ass clickbait bio, stock photo from google images & keyboard. never give into this. youre beautiful and your make ups fuckin POPPIN <3"
2019-09-02 02:45:45,Check out this tweet from googleanalytics: How to make a Stock Market dashboard in Google Data Studio  http://bit.ly/3264wkX  /by @Howe_Ely #measure #fintwit pic.twitter.com/tG9iWCKWJG
2019-09-02 01:32:02,Google Sheets for Stock and Portfolio Monitoring   http://www.stanleysuen.com/2018/03/google-sheets-for-stock-and-portfolio.html …
2019-09-02 00:54:50,"У papa johns на сайте программисты вооружились google translate и раздел акции в url назвали stock. Хотя, возможно, это постирония про бульон."
2019-09-02 00:21:17,is it just me.... or gboard for some reason is more difficult to type on than the stock apple keyboard @Google @madebygoogle any answers? it just feels like the layout is different idk why even tho they're both QWERTY
2019-09-02 00:18:43,"Keep trying Josh! Polls 😂😂😂😂. The left is extremely corrupt so watch the stock market. Amazon, Twitter,MSFT, Google, and Facebook make up 25% of the American stock market value. Get ready! But America will vote for President Trump regardless."
