date,tweet
2019-08-06 19:15:19,Are you still advocating for liberal ideas on your platform?  I need to know if I should be selling my Google stock.  #Trump2020
2019-08-06 18:36:44,The Swamp is very deep and far too many actually believed Hillary would win and they risked it all. They Never expected to get caught.   All I know is anyone with google stock should dump it now and invest in tissues.  Popcorn 🍿 Time
2019-08-06 18:26:42,"At 18, the Irishman Fionn Ferreira has just won the Google Science Award for his incredible invention that removes microplastics from the water. The $ 45,000 stock market...  https://www.ulyces.co/news/a-18-ans-il-a-invente-un-aimant-a-microplastiques-pour-nettoyer-les-oceans/ …"
2019-08-06 18:02:24,"J mate yes I've managed ok today thanks. Although went into town without my card then realised didn't need it because I can use Google pay! Then went for my free coffee, checked the app then it said Out Of Stock! So made my @LavazzaUK coffee at home 👍 pic.twitter.com/cEF0141euS"
2019-08-06 17:57:18,@Google @YouTube sell ur stock in this company now they dont pay dividends they attack conservatives censor teenage girls cuz they have religious morals conservative beliefs & speak truth & facts hurts the feelings of them Conservative are the 1s that invest dont give them our $
2019-08-06 17:45:23,"The abbreviation of google into goog + in the kill box / designation box, could be found on google: “ http://finance.yahoo.com  › quote Alphabet Inc. (GOOG) Stock Price, Quote, History & News Find the latest Alphabet Inc. (GOOG) stock quote,”. So GOOG is stock symbol for Alphabet."
2019-08-06 17:34:21,یعنی یه نفر نکرده امتحان کنه این دستورات رو، ماحصل رو عکس بگیره که نتیجه‌ی واقعی رو نشون بده. همه‌ی وب‌سایت‌های فارسی و داخلی هم از google stock photos استفاده کردن.  ولی جدای از این، کسی تجربه‌ی استفاده از این دستورات رو داره؟  pic.twitter.com/dFzeqtnfve
2019-08-06 17:34:05,"J’ai la rage je stock toute mes photos sur Google photo, et la j’y retourne je vois y’a encore les photos/vidéos avec mon ex putain de bordel de cul"
2019-08-06 17:20:45,"Samsung's phones are hot garbage and have godawful UI.  Plenty of other choices like Sony, LG, Google, Razer, and Motorolla that aren't cancer with awful bloatware replacing the stock UI."
2019-08-06 17:20:44,"I don't think we're listening to the same programme.... that was a sarcastic comment related to Stock Aitken and Waterman - Roadblock  But thanks for telling me about Google, that is new information......"
2019-08-06 17:15:28,"Indian-Americans look down on black folks! Google the Alabama businessman (Indian) who had his black daughter-in-law killed because she would bring down the family ""stock."""
2019-08-06 16:34:41,"If this is true, I'm selling my google stock and I refuse to use their search engine."
2019-08-06 16:28:44,No but I think trumpet is short selling Google stock.
2019-08-06 16:19:08,Time to buy more Alphabet (Google) stock!
2019-08-06 16:10:43,And how much did Google dump in stock this week?  How many billions$$
2019-08-06 16:10:18,"Stock Google image search  Picture quality will vary, but it'll do until you find a good antenna.  This is how we had all the TVs at RAC showing sports games 🤣  pic.twitter.com/aaSr4DjBop"
2019-08-06 16:08:00,"What!?!? Trump does this continuously! He sank Boeing’s stock, among a few. He has repeatedly attacked companies to lower their stock. Amazon, CNN, GOOGLE, etc. where was your outrage then?"
2019-08-06 15:38:21,"Well if Google translate is saying it right you did do 50 shots... So not weak, but maybe get a good recoil pad? I get bruised that bad with my K31 because we have to keep it with stock metal butt pad."
2019-08-06 15:36:38,"▶ Market Monitor: PPOH Line Below Zero for Hdfc Bank Ltd (HDB) - Stock Minute: Market Monitor: PPOH Line Below Zero for Hdfc Bank Ltd (HDB)  Stock Minute Following the technical signals for Hdfc Bank Ltd (HDB), we have recorded the Percentage…  http://dlvr.it/R9nH2y  GOOGLE"
2019-08-06 15:36:36,I take the view spec promoters push the envelope. Its cut-throat competing for limited funds.  Critical thinking: V producers grades between 1-2%. How/why can a stock mention 14%?  Google: Ablation pilot plant. GG & ASX:BLR.  Trust is earned through actions; not words. Imo
2019-08-06 15:33:11,"I just pointed out we don't hear about his ""amazing achievement"" the stock market quite as much anymore...  But sure... ignore all the other signs..."
2019-08-06 15:32:47,Sooo @uhnoimdirtydan @aelynn_can_die  let's invest in the Google stock market to become rich
2019-08-06 15:16:33,The Vanguard Total Stock Market ETF The Vanguard Total International Stock ETF アマゾン・ドットコム アルファベット（Google） フェイスブック インテュイティブサージカル アクソン・エンタープライズ AT&T ベライゾン・コミュニケーションズ フォード・モーター・カンパニー
2019-08-06 14:56:14,So to recap sundar said he liked you (most important) & all was good until fox told you a story of a rogue engineer who helped you build a narcissistic conspiracy theory. Now you try to seed uncertainty about google like you’ve done with #Bezos #amazon & the stock market in gen.
2019-08-06 14:55:07,Trump read a pre-written speech from a teleprompter  then went on to attacking China because of tanking stock market now he is attacking Google for his (dis)approval rating  bodies aren't even cold yet  YOU DEFEND THIS YOU ARE PART OF IT   https://twitter.com/DeadlineWH/status/1158496671287980032?s=20 …
2019-08-06 14:42:12,Accidentally found my new favourite stock image on Google  pic.twitter.com/oEJcKHVMOm
2019-08-06 14:37:03,"Spanky, the issues today that need your attention are Mass Killings, Economic turmoil in the Stock Market over your tariffs, North Korea missile tests & issues impacting American lives, not your imagined slight from Google bruising your poor little orange ego. #Snowflake"
2019-08-06 14:36:42,What you get when you search for partying stock photos on google  pic.twitter.com/D2XjPCyv5Z
2019-08-06 14:33:00,"Cx File Explorer Review : If you’ve been following us, you might have observed that we are trying to find the best replacement for the Stock Apps. We Already Replaced the Google Play Music with Musicolet; Read the Musicolet Review.  https://weobserved.com/cx-file-explorer-review.html … pic.twitter.com/OirdaIAA07"
2019-08-06 14:22:33,"this is a stock photo or not. Evidence photos usually don't have full white backgrounds and can be found with a google search of ""100 round magazine as the 5th result from an online store. If he did use one similar to this, why not use an actual evidence photo?"
2019-08-06 14:21:10,"▶ RIL Liabilities Increase To $65 Billion, Credit Suisse Raises Red Flag - Goodreturns: RIL Liabilities Increase To $65 Billion, Credit Suisse Raises Red Flag  Goodreturns RIL stock fell in Mondays trade on ratings downgrade by Credit Suisse and…  http://dlvr.it/R9n4zs  GOOGLE"
2019-08-06 14:21:09,▶ CS downgrades RIL to underperform; stock declines 3.5% - Economic Times: CS downgrades RIL to underperform; stock declines 3.5%  Economic Times Mumbai: Reliance Industries' (RIL) shares declined 3.5 per cent on Monday after Credit Suisse…  http://dlvr.it/R9n4xn  GOOGLE
2019-08-06 14:05:56,"Uh, that sounds great. Maybe try to google the dance poses? If you google something like ""walzer dance poses"" there are some great stock photos for references 😉😆"
2019-08-06 14:05:21,Don’t trust that Russian lying bastard. I just dumped  my Google stock. Cut that Google up in 20 pieces. Dangerous monopoly!!!!!
2019-08-06 14:01:36,💥 CUPONAZO 💥 ✅ Enchufe Inteligente WiFi Smart Plug Control remoto zoozee Toma de corriente inalámbrica para iOS Aplicación de Android Compatible con Google Home Amaz.  ❌ PVP: 28.99 EUR ♻ Precio reaco: Sin stock 🔥 Precio oferta: 17.9 EUR 💥 🎟 CUPÓN: PYKO7QP5  💳
2019-08-06 13:51:34,So annoying when you see an image on Google you'd like to use then take a closer look only to see its been branded as a stock photo..  Whoever thought of that idea is a dick..
2019-08-06 13:47:34,Google was one of the first companies to adopt Berkshire Hathaway style dual class stock to ensure control over the company  pic.twitter.com/Pl7kTqFjV8
2019-08-06 12:54:38,I can appreciate that Gail.   It is helpful to have some diversification like a stock portfolio  What happens when Google changes the algo yet again  It helps to have another source pick up the slack  #CMWorld
2019-08-06 12:40:14,Back In -Stock GOLD NUGGET L-018 PLECOCOSTOMUS ! Limited Rift Lake Aquatics on #Google  https://local.google.com/place?id=7648230243562260303&use=posts&lpsid=3968986424314134326 …
2019-08-06 12:30:19,Yawn. How are the stock markets today?
2019-08-06 12:21:09,Google急上昇RK: Amazon stock 【PR】商品豊富ポイント増える！＠ハピタス  https://goo.gl/KsWJ6n  pic.twitter.com/4N2a5VlV3x
2019-08-06 12:20:45,"Bezos Expeditions. He was one of the first shareholders in Google, when he invested $250,000 in 1998. That $250,000 investment resulted in 3.3 million shares of Google stock, worth about $3.1 billion in 2017. He also invested in Unity Biotechnology, a life-extension research firm  pic.twitter.com/rwz3fm14yq"
2019-08-06 12:17:58,"Technology moves quickly. When I was first starting out, the rule of thumb was alt text and making sure the site was usable in lynx would cover most cases. Today, impaired users are using add-ons for regular browsers.  Google and MS don't even put it in stock chrome or edge."
2019-08-06 12:10:47,"I assume this is your attempt at getting ahead of the low ratings you will be seeing soon because of your racism, White supremacy support, stock market, bankrupting our great farmers and your poker playing with China.  Or You are going to blame google when you lose reelection."
2019-08-06 12:06:08,"If your using Google to get your stock investment info, your of the  people who I take $$$ everyday. You can short sell a lot more that stocks.... even nube investors know that....."
2019-08-06 12:05:42,"I just listed: 'Googling Security: How Much Does Google Know About You?', for 41.25 via @amazon  http://www.amazon.com/gp/product/0321518667/ref=cm_sw_r_tw_myi?m=A1TJXAPT3KE5UE … Books Academic #buybooks Amazon Economy USA bitcoin tech library #TuesdayThoughts USA  http://goo.gl/D0koUJ  Mexico China Stock Congress #Trump"
2019-08-06 11:24:17,"Thanks to your out of control trade negotiations, the global stock markets are falling off a cliff and you are worried about someone in Google who said something about you 3 years ago?"
2019-08-06 11:15:30,This is hurting Google and they know it. Few more weeks of this and you'll see Google's stock price collapse. Very shrewd from Gemma and Co.
2019-08-06 10:55:10,"@DewsNewz I think @realDonaldTrump is now compromised. He wants gun control, hate crime executions, more spying by big tech. He had a ""good"" meeting with @sundarpichai who said Google wouldn't work against in 2020 election or help China. Mass shooting & stock market & trade war.."
2019-08-06 10:47:32,I need to buy more @Google stock!
2019-08-06 10:44:07,Bump stock 400-500 rounds/min per google
2019-08-06 10:41:50,Definitely buying Google stock today
2019-08-06 10:38:44,"O+ foto average sistema oprativo quasi stock, super veloce P30 sistema operativo meh, foto ottime, batteria ottima S10 foto buone, sistema oprativo decente  -> aspetta Google Pixel 4"
2019-08-06 10:24:46,Mera default camera hai GCam  stock cam to bhool bhi gaya  REALME 1 mai
2019-08-06 10:21:30,#RedmiK20 Night mode on Google camera and stock camera 😲 Have you ever used @Google camera ?   #cameracomparison #camera #android #Redmi #nightmode #night #photography #googlecamera #tech #technology #trakintech #keeptrakin #photo #nightscape #realme #oppo #oneplus #xioami #vivo pic.twitter.com/SnIKUuwnXU
2019-08-06 10:08:25,"Donald Ttump is ""watching Google closely* b/c  mass shootings & gun violence are rising, stock market tanking,  economy is in peril, Iran is pissed, white terrorism rising, farmers are bankrupt, retailers are closing, kids are caged... he's monitoring google.🤬"
2019-08-06 10:05:12,.@SEC_Enforcement Add this one to the file. Trump is trying to manipulate the stock price of @Google now.
2019-08-06 10:02:57,"Trump’s week:  Mass murders, stock market crashing, farmers going bankrupt...and he’s tweeting about Lou Dobbs and a google conspiracy story cooked up by a disgruntled worker associated with The Golden State Skinheads."
2019-08-06 09:56:42,FYI. YIPPY is a search engine in competition with google. Stock is at .30 CENTS per share. GOOD TIME TO BUY
2019-08-06 09:53:51,*buys stock in Google
2019-08-06 09:53:00,Are you watching the stock market?  Who’s fault is that?  Google’s?
2019-08-06 09:49:33,GOOGLE BERMUDA HCs: $20 Billion a year in income goes untaxed offshore into the no-tax haven of Bermuda by this single company on Wall Street  https://lnkd.in/e6quJfH   GoldmanSachs has nearly 1000 offshore companies in no tax havens to trade stock accounts… https://lnkd.in/eJ_MTii 
2019-08-06 09:38:54,"I guess, you got the defected device. Pixels had some lag issues that Google sorted out with the update. It's not the best in the market but I don't think it's that terrible either. Infact, it's supposed to be the fastest phone running stock OS."
2019-08-06 09:11:32,Dumping GOOGLE stock...Using differentvsearch engine. So far thousands in a petition doing the same.
2019-08-06 09:00:38,Tech stocks walloped as China retaliates in the latest salvo of its trade war with the US! . . . . #tech #technology #techstocks #stock #stockmarket #apple #amazon #tesla #google #alphabet #twitter #facebook #tradewar #nyse #software #apps #appdevelopment #technews #consulting pic.twitter.com/vtlj1Jkohu
2019-08-06 08:55:50,"⁦@realDonaldTrump⁩ , without evidence, accuses @Google of 'very illegal' action ahead of election ⁦@HouseDemocrats⁩ must call ⁦@realDonaldTrump⁩ 2 testify under oath 2 proper cmtes w evidence 4 the slander. Attempt to drive stock down?  https://reut.rs/2KsKauX "
2019-08-06 08:42:09,The sources as per my observation is as under: - New demat acct - Comment on Fb post  - Liking a trading page on FB - Downloading apps from google store related to stock market - all the discount/regular brokers with whom we have demat acct sell their user data
2019-08-06 08:40:11,"Pinned to Make Your Blog Well Red - Group Board - Blogging, Digital Marketing and Online Entrepreneur Stuff on @Pinterest: Google Slides Presentation + 20 Minimal Stock Photos & 4 Psd Mockups Included Clean, modern and minimal Google Slides Template. Cle…  https://ift.tt/2MInkCA "
2019-08-06 08:34:17,"Nah, let's check out what you're up to. Golfing while the country needed action against white home grown terrorism. Feuding with China causing the stock market to drop. Confusing Toledo with Dayton. Still stoking hate. Lying to the American people. Taking $ from the NRA..."
2019-08-06 08:34:16,"""RT rebootonline: 📣 ""Another awesome (and super interesting) experiment"" - Backlinko  Take a look at our latest #SEO experiment to find out if Google will rank you higher if you use unique images in content, instead of stock images: …  pic.twitter.com/Hadz3vADsN"""
2019-08-06 08:34:14,If u google search michi’s photos it’s an endless rabbit hole of weird stock photo looking shit
2019-08-06 08:31:30,VERY BRAVE AND DANGEROUS FOR  ENGINEER TO COME FORWARD AND SPEAK THE TRUTH ABOUT GOOGLE!  BTW WHATS UP EITH BEZOS BIG DUMP O F STOCK?  WHAT IS HE UP TO?
2019-08-06 08:27:40,Google just purchased Fossil (the watch company for those of you who don’t know and don’t use google) stock prices about to shoot up.
2019-08-06 08:06:07,Google female bullying and just see the first few stock images that come up loool
2019-08-06 08:01:31,"CNN: The killer was inspired by Donald Trump  TRUMP: CNN’S FAULT  (performs Google Search) Stock Market Crashes; Trump’s Popularity Plummets  TRUMP: GOOGLE’S FAULT  INTERN: Sir, I have some bad news. Most Americans believe Obama is smarter than you  TRUMP: (shoots intern)"
2019-08-06 07:57:55,Time to short @Google stock? I hope not!  pic.twitter.com/BV0Z26uPG3
2019-08-06 07:48:01,"📣 ""Another awesome (and super interesting) experiment"" - @Backlinko  Take a look at our latest #SEO experiment to find out if Google will rank you higher if you use unique images in content, instead of stock images:  https://www.rebootonline.com/blog/long-term-duplicate-image-experiment/ … pic.twitter.com/hIDwsyCPA1"
2019-08-06 07:21:37,That is my issue google has backed itself into a corner for years it was about stock Android now its the camera thats all google promotes. And for me thats not selling me
2019-08-06 05:51:44,"You're so pathetic! Our country is in mourning, North Korea launching more missiles, the stock market is tumbling but please keep us all informed about google!"
2019-08-06 05:30:15,Stock markets in a tail spin and you're worried about google and the election get real for fucks sake.  https://twitter.com/realDonaldTrump/status/1158551525817536512 …
2019-08-06 05:19:13,Me fastidia un montón lo complicado que se hace a veces comprar algo que no sea por Amazon. Estoy buscando un reemplazo del cable de mis cascos y la primera página de Google solo con Amazon y la página de la marca sin stock.
2019-08-06 05:15:34,"Largest one day stock loss of 2019, Kim launched two more misles. Domestic terrorist inspired by trump's words. I'm about tired of all this winning. #NotTrump2020"
2019-08-06 04:49:37,Check out stock market drop.  Don’t you want to take credit for that? What a real crook you are Benedict Donald
2019-08-06 03:54:00,"Google has emerged one of the most powerful gatekeepers in the packaged-food world through the need to stock 1300 ""micro-kitchens"" across 70 global office sites 🥨🍫👨🏽‍🍳  https://www.fastcompany.com/90369645/google-snack-buyer-food-industry-powerhouse …?"
2019-08-06 03:52:36,"Responden en un perfecto español. Me indican su web, tienen ubicación física y se ve en Google Maps. Tienen otros coches en stock en su concesionario online"
2019-08-06 03:47:11,They attached a google stock image also to take reference for details but I explained it’s the little things about a dog that give it the personality. Changing it too much would make it a different dog. I personally feel they are wasting their money but it’s up to them
2019-08-06 02:50:16,Stop buying Google stock. Expose the company for bias. @karenfinerman @timseymour @CNBCFastMoney @jimcramer $GOOG https://twitter.com/realDonaldTrump/status/1158551525817536512 …
2019-08-06 02:45:49,I thought Lou Dobbs’ Show was supposed to be about business.  Did he mention the tanking stock market or the fact that China will no longer be buying US agricultural products?  Or just about how Google is conspiring against you?
2019-08-06 02:44:32,"Those who lay with dogs end up with a flea infestation!!!  I recommend you get rid of your pitbulls & their lie infested ""News"".  While you're busy trashing Google check out their Stock Market Report! Better practice how you will explain that⬇️ to your supporters tomorrow 😁"
2019-08-06 02:44:23,"Majority of American's cried when you were elected.  So what?  Now you are targeting Google?  LOL, let me guess, WE are paying for it, what happened to targeting Bezos?  The stock market dropped terribly today, those trade wars aren't working, never were gonna work. Tax Returns."
2019-08-06 02:23:42,"WB reports like what? Please enlighten me. For my perspective I would suggest typing a few words on Google like Indian stock market crash, falling rupee, shutting down of motor and steel companies, unemployment rate etc. You can pick any source from there."
2019-08-06 02:09:50,Googles investment in communist  China? Technical communism  indoctrinate the masses via deception aka social/political control Algorithm enforcement censoring the human stock  Goal: leftist programming via limited search of right wing content Filter ID remove truth source
2019-08-06 01:58:03,What are doing to protect us against White Supremacy?  What are you doing to fix the Stock Market?  Both of these things you have created.    #BloodOnTrumpsHands
2019-08-06 01:32:57,"The Moral of the same Story, Different Day, is:  “The Major Stock Holders of the Google Platform are Democrat”  The Demo-Media, Manipulates  which SocioPolitical Trends Influences the Public.       “If it runs like google and talks like CNN, it’s a Democrat.”"
2019-08-06 01:29:09,"▶ Will HDFC sustain performance, deliver returns to shareholders? Stock picks from analysts and more from... - Firstpost: Will HDFC sustain performance, deliver returns to shareholders? Stock picks from analysts and more from...  Firstpost…  http://dlvr.it/R9l0sb  GOOGLE"
2019-08-06 01:15:10,Now about the stock market today?
2019-08-06 01:01:58,This Really Chaps My Ass Google  Your Stock Has Increased Ten Fold Since Our Republican Honest President Trump ACCEPTED (THE PEOPLES CHOICE) Job Of Being Our President And Commander-In -Chief. APOLOGIZE GOOGLE!!! Give Your President Trump A Call And APOLOGIZE
2019-08-06 00:26:14,"how ‘bout that stock market, huh? 😀  https://youtu.be/raOtofsjv_w "
2019-08-06 00:16:17,"We just had 2 terror events which were incited by you and your racist views, “your best friend “ Kim just shot more missiles in the pacific,tankers are being hijacked in the gulf, and the stock market plummeted. I think you have bigger problems then google. 🤔"
2019-08-06 00:11:04,You are not going to win unless you make a trade deal.Putin and Kim are not your allies.  Your tariffs are not feeding my family but the stock market is what we depend on. Make a deal or lose election.
