date,tweet
2019-07-08 19:58:25,"It doesn't counter my argument. It says they got it wrong. Then goes on to make another forecast. So where does he forecast stock market highs, continued growth, and record high employment figures and record low unemployment? Do your Google search."
2019-07-08 18:46:20,"I work in cybersecurity. An account that's following tons of people but has few followers is a red flag. Also, you can do a Google reverse image search on their profile pic to see if it's a stock photo, or just one they stole from someone."
2019-07-08 18:15:23,Just google ‘they were beaten by a bunch of 15 year olds’. Stock response from some when the equal pay thing is brought up
2019-07-08 17:48:06,"Stock Picks:  Nasdaq Today: Google-Dish vs. T-Mobile, AT&T and Verizon?  http://dlvr.it/R82mFb  pic.twitter.com/8cOux2lZOO"
2019-07-08 17:13:07,"Amazon, Facebook and Google stocks stumble over antitrust concerns ~ Facebook tumbles on antitrust concerns  ~ Facebook, Google, Amazon lose $140 Billion in stock value on news of federal government investigations @amazon @facebook @google  https://www.cnbc.com/2019/06/03/amazon-facebook-and-google-stocks-stumble-over-antitrust-concerns.html …"
2019-07-08 17:12:27,Do not use stock photography in your Google My Business listing. Google will find and delete stock photos.  https://www.brightlocal.com/?p=40813 
2019-07-08 17:06:30,"For very low cost, Amazon Fire HD 8 works ok, but it's a little bit of hassle to install Google Play Services.  Barnes and Noble have a decent 10 inch Nook tablet that runs stock Google Android 8.1  These are inexpensive, not in same class as the iPad but are much cheaper."
2019-07-08 16:47:38,"Battery life was also horrid, I have no issues with android, if you really wanna stick with it, check out OnePlus or Stock android on google pixel for minimal bloatware and smooth software compared to Samsung."
2019-07-08 16:19:36,"Shaq is one of the ones who was smart with investments (he bought Google stock before Google really took off), and because of his pretty likable personality, continues to earn endorsement deals."
2019-07-08 16:11:11,Google $GOOGL has opted to disappoint 🙄 with a $15.24 loss per share.   The stock currently stands at $1116.35 per.
2019-07-08 15:41:41,"I began with a Google search, of course. I found a few online shops purporting to have it, but most of them were out of stock. One was in Norway and I couldn't find a way to place an order for the U.S."
2019-07-08 15:38:17,"Buenas, pero aunque tengas puesto como galería predefinida la de Google fotos no te deja? No se, yo es que tengo la galería stock como predefinida. Lo que no me gusta, como pasa en otras Gcam, es que cuando hace una con modo retrato te sale las dos juntas, con y sin..."
2019-07-08 15:35:19,Please @Google just make an S10+ with Stock Android. Pixel design has been an abomination since the P3
2019-07-08 15:32:04,@HouseDemocrats How many #Emolumets have been broken by lawmakers? Does anyone own Google stock? BP? Any foreign investment anywhere of any kind? Then you are breaking the law @SpeakerPelosi #DemocratsAreCorrupt #DemocratsAreHypocrites
2019-07-08 14:51:05,"1st page on Google with a copy-paste article about #Tesla stock, now that's some damn good #SEO ;) @Wealthsimple @Google @SEOmoz pic.twitter.com/JrXI9JtWKi"
2019-07-08 14:36:01,google trends wiki  nvidia stock value
2019-07-08 14:32:13,lol wenn man diese tweet bei google eingibt kommt als erste treffer was von msn dot com und zwar ein ~artikel~ mit insgesamt 12 stock fotos und einem sehr kurzen text darüber dass man cyber sex partner nicht beleidigen soll weil es sind irl auch menschen aha ok
2019-07-08 14:19:18,Aw dammit. It’s already up to 30/1. This must be what it feels like to have twiddled your thumbs on Google stock.  https://twitter.com/JoeO670/status/1148290455286800384 …
2019-07-08 14:17:05,Practically a useful phone  1. Fast unlocking with face  2. High quality cameras 3. Amaizing stock software with latest updates 4. Google Goodies that come as usual with pixel devices
2019-07-08 13:30:28,Stock : Sưu tầm Gu Gồ 1 buổi chiều mưa. ( Theo trào lưu stock Google ) Stylist + Concept leader : Nam Thanh  Location : Suối tiên.
2019-07-08 13:13:52,"UPDATE 1-Shanghai exchange curbs bond issuers' use of repos in structured financing - sources  Reuters (Adds more details, background). SHANGHAI, July 8 (Reuters) - Shanghai Stock Exchange is curbing bond issuers from using repurch...  http://twib.in/l/Mx7pXe6Ej9y7  #China #Google #Risk pic.twitter.com/szY3OlCLAV"
2019-07-08 12:02:02,"Maybe data-driven narrative content, like daily stock reports or baseball game recaps...? In that case, Google might not care if it's AI-generated. But I'm assuming Google will do data narrative enough and just bury everyone else."
2019-07-08 11:58:43,"@Google is giving me black & white photos of white people, though I’m trying to filter for black people in the stock photos. Just perfect!🙄"
2019-07-08 11:36:35,"July is UV SAFETY MONTH! 🕶 ☀️We will be featuring a different pair of sunglasses we have in stock EVERY WEEK to spread awareness! WIN A FREE PAIR OF RAYBANS! Leave a Google Review about your AMAZING experience in our office, comment done below and wait to be picked July 31st!  pic.twitter.com/jydtUKtmct"
2019-07-08 11:27:18,"Something is really special about the Google camera. It always manages to surprise me. Take a look at these two shots. Left rm2pro stock, right gcam Now you see those plants on the ground? It's not visible to the naked eye and what i see is relatable with stock image barring..1.  pic.twitter.com/BgQlBtnZO4"
2019-07-08 11:09:22,DID U NOT REMEMBER MY BAHASA PRESENTATION ??? THE ONE WITH BEAUTIFUL WORD ARTS AND STOCK PHOTOS I GOT OFF GOOGLE 😤😡
2019-07-08 10:29:20,"Google-parent Alphabet's stock to close above 200-DMA first time in 6 weeks, but 'death cross' looms   https://hedgeaccordingly.com/google-parent-alphabet39s-stock-to-close-above-200-dma-first-time-in-6-weeks-but-39death-cross39-looms/ …    July 5, 2019@1:46pm  #WallSt"
2019-07-08 10:18:05,▶ Trading Watch: Checking the Numbers on Shares of Hdfc Bank Ltd (HDB) - Stock Visionary: Trading Watch: Checking the Numbers on Shares of Hdfc Bank Ltd (HDB)  Stock Visionary Checking in on the 50-day moving average vs price signal for Hdfc Bank…  http://dlvr.it/R81XlP  GOOGLE
2019-07-08 10:14:43,Want to invest in Google? Don't want to spend $1100 per share? Check out stock bits from Sofi Invest! Hey! Open an active investing account with $25 or more and we'll both get $25.   https://www.sofi.com/share/invest/112986 …
2019-07-08 09:40:59,If the Feral Reserve bought Treasury debt and the Treasury got excess money supply from the Federal Reserve The stock market would probably drop enough for Google users to buy the stock.
2019-07-08 09:31:50,Another year where Google shows that they care nothing about hardware specs and still charge flagship price for stock software in a glass and metal housing
2019-07-08 09:30:46,"Hi guys i’m selling Google Pixel XL, Google Pixel 2XL and Google Pixel 3XL. Semua ini ready stock and condition 100% 👍🏻  pic.twitter.com/ynmkxKx9zz"
2019-07-08 08:57:50,"Get on board before the wild chase for shares begins. For all the people who said, ""I should have bought into that tech stock like Google way back when."" This one could be just that.. My estimation is Tautachrome is about to hit one out of the park with Arknet!!!"
2019-07-08 08:29:45,"Google ""indian Stock market"" to understand budget better"
2019-07-08 08:16:25,Why does this picture look like a stock photo for when you Google 'Nigerian woman'  https://twitter.com/VictorMochere/status/1148196571034587136 …
2019-07-08 07:50:24,"Motorola was acquired by Google, then sold to Lenovo (China) who lost smartphone market, but PCs. Motorola once = Nokia now. Those were the time when motorola offered good specs with Stock Android, which is Nokia now but with better camera."
2019-07-08 07:01:19,"@sundarpichai -Hai,GOOGLE's Innovations for BankingTechnology&Smart Stock Markets is Needed,Can V expect ,Cloud Banking(Smart Intelligent Banking)&Cloud Stock Exchange(Smart StockMarket Exchange Systems),Can V expect NewConcepts,Except the Same 40Years Old Artificial Intelligence"
2019-07-08 06:33:14,Also a quick Google reverse image search for that particular photo suggests it is probably a generic stock image - maybe even from an earthquake in Papua New Guinea.  https://images.app.goo.gl/8idWabgWvCozVCcG7 …   Doesn't look particularly like the terrain of southern Iran.
2019-07-08 06:17:04,FYI - profile pic is a stock photo taken off Google images.
2019-07-08 06:13:07,hahahahaha i remember when i worked at a chippy and the owner explained that none of the pictures were even his own food they were just stock images off google lemme tell u i felt fucking LIED to 😭😂  https://twitter.com/SpottyLen/status/1147971515985616897 …
2019-07-08 05:23:16,Is it not fair that I don't have google/apple stock from the ipo?  I can still buy it and use the products but I'm not also rich.  So unfair.  pic.twitter.com/1iENOUl7iF
2019-07-08 04:11:48,How GOOGLE Is MANIPULATING Tesla Stock | Media Bias Exposed  https://youtu.be/QasKFYPMv2A  via @YouTube
2019-07-08 03:49:26,Looks like @darshanvmehta1 is so keen to buy this stock. Is this tweet also considered a negative article from you!! Google maps rely much on users and some idiot has used his mind to plot a #yesbank ATM on map in ocean. Is this an issue to you!!
2019-07-08 03:44:52,Monday......  *insert shite motivational quote*  Use stock photo from google images
2019-07-08 03:05:10,"They should see Bitcoin as investment and must compare it with other investments.  1 Google share is $1000 but you CANNOT buy less  1 Apple Stock is $200, u CANNOT buy $50 only  1 house is $200,000, u CANNOT buy $100 worth of it  Luckily, you can buy $100 worth of Bitcoin today"
2019-07-08 02:10:41,"1. Check the number of following/followers they have; it's generally a very low number.  2. They just signed up within the last few months or so.  3. You can reverse Google their avi to see if it's a stock photo. Most times, they don't have a photo posted."
2019-07-08 01:55:51,Always a Learner ... 🙏 Learning since 2008 Via Google & Personal Experience  I am a Good Observer and that's my Edge in stock market...  What's your Edge in Stock Market. Let us know in comments ..👇 #Learning #LearnEarn #observer #price #chart #barchart pic.twitter.com/UmShqE1UzK
2019-07-08 01:34:53,"That’s where Litecoin comes in 😉.  Really though, people “miss the boat” on lots of different things in life. Bitcoin will still be a favorable hold over the USD inflation-wise whether you purchase it today or in 10 years. Just like owning a Google stock can still make you $"
2019-07-08 01:06:49,Google Sheets for Stock and Portfolio Monitoring   http://www.stanleysuen.com/2018/03/google-sheets-for-stock-and-portfolio.html …
