date,tweet
2019-07-07 19:59:06,"Selling stock has no effect on the company. Stock is just ownership of the company, and not money or assets the company uses, and selling stock just means someone else is buying it. Google stock could literally go to zero and it would have no effect on the income/costs of Google"
2019-07-07 19:44:25,Remember the executive order. Google will lose everything trust me @realDonaldTrump already knows this & so does Google hence why Soros sold his stock and why ES resigned. Sadly for them that won't save their money. I wonder what we are going to do with all that dough. #MAGA
2019-07-07 18:56:58,"Android since 2014 follows strict design called Material Design. In 2018 MD2 is introduced, if you never use Google apps that's why you find Stock Android ugly, because you don't have lot of contact with Material Design."
2019-07-07 18:27:23,"Con la salvedad de que no demostraron ser mejores sino solo practicar dumping en USA.con la guita de Google, Bezos y Goldman Sachs. Cosa que en Argentina se lo ahorraron. 2 cosas: Crecen en paises sobrevaluados  donde el stock de autos particulares al pedo es grande y en recesion"
2019-07-07 18:18:27,Google to Add Stock Image Label and Filter to Google Image Search  https://www.stockphotosecrets.com/news/google-stock-image-label-filter.html …
2019-07-07 18:10:55,"IAM Platform Curated Tweet:  #TopInfluence Google parent Alphabet's stock to close above 200-day for first time in 6 weeks, but 'death cross' looms -  http://ForexTV.com  -    https://blog.iammarketingmedia.com/google-parent-alphabets-stock-to-close-above-200-day-for-first-time-i …..."
2019-07-07 18:09:47,"There’s for sure pros and cons for both. But I just feel that if I want to see how news affected a stock quickly,I’ll turn to google for a 1 Day overview,if I want to see historical performance, I’ll boot up ToS. Google Finance has always been a “what’s happening now” thing to me"
2019-07-07 18:07:43,Definitely Google stock photo  pic.twitter.com/wO5sInVZrA
2019-07-07 17:48:06,via Google: Where Will BlackBerry (USA) Stock Be in 10 Years? - The Motley Fool Canada  http://dlvr.it/R7zWFv 
2019-07-07 17:42:04,Google @SteveBurtch or “Steve Burch” luck hockey 40%.  Then apologize after you read the articles on the subject
2019-07-07 17:40:45,"sorry i’m jamaican, we dont use stock. i watch my family cook, the gravy makes itself as u cook. we wont be able to agree. also google was created by a white man, he wouldnt understand my caribbean background."
2019-07-07 16:56:22,"*BREAKING* Google parent Alphabet's stock to close above 200-day for first time in 6 weeks, but 'death cross' looms  http://www.marketwatch.com/news/story/google-parent-alphabets-stock-close/story.aspx?guid=%7B996D8102%2D5F5A%2D4015%2DA93E%2D68808A5E3441%7D&siteid=rss … #finance pic.twitter.com/7jKo4Dr9aj"
2019-07-07 16:37:21,"Google parent Alphabet's stock to close above 200-day for first time in 6 weeks, but 'death cross' looms Google parent Alphabet Inc.'s stock rose 0.7% in afternoon trade, putting it on... -  http://feeds.marketwatch.com/~r/marketwatch/marketpulse/~3/a4LqK1zYAC4/story.aspx …"
2019-07-07 16:34:49,@kronaby I know that the app has a camera function because of compatibility of all the android cameras. But does it work with the stock google camera for example on the Pixel? thanks in advance!
2019-07-07 16:17:53,you can reverse search a google image for like basic things/to see if they just pulled a 'stock' photo off google :)
2019-07-07 15:09:02,$Nke on Google is nike stock.
2019-07-07 15:05:21,I think I found my new favourite stock photo guy on google.  pic.twitter.com/ES6ldmRAG1
2019-07-07 14:50:26,"If Disney was doing them they wouldn’t include stock photos easily found by google. They’re fake, but it’s the usual brigading suspects, not Disney.  https://twitter.com/hasanthehun/status/1147922346503626757 …"
2019-07-07 14:30:05,HAP BIRF! Here's a stock photo of a cake I found on Google Images!  pic.twitter.com/jjo3ibTHql
2019-07-07 14:24:23,"Search ""EU Switzerland"" in Google News and it will come up with many stories from this week about their rift. It's all over new sanctions. Switzerland has just banned EU from trading on Swiss stock exchange."
2019-07-07 14:19:26,"Assets don’t have to be tangle in order to amass wealth.. assets can be a folder full of documents. It’s the stock options, the 401ks, the online business l.. it’s the modern way of amassing riches.. so start that website and start collecting from those google ads!!"
2019-07-07 14:18:56,"Oh man...on a similar tangent, if I had known anything about the stock market, I would've bought Apple or Google stock 15 years ago, when shares were under $20."
2019-07-07 14:12:49,I've just reported the map to Google as it contains personal information see if they remove it
2019-07-07 14:11:29,"Infra red nasal probes....check them out on Google, see nice overview,  been using mine 10 years, really helps and yes I find it helps with allergy related insomnia.  Lloyd's and Asda usually stock...I'm on my 3rd unit...use mine twice a day minimum."
2019-07-07 12:21:40,Bruhhh 😂 as soon as I unload some of this Google stock!
2019-07-07 11:51:57,People still complain about using stocks in 2019.   yall ought to get your heads out of your asses. downloading a full template too using a stone texture or a smoke stock from google images is very different.  This now renders all your plausible arguement statements as useless.  https://twitter.com/ApsxsUS/status/1147874754961051658 …
2019-07-07 11:26:56,"There was a recipe in the tesco magazine using pulled bbq jackfruit. This isn’t available online when I search for it, so I assume the local warehouse doesn’t stock it. If I google it, it comes up with this  pic.twitter.com/A9f1Gwyw2g"
2019-07-07 10:42:32,I saw that. What’s imminent is how this interview article pushes goog stock ? Down $90 like last time ? It appears his investigation is focusing on google only - hawkish view
2019-07-07 10:41:42,"Why do most stock sites (e.g. Google) show the 1-day view by default? It's more exciting, but it's a terrible way to look at a company's performance and a dangerous way to invest. Google doesn't even shift the % change when you switch to a longer view.  pic.twitter.com/WXaYFtHQ74"
2019-07-07 10:33:28,Google. Best for free stock pics.
2019-07-07 10:01:20,"Time ada stock haritu duit takde, ni dah ada duit kasut pulak takde aihhh, tu aku tak pernah tau pulak, banyak kali jugak try search kat google kot kot ada keluar"
2019-07-07 09:43:45,"#Nokia 4.2 With Stock Android 9.0 (Pie) It's got it all. And more, with the Google Assistant. Buy now with Easy EMI starts at ₹1,299/month* All Finance Available Visit our Nearest Store Today!! #sambhavmobiles #smartphones #nokiaandroid pic.twitter.com/olKtmaKa7E"
2019-07-07 09:08:17,Oneplus 7 Pro Google Camera Vs Stock Camera  https://whatgearnews.blogspot.com/2019/07/oneplus-7-pro-google-camera-vs-stock.html …
2019-07-07 09:05:14,Google search the stock photo and you will get results of full rez photo.
2019-07-07 08:59:08,"@sundarpichai - Hai Google Executive, After the Technology of Quantum Computers, What will be the Status of Bitcoin Stock Markets , whether,  it is also going to Turn Quantum Bitcoin and what about the Security for Quantum Bitcoin (Quantum Security)"
2019-07-07 08:36:06,Oneplus 7 Pro Google Camera Vs Stock Camera  https://whatgearnews.wordpress.com/2019/07/07/oneplus-7-pro-google-camera-vs-stock-camera/ …
2019-07-07 08:22:49,"💥 CUPONAZO 💥 ✅ Enchufe Inteligente Mini Salida WiFi - VOION Conector Inteligente Funciona Con Amazon Alexa, Echo, Google Home, IFTTT, No Requiere Hub, 16A Para Elect.  ❌ PVP: 42.99 EUR ♻ Precio reaco: Sin stock 🔥 Precio oferta: 15.5 EUR 💥 🎟 CUPÓN: IBP9TKOX  💳"
2019-07-07 08:09:18,Oneplus 7 Pro Google Camera Vs Stock Camera  https://cosmichemist.tumblr.com/post/186114611480 …
2019-07-07 08:02:16,From Discover on Google  https://economictimes.indiatimes.com/markets/stocks/news/why-it-may-be-downhill-from-here-for-stocks-in-2019/articleshow/70112153.cms … Stock market likely to crash in 2019
2019-07-07 07:47:15,"Lol bkn kene tngkap byk gmbar bru jd cantik. Google mmg dah ad byk stock data gmbar bknnye AI tu blajar drpd gmbar yg kita tngkap. So dgn gmbar2 tu la dia produce gmbar kita tngkap jd cntik tp klu mmg xpandai angle n edit, still xcantik jgak"
2019-07-07 07:40:28,Oneplus 7 Pro Google Camera Vs Stock Camera  https://www.whatgear.net/technology/oneplus-7-pro-google-camera-vs-stock-camera …
2019-07-07 06:46:55,"[Help RT]  Stock Clearance (from MX Concert) *Limited Stock* 💜Open reservation for Group, I.M & Hyungwon Transparent Handfan. 💜Pick up and pay during #MXMBBMODE @MXMBBMode Price: RM 6  x 1 set RM 10  x 2 set   please fill in this google form:  https://forms.gle/13ofZdAow67Zjjc99 … pic.twitter.com/8TTHXFprWi"
2019-07-07 06:34:30,Oneplus 7 Pro Google Camera Vs Stock Camera   https://www.whatgear.net/technology/oneplus-7-pro-google-camera-vs-stock-camera …
2019-07-07 06:34:30,Oneplus 7 Pro Google Camera Vs Stock Camera   https://www.whatgear.net/technology/oneplus-7-pro-google-camera-vs-stock-camera …
2019-07-07 06:30:28,"If You Still Need a Reason to Buy Google Stock, Take a Look at AI  http://zpr.io/gJrY9  #business #news #money #investment #moneyworksmagazine"
2019-07-07 06:02:17,And that's a stock photo from Google 🤦🏾‍♂️
2019-07-07 05:10:19,I own my #Pixel2XL now a year. Fuck this thing has huge burn in issues. @Google everything I have on screen that belongs to the Stock UI HomeScreen is burned in. I see that every time when I have a white Background. Or if I restart my phone lol  That's definitely a downer
2019-07-07 04:36:46,#BoloGuruji  Gcam apk  is better than stock  camera (except google).. really capture good images  Then why it is not available on play store??
2019-07-07 04:28:24,"Google maps is the publisher. Might be worth a try.   Collier has provided the 'evidence',  screenshots, that can be easily faked.   Here's one I did...  pic.twitter.com/1q6jTucMBR"
2019-07-07 04:12:16,That's shocking.    Is there a way to get Google to take the map down?
2019-07-07 03:16:27,If you want to take extremely low light photos then use Pro mode of Nokia stock camera or use Google Camera app. Here is some samples First one is Captured by pro mode of stock camera #Nokia_8.1 and second one is by Gcam Night sight mode @sarvikas @NokiaMobile @NokianChetan pic.twitter.com/xGXyUPnsyA
2019-07-07 03:11:14,Wait because Nokia Working on new camera App which have night mode feature . If you can't wait then try pro mode or use Google Camera app Here is some samples First one is Captured by pro mode of stock camera and second one is by Google Camera Night sight mode  pic.twitter.com/AZsI6pk2pH
2019-07-07 02:58:08,Let’s see how it works out for you. 👍👍. So far triggered right wing protests have increased the stock value of the products y’all boycotted. Google it 😎😎
2019-07-07 01:54:03,why does this look like stock photos from google to me 😂
2019-07-07 00:04:52,“the stock market” google search has me fucken crying  https://twitter.com/jackdwagner/status/1147404593057288193 …
