date,tweet
2019-05-27 19:55:39,"Lol. K. You can look up their stock value but can’t google [a free to use resource]  what “toxic masculinity” is.   Stay ignorant, that’s not my problem."
2019-05-27 19:19:52,Hahhahaha she must own stock in Google hahah  https://twitter.com/drmistercody/status/1133150551841972224 …
2019-05-27 18:07:24,"Google'a ""şeytan eli"" falan mı yazdın? Bari daha yüksek çözünürlüklü ve ortasında stock photo ibaresi olmayan bir şey bulsaydın. Azıcık gayret."
2019-05-27 17:35:20,Why do stock photo websites keep coming up on Google Image Search when you are searching for info on your own photo of a sculpture? Plus they have annoying watermarks and they expect people to pay rip off prices for them!
2019-05-27 17:27:48,Stock & Stable on #Google  https://local.google.com/place?id=10546519931383663128&use=posts&lpsid=997758231772116268 …
2019-05-27 17:01:29,Stock & Stable on #Google  https://local.google.com/place?id=10546519931383663128&use=posts&lpsid=561562856233653337 …
2019-05-27 16:39:34,"Google discounts Pixel Slate by $200, Core m3 now $599 & Celeron still out of stock - 9to5Google  https://9to5google.com/2019/05/26/google-pixel-slate-discount/?utm_source=dlvr.it&utm_medium=twitter … pic.twitter.com/War6vQ3S0i"
2019-05-27 15:55:15,"pedrin, não sei se ainda existe mas... tinha um lugar na rondon, perto de onde é o gabarito agora, que vendia! Na tock stock deve ter... Mas acho válido você digitar no Google ""puffs em uberlândia"", certeza que cê vai achar algum lugar hahahahah"
2019-05-27 15:32:41,remember that time that my ex was ignoring me so i got a positive pregnancy test stock image from google and told him i was pregnant
2019-05-27 13:49:56,I checked also the @GoogleStore for their Google tablet - out of stock for months now. Unless you get the pricier iterations ($1000) + $200 for a shitty keyboard. So no thanks. Also #Googleisevil
2019-05-27 12:42:28,"I didn't know LuchaSaurus before seeing him on #BTE but this guy looks like an Adonis and a quick google show's me he is also a good looking fella, at 34 a lot of stock should be put into this guy real quick.  Marko Stun is the missing baby face link in professional wrestling."
2019-05-27 12:29:29,Bruh if u want a avi u need a real 2D and 3D png of it. Not a google stock png image.
2019-05-27 12:06:54,"If #Uber turns into the high-growth tech stock of bull analysts' dreams, the #ridehailing company could disrupt the longstanding acronym of FAANG  #Facebook #Apple #Amazon #Netflix #Google #IPO #startup #innovation #GigEconomy #FutureofWork #startups https://www.businessinsider.de/tech-analysts-conflicting-names-faang-stocks-with-uber-2019-5 …"
2019-05-27 11:57:32,Shedding Some Light on Scientific Digital Imaging plc (AIM:SDI)'s Stock Health as FCF Hits 1.142516 - Chandler Caller  http://dlvr.it/R5WC5j   (Google News)
2019-05-27 10:34:35,.christian dior   hoping to stock luxury rags in the coming weeks.   let’s pray for racks 💰💰💵💵  —- don’t forget to pass through our shop this week   📍GEO TAG : sneaker hub [ uber / google maps ]   we are located at…  https://www.instagram.com/p/Bx-DFfdJWpI/?igshid=2ddgex61iuo9 …
2019-05-27 09:58:58,"Another instance where Google Camera completely outperforms the stock camera! The second image is straight from GCam, untouched.  I always keep it on HDR+ enhanced. Google Camera always shines when it comes to handling harsh dynamic range!  pic.twitter.com/45SjCW4H6j"
2019-05-27 09:57:01,they're cool with using stock photos though.   Google thinks this is Texas  https://www.google.com/search?tbs=sbi:AMhZZiuoOZt7kYvBI8rD5w67UVCHwNO_1o5eVHKCllM1-cj5iKTc7S8yNS8xAV4kmoXxcxISXo2gqViDRk_15fuHeQRFFpiYgNx3ctO2almzEyALXkJXmRp81kYDlPEHuXnJyota7HthBvzGAM22OFLjSPQje9tm-0DqJ6IyF3n_1Fo4TXmS1iPNsExuAmT-VoHygsrkhkeiLdMZytruoA9cb6x2EgoVRYVurHcq2BjBCtPvSgD3C7nHGm8TGcllmmOIcTBFPAgNOMCbxnITH6WK5le9iLjE_1nUi-tAvrwvIpUgbUU5bSLLIEGxn104Cozs-mwT_1vnQADuguQfr5s499oy3HiKyUGrOpg …
2019-05-27 09:35:05,I hope Google Play/YouTube Music also comes to Alexa this summer or I’m gonna need to stock up on Google Home Mini 2s.  https://press.aboutamazon.com/news-releases/news-release-details/amazon-and-google-announce-official-youtube-apps-launch-fire-tv/ …
2019-05-27 09:18:59,Why google must bann Huawei? Is that true google is owned & run by US gov? I believe that    not all stock holders of google agree US gov
2019-05-27 09:11:35,Man the device which were sold and still in stock will not be affected but yaa you won't get android updates from Google but huawei will release security updates normally and you will also get play store updates
2019-05-27 08:36:17,"Why isn’t there Pork stock cubes? There’s chicken, veggie, beef but not the most flavoursome meat of all? I’m sure I could google the answer if I had the energy"
2019-05-27 07:33:24,"Morning Steve,   Thanks for dropping me over a message, I hope you're having a nice bank holiday weekend.   Oh right, if the Google Home Hub currently out of stock, we'll not starting billing you for it until it's dispatched and delivered to you :) - Mark J"
2019-05-27 07:30:13,@EE Hi I added a Google Home Hub to my plan yesterday and got an email saying they're out of stock. I'm assuming I won't start getting billed until I receive it?
2019-05-27 05:47:17,Still on my favorite referrals  and one of the best things I've ever found them Google is getting this free stock  and everybody that signs up its free stock so it's awesome.I said people…  https://www.instagram.com/p/Bx9iN0XA91npdIT-5D2TWjfBrDzYlISMmfHYJI0/?igshid=1ht3wsg4duwf7 …
2019-05-27 05:25:40,I didn’t know she bribed her way. What can I google to learn? I googled Nancy & the Stock Market. Plenty of crime there. WWG1WGA
2019-05-27 04:32:35,"O la peña lee lo que quiere o tenéis un problema Huawei tiene un contrato con Google y los terminales vendidos y en stock seguirán funcionando igual, los futuros terminales tendran su propio OS... No se acabaría el mundo ni nada por el estilo."
2019-05-27 03:59:20,@Google enregistre tout ce que nous dictions à notre téléphone et le stock. C'est ici sur votre compte que vous pouvez retrouver toutes vos phrases avec votre voix en plus. :  https://myaccount.google.com/activitycontrols … #stopespionnage pic.twitter.com/F46tX6E9iG
2019-05-27 03:02:30,"Google discounts Pixel Slate by $200, Core m3 now $599 & Celeron still out of stock  http://bit.ly/2ManHqF  #925 pic.twitter.com/ymZYOsFcLU"
2019-05-27 02:21:05,"If I recall correctly, the Bass Library was not where most of the current scholarship was shelved, but was more like a grand “Everyman’s Library”, with classics and somewhat older stock that might very well be found on google books."
2019-05-27 02:11:21,Pixel 3a XL: Google's latest entry to the midrange smartphone market. Vanilla Android - pure stock google rom for those Android purists. Optimized Performance - Can give you a seamless performance even with just a Snapdragon 670 due to Google's optimizations.
2019-05-27 02:07:05,The SS Journal: Google Sheets for Stock and Portfolio Monitoring  http://www.stanleysuen.com/2018/03/google-sheets-for-stock-and-portfolio.html?spref=tw …
2019-05-27 01:43:36,Google Sheets for Stock and Portfolio Monitoring   http://www.stanleysuen.com/2018/03/google-sheets-for-stock-and-portfolio.html …
2019-05-27 01:35:43,Why the last one look like a google stock image 💀💀💀😭  https://twitter.com/ellienkate/status/1132882507630649345 …
2019-05-27 00:29:30,"Global Serverless Computing Market Insights & deeep Analysis 2019-2024: Amazon Web Services, Google, IBM, Microsoft, Oracle, CA Technologies - News Stock Exchange  http://bit.ly/2ECr4R3 "
2019-05-27 00:26:29,Picture is so good it could be mistaken for a stock photo when you search bars with Google images
