date,tweet
2019-05-18 19:14:59,"Such a great question to test behavioral bias...""What company's stock has performed better?""  Interesting poll to test out.  Google is more readily available in memory from a performance standpoint.  #availabilityheuristic @danielcrosby https://twitter.com/charliebilello/status/1129482088955207681 …"
2019-05-18 18:46:34,"Canadian economy is already stronger than it was with the Conservatives. Also google ""old stock Canadians"" or ""un migration pact"" if you like virtue signaling.  https://www.princegeorgecitizen.com/opinion/editorial/conservatives-prefer-symbolism-over-substance-1.23539286 …"
2019-05-18 18:22:14,Agree with your point but I’m curious where the pics came from. Did someone google “sad progressive millennials stock images”?
2019-05-18 18:17:13,@MKBHD is the Google message app better than my stock OnePlus message app which one do you use? On all your Android devices?
2019-05-18 17:00:55,Uhm.  Facebook has gained profits last fiscal quarter of 2018 and profits rose again first quarter of 2019.  This is a simple google to find this out.  Don’t confuse their company stock with profits.  So you want government to make them go out of business cuz you’re mad? 😂😂
2019-05-18 16:23:22,Is the pixel closer to stock android? I know Google makes android but I just want to know. Stock android is the best android 👽
2019-05-18 16:12:51,I swear. Stock Android is so clean and neat. Google native apps are 😍😍😍
2019-05-18 16:05:17,"Al gore wanted a climate exchange like the New York stock exchange to sell carbon credits and make money.   That went belly up (google Chicago climate exchange CCX) b cause congress didn’t pass Cap N Trade.     So, they did the TPP deal to funnel carbon $ to Intl banks"
2019-05-18 15:54:49,google account sell $0.50 stock Available .  skype-hasan626363
2019-05-18 15:47:46,But stock in @RealPhilWalker like its Google in ‘04
2019-05-18 15:43:13,"Google suggests that Sfiha is made from pastry and has a topping. What I saw and ate was made from dough and plain. (I should note that the image I posted is a stock pic of a crumpet, not what I saw in the store.)"
2019-05-18 15:20:28,"AOSP without Google Apps is ""Stock""."
2019-05-18 15:20:01,"Android ""skins"" are the ones who are fragmented... Not Android as whole. Android has it's own ecosystem and its Google's. Huawei have theirs, same with Samsung. When we say Android, we don't use Skins here... Also, hahah... If you will say that then not even Android One is stock"
2019-05-18 15:17:15,Fragmented when other OEMs come into game. Use Google when we talk Android. It's not same when you use Samsung Android and Huawei Android compared to Stock Android. Stock Android is like iOS. Controlled by Google. OneUI is for example controlled by Samsung and Google and carriers
2019-05-18 15:14:15,"Do you even understand how Android is controlled and how other OEMs control Android when it gets released by Google. Stock Android have more features than iOS, more customisation etc etc but it's sent to Pixels day one when newer version or security patch comes out?"
2019-05-18 15:13:09,@madebygoogle how about making a phone that leaves RAM available for using apps? This is Google's flagship device that can't keep two apps open at once because stock Android uses more than half the RAM  pic.twitter.com/hr0mFcYk8m
2019-05-18 14:59:30,Day 31 : I finally built my first Recurrent Neural Network!!.It predicts the future stock prices of Google(2017). It doesn't react quickly to the non-linear changes(spikes) which is to be expected because the stock market usually has random spikes #100DaysOfCode #DeepLearning pic.twitter.com/hLKcM84q97
2019-05-18 14:59:12,Negative Impacts of Black Hat SEO techniques:- Just Unbelievable world's top 12 companies hit with Google Manual Penalty includes Google Chrome and Google AdWards see below another 10  9-The Home Depot.  8-JC Penny.  7-Over Stock.  6-eBay.  5-Genius.  4-Mozilla.  3-BMW.  2-B…  pic.twitter.com/UGSpOv7xHQ
2019-05-18 14:53:40,"Looking for another android phone to replace my Honor View 10 which works but not as fluid and their EMUI sucks. I’ve decided most likely on the @Google #Pixel3aXL than the #OnePlus7Pro too expensive. Good specs, great camera, headphone jack & stock android = great budget phone."
2019-05-18 14:45:45,"This program in Finland is so inspiring. If @facebook and @Google were suddenly inspired to do the right thing for a change, they would embrace and and help facilitate this program internationally. In the long run it is the best thing for thing for their stock holders.  https://twitter.com/DefendDemocracy/status/1129803973706301440 …"
2019-05-18 14:38:21,Negative Impacts of Black Hat SEO techniques:-  Just Unbelievable world's top 12 companies hit with Google Manual Penalty includes Google Chrome and Google AdWards see below another 10 9-The Home Depot. 8-JC Penny. 7-Over Stock. 6-… https://lnkd.in/f8gzYJK   https://lnkd.in/fGm4B25 
2019-05-18 14:29:27,"Wenn du ein Google Konto hast, brauchst du bei OnePlus *nichts* anderes. :) Das Android von OnePlus ist ja ziemlich stock."
2019-05-18 14:25:21,"It's a losing bet. They kept raising the price and now they've gone too far. At the same time, Google finally got it right with the Pixel 3a lineup and we can now get an affordable stock Android phone with a stellar camera. @OnePlus could have conquered that spot, hut didn't!"
2019-05-18 14:03:28,"What if we install a custom ROM ...... I am using a OnePlus 3t in 2019 with a custom ROM and Google Camera. It's just an amazing experience, even now  I get all the security updates (Thanks To The Custom ROM) The UI is stock And the best, the camera with Google Camera is epic !  pic.twitter.com/PcNnbSdwCn"
2019-05-18 13:38:40,"I Absolutely Agree with this selection, additionally add stock google android  https://twitter.com/MKBHD/status/1129723794732539904 …"
2019-05-18 13:27:26,Sanika Stock Market Consultancy & Training Center on #Google  https://local.google.com/place?id=15007517021948509168&use=posts&lpsid=7107345065303569991 …
2019-05-18 12:42:40,$50 Off @  http://geekbuying.com  -  https://www.havasupromos.com/50-off-geekbuying-com-50/ … - $50 Off for [ES Stock]TicWatch C2 Smartwatch Wear OS by Google
2019-05-18 12:39:30,"Good point. Curious which CEO's are outspoken Democrat vs. Republican. FB, Amazon, Netflix, Google, Twitter... These are just ones topping our stock market. How about others like the auto and insurance industry, food giants, etc. Coffee, soda and beer industries... Hmmm."
2019-05-18 12:34:33,"TERIMA KASIH YANG SUDAH IKUTAN PRE ORDER LFC TERBARU, AKAN DIKIRIM SERENTAK 20-21 MEI 2019!  *READY STOCK* LFC HOME 2019/2020  GRADE ORI IMPORT  WHATSS APP 083891670159 ATAU KLIK  http://www.bit.do/OrderAnfieldmart …  OUR STORE SEARCH ON GOOGLE MAPS : ANFIELDMART  #YNWA pic.twitter.com/c1tAqtQR3f"
2019-05-18 12:12:54,When you google a stock image to make a meme but the 4th image already has you covered!  pic.twitter.com/lDTyXfpac6
2019-05-18 12:10:32,Stock andorid di Nokia gua bisa install Google Pixel Camera.
2019-05-18 12:02:21,Lista top 10 de qualquer coisa com stock photo dando zoom e voz do google tradutor é o UNICO conteudo relevante no youtube
2019-05-18 11:51:53,"Good Stock != Good Company  That’s not even to say that Dominos isn’t a better company than Google. But Googles impact is almost immeasurable by comparison.   For example, how much of Domino’s business comes from Google Search, Android, Amal’s etc.  https://twitter.com/charliebilello/status/1129482088955207681 …"
2019-05-18 11:49:24,"Here is your chance to get in on the stock market like I did. +FREE Stock & trades.   **Top FREE Finance App in the Google Play/Apple Store**  Join Robinhood and we'll both get a stock like Apple, Ford, or Sprint for free. Make sure you use my link.  https://share.robinhood.com/casieb12 "
2019-05-18 11:48:53,"Here is your chance to get in on the stock market like I did. +FREE Stock & trades.   **Top FREE Finance App in the Google Play/Apple Store**  Join Robinhood and we'll both get a stock like Apple, Ford, or Sprint for free. Make sure you use my link.  https://share.robinhood.com/casieb12 "
2019-05-18 11:48:48,"Here is your chance to get in on the stock market like I did. +FREE Stock & trades.   **Top FREE Finance App in the Google Play/Apple Store**  Join Robinhood and we'll both get a stock like Apple, Ford, or Sprint for free. Make sure you use my link.  https://share.robinhood.com/casieb12 "
2019-05-18 11:22:22,Never logging into Google account on stock Android ROM? via /r/privacy  http://bit.ly/2WcMGNS 
2019-05-18 10:23:01,"Wondering how u plan to TRANSFORM d way India shops @RajneeeshKumar @flipkart @flipkartsupport. Need an item from Flipkart in Delhi, its been Out of Stock for Delhi Pin Codes since 16 May. What kind of Planning & Forecasting did u do? Ur Helpline 1-800 # DOES NOT WORK FULL 24Hrs!"
2019-05-18 09:44:46,"It was already proven to be pushed by Russians and even the photos of Dems who ""walked away"" were stock photos off of google. Whether it helped or not it proves Russia interfered Right or left  this is fact   https://www.snopes.com/fact-check/walkaway-campaign-stock-photos/ …"
2019-05-18 09:11:33,Stock Google OS?
2019-05-18 09:06:14,Never knew that Domino’s outperformed Google in the stock market 😱📈  https://twitter.com/charliebilello/status/1129482088955207681 …
2019-05-18 08:25:07,"$DPW  Colossal asswipe CEO Milton Todd Ault (google with word #fraud), whose stock is down 99.9% is still calling his common shareholders haters (he owns preferred & has gained ownership at common’s expense) is still playing the victim?  This guy is a 400 lb. scam artist bully?  pic.twitter.com/T8ZzcfB3yu"
2019-05-18 07:44:04,... upwards to today's price if one was to check it out via Google on the stock exchange share price history graph under the max tab! So @Conservatives you may fool yourselves with such fake scaremongering news but you will not fool us or other party leaders ...
2019-05-18 07:42:26,This is fake news by @Conservatives. As everyone will see via Google on Stock Exchange when National Grid was listed / floated in 1995 after being Privatised under then PM John Major in 1990 after Margaret Thatcher its share price was £257.57 per share as at 15/12/1995 & ...  https://twitter.com/Conservatives/status/1129311639403225088 …
2019-05-18 07:20:07,"In this week’s update: Uber’s recent stock market adventures, SpaceX’s launches the first satellites in the light of its Starlink mission, Google Assistant is entering a new phase and the 5G war between Donald Trump and China keeps on escalating.   https://youtu.be/4mb_z63pV14 "
2019-05-18 07:02:21,*ONEPLUS 7 PRO GIVEAWAY*  https://youtu.be/WgC91yLPOlA  <--- OnePlus 7 Pro Google Camera vs Stock Camera + Installation Tutorial + Giveaway!🔥🔥🔥 . Retweet!!!  pic.twitter.com/PzUW1xdGV1
2019-05-18 05:44:51,Chuck Taylor’s x off white   Sz : 39/40/43   🏷 450.00   📍GEO TAG : sneaker hub [ uber / google maps ]   In stock and selling now   Pick up from our store or have it delivered @ a fee @ Trassaco Estates  https://www.instagram.com/p/BxmWxkzJxZd/?igshid=u5l55ipanz5b …
2019-05-18 04:45:28,"🇺🇸 A stock that is not getting the attention it deserves is #Dominos Pizza(orange). Outperforming #Google(green) and #Facebook(purple), but dwarfed by #Amazon(white) $DPZ $GOOGL $FB $AMZN pic.twitter.com/9XJISQ32sY"
2019-05-18 03:47:38,Baidu Stock Slides 16%: Here’s Why China’s Google is Stuck in Freefall  https://tradermeetscoder.com/baidu-stock-slides-16-heres-why-chinas-google-is-stuck-in-freefall/ … pic.twitter.com/GHmaCX13Ew
2019-05-18 02:57:08,Baidu Stock Slides 16%: Here is Why China’s Google is Stuck in Freefall  https://chinawapz.com/baidu-stock-slides-16-here-is-why-chinas-google-is-stuck-in-freefall/ … pic.twitter.com/WdAMMcPBkw
2019-05-18 02:13:04,Gotta love the Google London office - spaces with #personality drive #creativity and #innovation - Google’s stock and trade!  pic.twitter.com/GQc6oSjrp4
2019-05-18 02:08:10,need pa bang mag aral for diagnostic or magbbase sa stock knowledge? — A diagnostic procedure is an examination to identify an individual's specific areas of weakness and strength - Google. Kung competitive ka sure.  https://curiouscat.me/kuyaruzu/post/878265268?t=1558159690 …
2019-05-18 01:31:10,Baidu Stock Slides 16%: Here’s Why China’s Google is Stuck in Freefall  https://newsbuzzz.me/baidu-stock-slides-16-heres-why-chinas-google-is-stuck-in-freefall/ …
2019-05-18 01:21:03,HTC や Samsung 、もちろん Google のデバイスは死なない。 SONY も OK 。あとは Oppo 子会社の OnePlus も Stock Android 指向だから問題なし。 Xiaomi も知ってる限り絶対殺すマン機能はない。
2019-05-18 01:07:59,It’s good but I like to hour to hour forecast on days that are couple days out. Is there a way to do that? Stock Google one could do that. Can stock iOS do that?
2019-05-18 00:39:36,"Love my pixel 3 XL and will most likely not be going back to iPhone, but this finger print sensor... I mean come on Google... The sensor on pixel 4 better come back swinging.. cuz this guy is lacking... #google #pixel #stock #android"
2019-05-18 00:34:16,Google had the same issue in 98 when Yahoo was the juggernaut of the search industry.  Look at google now aka alphabet... I can’t even afford 1 stock. 🤦‍♂️   People. RELAX. Look at how amazing the car is. Yes. Every car has its quirks. And every company has wrinkles. WAIT IT OUT
2019-05-18 00:16:22,You just watch. Mark my words. This will be another Amazon and Google stock. That thing will blow up. Always think long-term. They are completely ahead of the industry. All they have to do is work out the wrinkles
2019-05-18 00:03:33,Good to know! Agreed the stock router is garbage.
