date,tweet
2019-09-15 19:43:27,Search your device model stock rom (i.e: G9xxxx stock rom) on google
2019-09-15 19:40:17,Also type in the model number into Google and then type stock room after the model number of the phone. Just keep looking until you find a room download link for the phone.
2019-09-15 19:16:32,"If you Google the term, you’ll get a lot of great info. A total-market index ETF is a way to invest in the entire market, purchasing it just like you would one stock. You get tons of diversification at very very low fees."
2019-09-15 18:35:24,"It was more that the Duo UI is kind of shitty when you have several dozen accounts, many of which are the same type (google etc). Probs just gonna stock with Duo I guess."
2019-09-15 18:22:15,I was looking for the macOS Catalina stock wallpaper but I ended up typing macos katalina wallpaper into Google.
2019-09-15 18:00:02,"azulinex Google pixel, I have a Google pixel 2 XL and it's my best phone to date but I'd suggest waiting for the 4th one to drop, one of the best cameras on a smartphone, stock Android and free cloud storage"
2019-09-15 17:43:51,"Google pixel, I have a Google pixel 2 XL and it's my best phone to date but I'd suggest waiting for the 4th one to drop, one of the best cameras on a smartphone, stock Android and free cloud storage"
2019-09-15 17:30:31,Vegetable stock?   I don’t want to google it
2019-09-15 16:33:00,aussi vide le cache de temps en temps (si tu ne le fais déjà)  ça peut etre intéressant si tu laisse souvent beaucoup d'onglets de mémoire google chrome stock beaucoup
2019-09-15 16:15:20,Google is your friend.   Maybe you've been too distracted by his hair and socks to notice that he's a laughing stock.  pic.twitter.com/TUSdkHn9vR
2019-09-15 16:03:45,"This is on DU, Pie. I've also had this same thing (last time) on my Pixel 3XL running stock (at the time it was Q beta)"
2019-09-15 15:48:33,What world are you Dumeel idiots living in Sanskrit is Syrian.  No wonder you guys are a laughing stock in the whole country.  You can literally trace the origin of Sanskrit by a single click on Google.  Dumbass periyarist
2019-09-15 14:21:09,I'm afraid the item is out of stock it it says so on our website. You can refer to listings for Google Pixel 3a XL phones that are available here:  https://tinyurl.com/y6kgup7t .
2019-09-15 13:34:41,Laughing stock?? That's rich. The media can't keep UCF out of their mouths. Why don't you Google UCF or Twitter search UCF. Article after Article will pop up. I've been reading tweets all morning that are embracing UCF. Might want to leave the bubble you are in.
2019-09-15 12:35:08,"@CeXSupport Hi, please confirm if there is a Grade A Google Pixel 3a XL in stock? I have it in my basket, but the site says not in stock? Thanks"
2019-09-15 12:33:03,"@Cex Hi, please confirm if there is a Grade A Google Pixel 3a XL in stock? I have it in my basket, but the site says not in stock? Thanks"
2019-09-15 12:29:44,"Just put $2000 in #xrp. If you had known Apple, Google and Amazon would be worth millions, you would have bought the stock. #XRP is selling for $0.25. Get it @coinbase https://www.coinbase.com/join/ellis%20_8?src=android-link …"
2019-09-15 12:29:08,"Just put $2000 in #xrp. If you had known Apple, Google and Amazon would be worth millions, you would have bought the stock. #XRP is selling for $0.25. Get it @coinbase  https://www.coinbase.com/join/ellis%20_8?src=android-link …"
2019-09-15 12:26:37,"photography, landscape, adobe stock, adobe, microstock, mountain, paddy fields, asia, shutterstock di #Google  https://local.google.com/place?id=4806064595638485342&use=posts&lpsid=8468306223256104771 …"
2019-09-15 12:26:11,Dan Gibson's (archaeologist) Mecca videos provide sound evidence to the contention that Muhammad's ancestors hailed from the Great City of Petra (Google in Youtube).  My contention: Adnan came from Idumean/Moabite/Amalakite/Nabatean stock - BAAL Worshippers and enemies of Israel.
2019-09-15 12:20:07,"@SkyCricket:Jack Leach needs to put the Google into his stock of DELIVERY ARSENALS, if he really wants to be a match winner. Otherwise, he'll have be satisfied with just the one or two wickets per innings, or three very occasionally. He needs to be getting 5 to be a match winner."
2019-09-15 12:04:06,"guys i was just informed Litecoin is not a stock! holy crap did everyone else know this!?? LMAO! wow, i ask if you only buy google stock and your response is litecoin is not a stock? good argument for not buying alts there, they are not stocks people, KNOW THIS!"
2019-09-15 11:55:38,"#marketing within my photo stream, google photos has this ad encouraging me to print my best memories. Problem? It’s a stock photo and is not related to *any* of my memories. Except now, when I will use it in presentations as an example of bad marketing. @dflieb⁩ pic.twitter.com/bpNepF2sjf"
2019-09-15 11:50:11,"yes, and that is the time to buy if you have the right resources,, I have enough bitcoins for now and my family does to... if we want to diversify when alts are down i dont know why anyone would criticize this. should i only buy google stock? whatever BTC rules but so does money!"
2019-09-15 10:49:35,explain a dividend with specificity. Don’t google it. When do U have to buy a security in order to receive  dividend How do Dividends impact the value of a share of stock?  There a connection between a company's dividend and its stock price?  How does Dividend Yield work?
2019-09-15 10:33:55,"Baru tau Android 10 ada feature share QR code & password for saved wifi. Jangan ketinggalan sangat please, MIUI dah lama buat. Tech reviewers pulak ayat macai stock android ""thank you Google for this innovation"" my ass."
2019-09-15 10:31:03,Buy Google stock
2019-09-15 10:17:52,📱Download our own Google Play App Now for all Android Devices.📱  Be the first to keep upto date with all our special offers and latest stock.   https://play.google.com/store/apps/details?id=com.bombalicious.bombalicious … pic.twitter.com/LdIeWV9HiP
2019-09-15 09:50:27,"umm u do realize they're not hers right? they were taken from the internet and then she edited them so they'd look like a pair of wings. ik some of the artists that did these, and i recognize the other two pics as stock pics from google"
2019-09-15 08:36:12,Day 41: Constructed my first Rnn. I felt it was a bit complex as compared to Cnn and Ann. Predicted the stock prices of google for a particular month using the previous prices. Hoping to get a greater accuracy next time. Graph shows the prediction. #100DaysOfMLCode #100DaysOfCode pic.twitter.com/cYGMlhuqdv
2019-09-15 08:00:02,"Though hype still remains for Google’s stock Android OS, Xiaomi and Samsung have evolved their skins significantly, and are just as good or even better in some cases.  http://huffp.st/O7a9qcU "
2019-09-15 07:36:02,▶ HDFC Bank Limited (HDB) Sees VMA Increase Over Past 7 Sessions - Stock Minute: HDFC Bank Limited (HDB) Sees VMA Increase Over Past 7 Sessions  Stock Minute Shares of HDFC Bank Limited (HDB) have seen the volume moving average (VMA) climb over…  http://dlvr.it/RD7k6K  GOOGLE
2019-09-15 07:17:24,"Unlimited photo storage, great photo quality, great stock android experience.  At the time I also commuted and apple car play didn't let me use google maps (this might not be the case now)  Google Maps is essential for commuting and Android Auto was a game changer #SwitchtoPixel"
2019-09-15 06:51:02,"▶ Signal Tracker: Parabolic SAR Spotted Above Stock Price for Hdfc Bank Ltd (HDB) - Valliant News: Signal Tracker: Parabolic SAR Spotted Above Stock Price for Hdfc Bank Ltd (HDB)  Valliant News Examining shares of Hdfc Bank Ltd (HDB), we have…  http://dlvr.it/RD7dVC  GOOGLE"
2019-09-15 05:54:02,"▶ HDFC Bank Limited (HDB): Hot Watch to Target - WEB NEWS OBSERVER: HDFC Bank Limited (HDB): Hot Watch to Target  WEB NEWS OBSERVER HDFC Bank Limited (HDB):. If you are considering getting into the day trading or penny stock market, it's a…  http://dlvr.it/RD7WV6  GOOGLE"
2019-09-15 05:30:00,"There will be a change in the ordering process as the google form didn't work very efficiently (wrote 30+ emails to people who didn't respond) I won't be modding mice on comission anymore, but rather build them on stock and sell them in a store."
2019-09-15 05:08:10,"Nö ,hatte bis vor kurzem das Nokia 8 mit Stock Android und bin aufs s10 gewechselt und muss sagen nach dem ich die ganzen Hauseigenen Samsung Apps gegen die von Google ausgetauscht habe ,die Software wirklich gut ist. Kein Vergleich zu der auf'n s7 dass ich mal hatte."
2019-09-15 05:06:02,"▶ HDFC Bank Limited (HDB): Hot Watch to Target - WEB NEWS OBSERVER: HDFC Bank Limited (HDB): Hot Watch to Target  WEB NEWS OBSERVER HDFC Bank Limited (HDB):. If you are considering getting into the day trading or penny stock market, it's a…  http://dlvr.it/RD7R4b  GOOGLE"
2019-09-15 04:53:24,"One irony with polish/continental shops is that I often end up buying traditional English stuff from.then which mainstream uk shops don't stock ie pearl barley , split peas . If you're a timid foodie just have Google translate ready"
2019-09-15 04:48:34,"4k bottles dispatched, with heavy number of booking we are stock'n up to gear up for next level, haven't you still heard of #Wateriia, Download @wateriia App available on google play store, order 100% pure processed…  https://www.instagram.com/p/B2bPu3NlRT7/?igshid=1vcgpj26xxxny …"
2019-09-15 03:22:38,"Is there a difference between ""money relation"" and stock to flow relation of a money? Apologies @evoskuil couldn't find anything on quick Google search"
2019-09-15 03:19:18,"Bro, you can google stats all you like, it changes nothing. End of the day- we are a huge destination club. About to explode. You’re a laughing stock. A burning, sinking ship that people can’t jump off quickly enough. Blues on the up. Criws.... rebuilding."
2019-09-15 03:00:31,Shit looks like a stock google photo 😂
2019-09-15 02:41:15,There's only one that rules them all.. pure stock OS.. Google Pixel 🤩 (updates for sure for next three/four years) Lesser value for money If you want value for money then Samsung or OnePlus
2019-09-15 02:13:17,& then google stock surges  https://twitter.com/BehaviouralMis1/status/1172951071498670080 …
2019-09-15 01:49:56,Je ferais un google doc et vous pourrez reserver tant qu'il y a du stock 💚
2019-09-15 01:49:27,"All Home Depot is also theirs. You can Google for the Villar Group of companies and you'll get the answer there :) All Home Depot is even going for IPO- sa mga friends nyong stock trader, sana iboycott nila to!!!"
2019-09-15 01:29:00,"for some reason google searching those images only lead me to cartoon stock photos, I'm surprised you got to the exact artist like wow"
2019-09-15 01:18:02,Google Sheets for Stock and Portfolio Monitoring   http://www.stanleysuen.com/2018/03/google-sheets-for-stock-and-portfolio.html …
2019-09-15 00:43:32,"This one almost made me think I was mistaken because the stock image they tacked matches the google earth capture,those bleachers are there,the lights tower,and the dome shaped building,I was certain I am seeing ruins from the sat. image,so I was confused until I zoomed...  pic.twitter.com/DQgKZJBZ3U"
2019-09-15 00:19:46,"Depois de formatar 15 vezes, rom stock, magisk, super Su, o meu celular ainda não tá bom ! Desisto jogue a toalha usei bandeira branca até é Google já me mando vc ligou excessivamente na sua conta espere 30 min, hate you MOTOROLA"
