date,tweet
2019-08-23 19:55:06,#Google Photos thinks this stock picture is of a cat. [via  http://reddit.com ]  pic.twitter.com/qNVUlOFUx5 #SEO #SEM
2019-08-23 19:38:37,Focus ST stock exhaust on a Chrysler 200? Via a local exhaust shops google ad  pic.twitter.com/LP0car60no
2019-08-23 18:59:05,Alphabet : Google Puts Curbs on Political Debate by Employees--Update #Alphabet #Stock #MarketScreener  http://marketscreener.com/ALPHABET-24203373/news/Alphabet-Google-Puts-Curbs-on-Political-Debate-by-Employees-Update-29108588/ … pic.twitter.com/ZbE4JRKJ3t
2019-08-23 18:38:56,google teach me stock handling quiero dinero
2019-08-23 18:31:22,"Glad I could excite you, sweetie! This too shall pass. Stock up on viagara now, you’re gonna need it. (Seriously - google it - your diet will lead to some unpleasant outcomes)."
2019-08-23 17:48:04,Look at Gamestop stock on google. This wasn't a random act of corporare greed. #Gamestop is a flaming burning jumbo jet headed straight for an orphanage and GI will be a casualty of its hubris if someone doesn't step in soon.
2019-08-23 17:07:17,chuck taylors x CDG   sz : 37-41   🏷: ghc320.00   in stock and selling now   📍GEO TAG : sneaker hub [ uber / google maps ]   📱: 0200371637  ~locate our shop on the main upsa road close to maxxis tyres!! @…  https://www.instagram.com/p/B1hV-7SJZru/?igshid=1qgi18hqiuvm5 …
2019-08-23 16:44:07,"We saw unprecedented growth under Obama. Just google the deficit on his first day in office to his last to now.  But your man also tanked the stock market today w/that tweet.   My family were US farmers for almost 350 yrs, Reagan got us. I do hope you don’t suffer our fate.  pic.twitter.com/A1Yp9ngcii"
2019-08-23 16:25:37,"Why the people dont read WP of xtz? They believe in marketing? Well so they did in the times of tulips and dot com buble. Only few survived Apple, Ms, Google. Xtz is like MS stock from 90s!!! Tezos!"
2019-08-23 16:15:30,"Is it bad, that when your bro calls and says “I’m dropping by w/ the kids “, That I run out and stock up on all their favourite junk food?  What’s aunt for if not to spoil them.  (Google search Photo credit Linvingoutsiderhebox)  pic.twitter.com/mFvKeZ69aU"
2019-08-23 16:09:25,"took the letters on the right used google translator, turned out to be german. spotted few details of the building, looked like old train station. googled ""old train stations buildings germany"" it showed me a stock image of a similar building.. used google map, Dammtor hamburg  pic.twitter.com/wfo49e82AX"
2019-08-23 16:09:13,"Xiaomi Mi A3 64Gb Disponible, en stock.  Características:  El Xiaomi Mi A3 es la tercera generación de la serie A con la misma filosofía que sus predecesores: actualizaciones directas de Google gracias al programa…  https://www.instagram.com/p/B1hPV2_gdoy/?igshid=y3v3izose375 …"
2019-08-23 15:52:28,"5 year high for Google searches for #recession. This is a good contrarian indicator.  Our economy is strong, unemployment low, wages risings, interest rates going down.  We're still positive for stock markets.  pic.twitter.com/tqznpR03Cc"
2019-08-23 15:43:31,....and what event do you think (I'll give you a few days too Google it) led to Obama inheriting and than fixing the stock market?
2019-08-23 15:38:37,Bear in mind this is Rupert Murdoch David Geffen Apple he owns billions of dollars is stock Google owns YouTube Harvey Weinstein and the list is endless of these participants trying to censor us and Twitter hates me I know they're looking to suspend me for any damn reason..
2019-08-23 15:28:52,Buy as much stock as you can for new start-up companies called google and amazon. And #bitcoins. Buy a ton of those.
2019-08-23 15:26:05,Alphabet : Google Puts Curbs on Political Debate by Employees--Update #Alphabet #Stock #MarketScreener  http://marketscreener.com/ALPHABET-24203373/news/Alphabet-Google-Puts-Curbs-on-Political-Debate-by-Employees-Update-29107422/ … pic.twitter.com/idrZwTcfpA
2019-08-23 14:16:11,"When you Google “disability quotes” you get nothing but these cliches, plus long paragraphs by Stephen Hawking and Helen Keller. It’s like the words version of the disability stock photos problem. Maybe we should develop our own quote collections."
2019-08-23 13:39:40,"💥 CUPONAZO 💥 ✅ Enchufe Inteligente Wifi, TECKIN Inalámbrico Smart Mini Monitor de Energía del Zócalo del Interruptor Compatible con Alexa Echo Google Asistente no se.  ❌ PVP: 24.99 EUR ♻ Precio reaco: Sin stock 🔥 Precio oferta: 16.0 EUR 💥 🎟 CUPÓN: LFFX22I2  💳"
2019-08-23 13:33:05,"...immune to going on the fritz, and multiple backup (methods) are always good in principle! That old police D90 stock is available retail (e.g. @sussex_police's here:  https://www.retrostylemedia.co.uk/product/police-interview-c90-ferric-blank-audio-cassette-tapes …) suggests there may have been significant supplies before change-over! And that.."
2019-08-23 13:23:25,Huh? That's not the reason at all. Truth is that they throw too much bloat in their devices even today.  Not 100% sure but a quick Google search showed that full stock rom for S10+ is of ~4.5 GB!!!  While OnePlus roms are anywhere between 1.5-2GB  That extra 2.5 GB is BLOAT
2019-08-23 13:14:39,Avaricious Google starts the apocalypse  9 pm in Freddy Fazbear's Pizzeria. Benjamin  Blythe reporting for Stock Market station.
2019-08-23 12:49:29,Hey @realmemobiles @realmecareIN @MadhavSheth1 fisrt pic shot on nightsight from realme x's stock camera .... Guess what....second was shot on gcam mod on realme x  @GoogleIndia @Google @sundarpichai  it's just awesome man .....   Waiting for pixel 4   #shotonerealmex pic.twitter.com/IC2gVBDuNO
2019-08-23 12:32:02,Alphabet : Google Puts Curbs on Political Debate by Employees #Alphabet #Stock #MarketScreener  http://marketscreener.com/ALPHABET-24203373/news/Alphabet-Google-Puts-Curbs-on-Political-Debate-by-Employees-29107088/ … pic.twitter.com/PnY3Ahvx5D
2019-08-23 12:25:28,"On Instagram,  I see this a lot ""SOLD OUT BUT WOULD BE RESTOCKING SOON"" 😁😁. ******* Well, according to google, there is a huge difference between the Words""SOLD OUT"" and ""OUT OF STOCK"". ******* ""SOLD OUT” means the…  https://www.instagram.com/p/B1g1u4anNHO/?igshid=1j0yi2fnm4jg …"
2019-08-23 12:21:52,"Well do not put much stock in what yahoo  or Google News tells you unless you check it out for your self Trump's team is 'angry' that A$AP Rocky didn't thank them for involvement in court case, Yahoo reports   https://twitter.com/i/events/1164916313912823808 …"
2019-08-23 12:08:51,"... >>>BREAKING .. >>>DAMAGING ""SECRET GOOGLE DOCUMENTS"" RELEASED TO PUBLIC .. >GOOGLE AT HIGHEST EXEC. LEVEL ""CONSPIRED"" TO SWAY AMERICA'S FREE ELECTION... .. >STOCK AT RISK OF SELL-OFF!!!! ...   https://twitter.com/JamesOKeefeIII/status/1161630412030042112?s=20 …"
2019-08-23 12:05:17,.... >>>BREAKING .. >>GOOGLE STOCK AT RISK....GOOGLE VIOLATED EXEMPT STATUS..INVESTIGATION UNDERWAY ... >>>DAMAGING SECRET GOOGLE DOCUMENTS SHOW ELECTION MEDDLING .   https://twitter.com/JamesOKeefeIII/status/1161630412030042112?s=20 …
2019-08-23 12:02:12,.. >>>>>BREAKING ... >>>SECRET GOOGLE DOCUMENTS SHOW GOOGLE EXECS. CONSPIRED TO SWAY AMERICA'S ELECTIONS..... ... >..GOOGLE STOCK NOW AT RISK OF LOSS .   https://twitter.com/JamesOKeefeIII/status/1161630412030042112?s=20 …
2019-08-23 11:44:26,.... >>>>BREAKING ... >>>DAMAGING GOOGLE DOCUMENTS RELEASED... ... >>>GOOGLE EXECS. CONSPIRED TO USURP AMERICAS FREE ELECTIONS....  ...STOCK NOW AT RISK.... ..   https://twitter.com/JamesOKeefeIII/status/1161630412030042112?s=20 …
2019-08-23 11:33:32,Scientific Digital Imaging Plc (SDI.L): -DI Recorded Above +DI on These Shares - Stock Snacks  http://dlvr.it/RBlyKn   (Google News)
2019-08-23 11:20:45,"*looking over the stock market*  *market drops like a drunk one legged amputee* Me: What the hell just happened?  Google: trump tweeted Me: oh, okay."
2019-08-23 10:54:21,"... >>>>BREAKING ... >>>SECRET GOOGLE DOCUMENTS SHOW ""ELECTION MEDDLING"" BY GOOGLE ... >>>GOOGLE STOCK AT RISK....GOOGLE ACTED AS A EDITOR & ""VIOLATED"" EXEMPT STATUS, OPENING DOOR TO MASSIVE GOVERNMENT INVESTIGATION & LAWSUITS .....   https://twitter.com/JamesOKeefeIII/status/1161630412030042112?s=20 …"
2019-08-23 10:27:12,... >>>>>BREAKING ..... >>NEWLY DISCOVERED GOOGLE DOCUMENTS PROVE GOOGLE'S ATTEMPT TO CONTROL AMERICA'S FREE ELECTIONS...VIA INFORMATION CENSORSHIP ...  GOOGLE STOCK AT RISK AFTER RELEASE OF DAMAGING DOCUMENTS.... ...   https://twitter.com/JamesOKeefeIII/status/1161630412030042112?s=20 …
2019-08-23 10:25:23,"I get that you don't believe any of them because you're too busy worshipping a creeper, but I stand with victims. Despite what any of you have tried to say, you guys have failed to disprove any of them. Sorry, but I'm not gonna put stock in someone who says ""Google disagrees""."
2019-08-23 10:07:04,... >>>>>BREAKING ... >>DISCOVERED SECRET GOOGLE DOCUMENTS SHOW GOOGLE LIED & PERJURED SELL UNDER TESTIMONY.... ..... >>GOOGLE STOCK AT RISK OF HUGE LOSS AS GOVERNMENT INVESTIGATES GOOGLE ELECTION MEDDLING ...   https://twitter.com/JamesOKeefeIII/status/1161630412030042112?s=20 …
2019-08-23 09:52:28,"Want to know how to create your own stock portfolio spreadsheet?  Here is a quick & simple tutorial I made using Google!  Get #tips on #investing in #dividend #stocks, #passiveincome, #money management, and general #finance.   https://www.youtube.com/watch?v=NtC-HA8FP2I … pic.twitter.com/IHgQafcTlC"
2019-08-23 09:38:04,▶ HDFC Bank falls 2% amid management rejig; Srinivasan Vaidyanathan new CFO - Moneycontrol: HDFC Bank falls 2% amid management rejig; Srinivasan Vaidyanathan new CFO  Moneycontrol The stock in last three months shed more than 10 percent.  http://dlvr.it/RBlb0C  GOOGLE
2019-08-23 09:35:25,the monkey picture cracks me up it looks like a stock natural geographic photo they got off google
2019-08-23 09:17:52,hermès necklace   “gift ideas for her”   🏷: ghc 150.00   in stock and selling now   📍GEO TAG : sneaker hub [ uber / google maps ]   📱: 0200371637 @ East Legon Executive Fitness Club  https://www.instagram.com/p/B1ggRHtJ45b/?igshid=1v5akza81m7l0 …
2019-08-23 09:14:58,"✅ Enchufe Inteligente wifi TECKIN Inalámbrico Smart Mini Monitor de Energía del Zócalo del Interruptor Compatible con Alexa Echo Google Asistente, no se.  ❌ PVP: 52.99 EUR ♻ Precio reaco: Sin stock ⏰ Oferta FLASH: 33.59 EUR  💳  https://amzn.to/2n6WwOc  🗣Apunto de agotarse"
2019-08-23 08:59:15,It's a stock feature for Google Pixel devices
2019-08-23 08:01:50,And you have done the same to others claiming that you were able to use there photos when you never contacted them aka that station sign at rakin springs that you swaped over to a stock photo from google
2019-08-23 07:27:27,"The biggest companies on the US stock exchange are companies like Google, Facebook, and Amazon.  What do they have in common?"
2019-08-23 06:45:48,"Moto One Action: The Pros, Cons, And The X Factor -  https://is.gd/X5KBzG  Stock Android User experience The Google-Motorola collaboration continues with the new Motorola One Action. The smartphone runs...  pic.twitter.com/VjmLJHy056"
2019-08-23 05:46:58,"Don’t make yourself a ‘laughing stock’. Download a random pic from google and then call it what ever you like. BTW I made some adjustments to it.   Enough of this tread, I am closing it now. Bye Indian troll.  pic.twitter.com/KH2YANBkSL"
2019-08-23 05:25:46,From Glock Takes Stock: Google Launches Open-Source Browser Extension for Ad Transparency  https://brownglock.com/library/2019/08/23/google-launches-open-source-browser-extension-for-ad-transparency/ …
2019-08-23 04:59:58,"Hands on: Xiaomi Mi A3 review -  https://is.gd/0BvY9G    Two years ago, Xiaomi did the unimaginable—partner with Google to make a smartphone that runs stock Android over MiUI. This was the b...  pic.twitter.com/rMUhOnJ4gN"
2019-08-23 04:29:37,Are you a service provider looking for a market for your inputs? Let us convert your stock to cash in one easy step – just get in touch with us. Just a click away on web -  http://www.ebagropamoja.org  download app from google play store -  https://play.google.com/store/apps/details?id=com.trendpro.ebagropamoja … pic.twitter.com/0DiYizn4pi
2019-08-23 04:28:44,"You still have Google search.  Newspapers Technology section.  If you wanna go old school,  stock broker cold calling your ass about this revolutionary payment technology under $0.30, and it's about to moon.  🤣🤣🤣  pic.twitter.com/u8xO9zKrzp"
2019-08-23 03:44:36,@phonesoldier hey is there any good alternative for Google images?? Finding stock photo have become a pain lately
2019-08-23 03:38:44,"You don't need a trust-less system for assets and utilities. If SEBI etc aren't run by oldies, it is trivial for a stock exchange to issue you digital goods. No different from buying domain names, or having a google account."
2019-08-23 03:28:21,"A light Google Fu later and it seems pretty suspect. However, I've also heard about morphine stock piling as well...  Rumour has it they are planning on using it for lethal injection."
2019-08-23 02:41:08,▶ HDFC Bank falls 2% after management rejig; appoints Srinivasan Vaidyanathan as CFO -  http://Moneycontrol.com : HDFC Bank falls 2% after management rejig; appoints Srinivasan Vaidyanathan as CFO   http://Moneycontrol.com  The stock in last three…  http://dlvr.it/RBkTq3  GOOGLE
2019-08-23 02:19:31,Okay Google..  Are you seriously trying to tell me there are no stock images of people putting their balls on a tech deck mini skateboard?
2019-08-23 02:06:09,"For 100% free stock, like Apple, Snapchat, or Facebook, open an account in the next 24 hours with this code:  https://invite.robinhood.com/dominit133  #stockstowatch #stocks #StockMarket #StockMarketNews #Apple #Facebook #Google #Amazon #RobinoodApp"
2019-08-23 01:51:05,is stock share halal - Google Search  https://www.google.com/search?safe=active&rlz=1C1GCEU_enAU821AU821&ei=lH5fXZP8CtHe9QPyxo34BA&q=is+stock+share+halal&oq=is+stock+share+halal&gs_l=psy-ab.3...3091.3173..3317...0.0..0.0.0.......0....1..gws-wiz.lDnf2GOP1H4&ved=0ahUKEwiTlsKJppjkAhVRb30KHXJjA08Q4dUDCAo&uact=5 …
2019-08-23 01:34:54,What's Google bloat ware?? I thought stock android don't have any bloatware.
2019-08-23 01:27:48,Camera and the stock android experience
2019-08-23 01:20:03,▶ HDFC Bank falls 2% after management rejig; appoints Srinivasan Vaidyanathan as CFO - Moneycontrol: HDFC Bank falls 2% after management rejig; appoints Srinivasan Vaidyanathan as CFO  Moneycontrol The stock in last three months shed more than 10…  http://dlvr.it/RBkKqr  GOOGLE
2019-08-23 00:59:04,"Custom made Collection for a Danish Client for Autumn ! Developed the style just from a Google image sent by our Client, in our mill stock prints....@Indibala pic.twitter.com/Yc7sDxsWso"
2019-08-23 00:48:05,"Prince of Agrabah. Try google, it might help you. Lastly, many factors affect the stock market, not just the state of the economy. For instance US economy is doing really well (FYI downturn will start in November) but stocks are flat over the past year because Trump is a tool.  pic.twitter.com/wJ5m5mT4ga"
2019-08-23 00:36:36,"im just saying bro, there's enough historically black universities on this planet for us to at least have a decent amount of black student stock photos on google - even if it's the same five niggas doing different shit. my landing page finna look unseasoned now, meh."
2019-08-23 00:31:20,25 Sites Where You Can Get Superb Free Stock Images  You always need free stock images for your blog or social media The days of using Google Image Search to find images to download is over. ... Free #publishing and #writing advice. http://rviv.ly/WCPiXm 
2019-08-23 00:25:17,Larry Page & Sergey Brin founded Google. They own 14% of the Shares and 56% of the stockholders voting power through super voting stock. source: Wikipedia.  pic.twitter.com/khPUXeUkVY
2019-08-23 00:22:09,Buy Google stock and NYC property.
