date,tweet
2019-05-26 18:51:45,"Spot the person who has never used a mobile keyboard in their life.   Hint; It's @mtracey  Look darling. Most of us who have used the stock @android keyboard from @google, the @SwiftKey from @Microsoft, or the #Abomination from @Apple are used to spellcheck not working."
2019-05-26 18:27:24,"You remember their shirt sponsors AIG? That 'iconic' kit? Google them and their links to the 2007 stock market crash, American International Group"
2019-05-26 18:14:34,@Google Stock Valuations Illustrated & Warren Buffett Books  #Buffett #audible #amazon #walmart #barnesandnoble #google #bing pic.twitter.com/6W7a8PswR0
2019-05-26 17:35:03,"Google discounts Pixel Slate by $200, Core m3 now $599 & Celeron still out of stock - 9to5Google  http://dlvr.it/R5St5H "
2019-05-26 17:31:13,"here is a stock art photo i found when i did a google image search for ""dejected frog""  pic.twitter.com/nByWJrjbwJ"
2019-05-26 17:01:02,25 Sites Where You Can Get Superb Free Stock Images  You always need free stock images for your blog or social media The days of using Google Image Search to find images to download is over. ... Free #publishing and #writing advice. http://rviv.ly/WCPiXm 
2019-05-26 16:58:51,"Google discounts Pixel Slate by $200, Core m3 now $599 & Celeron still out of stock  https://www.chromegeek.com/google-discounts-pixel-slate-by-200-core-m3-now-599-celeron-still-out-of-stock/ … pic.twitter.com/Yivg7sw1kr"
2019-05-26 16:44:44,"Los teléfonos de #Huawei actualmente en uso, así como los que están en stock podrán continuar usando los servicios de #Google con normalidad.   Fuente: Huawei Mobile Mx  pic.twitter.com/6tA2dsF0uy"
2019-05-26 15:47:36,"Google discounts Pixel Slate by $200, Core m3 now $599 & Celeron still out of stock  https://9to5toys.com/2019/05/26/google-pixel-slate-discount/ … by @technacity pic.twitter.com/y7BUDk1Egt"
2019-05-26 15:31:45,hagan esto pero con cualquier cosa que se yo fotos de stock graciosas de Google delen  #UruguayNeedsBTSTour https://twitter.com/lgastelu1/status/1097706122327322624 …
2019-05-26 15:21:08,Nice! Quick Google search reveals they were sold @ forever 21 and they're still in stock. Rad!
2019-05-26 15:13:51,Before [old car]: 2004 Pontiac Sunfire  After [new car]: 2019 Nissan Altima SR  [Using stock photos from Google Images as representations]  I am so.. freaking.. happy!😁  pic.twitter.com/2UHd8wsnur
2019-05-26 15:11:33,"Google discounts Pixel Slate by $200, Core m3 now $599 & Celeron still out of stock  http://dlvr.it/R5SdJx  pic.twitter.com/P4pREO7F0L"
2019-05-26 14:49:03,"Google discounts Pixel Slate by $200, Core m3 now $599 & Celeron still out of stock  http://dlvr.it/R5SZwK  pic.twitter.com/sjDNzQ9LZL"
2019-05-26 14:46:29,"Google discounts Pixel Slate by $200, Core m3 now $599 & Celeron still out of stock  https://9to5google.com/2019/05/26/google-pixel-slate-discount/ … by @technacity pic.twitter.com/c8YIj4f76t"
2019-05-26 14:09:55,"It's hilarious how in their efforts to make us believe that POC love BS, they stooped to wearing digital blackface - creating fake POC profiles with stock Google pictures of POC, typing in ""black"" slang so antiquated it was downright cartoonish."
2019-05-26 13:49:40,"I am a dual fuel BG customer.  I worked for several energy companies. Before i retired. Including BG. Although Centica was registered on UK stock exchange at the time, myself and colleagues believed it was really a French Co. Around 15yrs ago. Google says no."
2019-05-26 13:37:27,"For me, I just google various poses and stockpile a lot of stock photos and stuff. I also follow some twitter accounts that post some pose refs. Lemme see if I can try to find them for ya."
2019-05-26 13:33:08,"Google “30's Man” and you’ll basically find stock photos of men realizing that their best years might be ahead of them, but are also very possibly behind them. #stockphotos pic.twitter.com/qwgDjPJ0ce"
2019-05-26 12:38:11,LPT for you smut writers out there.   Can’t afford really smutty stock photos? Want to build some capital before spending a ton on covers?  You can use Google image to find royalty free stock photos. Use the advanced options to show pics available for reuse with no copy write.
2019-05-26 12:14:58,With Tesla stock choosing at less than $190.  Down more than 50% you might be able to get it serviced at the Ford Dealer soon.   Amazon Google and Apple have been rumored to be interested in a takeover/buyout as well.
2019-05-26 11:44:10,Just like you were there for the Ronaldo transfer to Juventus and tweeted Google stock  pictures.....👀
2019-05-26 11:39:02,"""I google""  Autoreplace on my phone has made me a laughing stock on here."
2019-05-26 11:36:59,"Not in all companies. Not for all Principal Engineers. Also, will include a lot of stock components. Source: I am one and I earn a loooooot less than this :-)  Pay masters (Amazon, Microsoft, Google, Wallstreet firms) definitely pay this much. Look at Glassdoors :)"
2019-05-26 11:00:14,Since I tried stock android on my friend's xiaomi mi a2 I've been in love with it! I really need a pixel 3a or 3a xl but google doesn't sell them in Portugal:(
2019-05-26 10:48:20,"If #Uber turns into the high-growth tech stock of bull analysts' dreams, the #ridehailing company could disrupt the longstanding acronym of FAANG  #Facebook #Apple #Amazon #Netflix #Google #IPO #startup #innovation #GigEconomy #FutureofWork #startups https://www.businessinsider.de/tech-analysts-conflicting-names-faang-stocks-with-uber-2019-5 …"
2019-05-26 10:31:12,Its not about trading of its stock.  It's about the politics of the day in the US affecting the rest of us internet users and developers.  That is the impetus driving decentralization of platforms to varying degrees frm what i see  The point ws abt Google coming under US pressure
2019-05-26 10:23:22,"Berharap harga p30 pro anjlok. Terus beli, install stock android 9 pie dgn google pixel cam. Voila!"
2019-05-26 09:21:47,Google shows a history of Twitter stock decline when boycotts have been announced.
2019-05-26 09:17:45,"Confirmed!  Did a simple YouTube search for @MarkDice & top 8 videos were from other people, including 2 from ms. pakman!  Google has made themselves a laughing stock.  @Hard_Bastard @Styx666Official pic.twitter.com/ZuYUtgmevF"
2019-05-26 08:43:03,"Google is doing Trumps job for him. Thanks Google, keep killing yourself, we appreciate it. Once your stock gets low enough, one of Trumps billionaire friends will buy you out and purge it of its Marxist infection.  https://www.youtube.com/watch?v=-ilIO6cAvt0&feature=em-uploademail …"
2019-05-26 07:45:27,"Hello, we are here to provide support. P30 and P30 Pro are existing products, existing users including those have been sold or products still in stock will not be affected, please feel free to use Google apps."
2019-05-26 07:18:13,"Hello, we are here to provide support. Your phone is an existing product, existing users including those have been sold or products still in stock will not be affected, please feel free to use Google apps. We are at your service."
2019-05-26 07:09:01,Google strong dollar effect on import prices. I export. It’s killing me. Probably  increase stock market prices ironically.
2019-05-26 07:06:06,"It does type OK, but it is truly AWFUL for swiping. Strings of single letters and punctuation rather than real words, as if it hasn't been programmed to actually recognise language. Much worse than the Google stock offering, unfortunately :-("
2019-05-26 06:41:29,Analyze stock historical prices on Google Sheets  https://code.luasoftware.com/tutorials/google-sheets/analyze-historical-stock-price-with-google-sheets/ …
2019-05-26 05:46:46,"@HarveyNicholsCS can you tell me if you stock Olaplex No 3 in your store at Dundrum Shopping Center, Dublin? You came up on google search as a stockiest but I don’t see it on your website."
2019-05-26 04:59:58,@Google stop logging me out of every single account or I'll eat your whole company's microwave stock
2019-05-26 02:34:06,Portrait Mode shot of Redmi Note 5 pro  See the difference between G cam and Stock app  😲😲 @xdadevelopers @MiIndiaSupport @miuirom @manukumarjain @technologyjock @T_T_Reviews_YT #Giveme5 #RedmiK20 #OnePlus7Pro #Google #gcam #RedmiNote7S pic.twitter.com/vYlx576TZJ
2019-05-26 02:20:24,"having a curved screen phone with stock android has been on my wish-list for so long. Google never did it. So yes, i am somewhat tempted to pick OP7Pro."
2019-05-26 02:04:38,"Android 8.0, pixel pie icons, wall from a group of google photos, and the widget is stock"
2019-05-26 01:04:13,"Ada ready stock 64GB 128GB  Kepada yang berminat nak beraya dengan Google Pixel, boleh roger ya  😁😁  pic.twitter.com/i7fzJVF9Ed"
2019-05-26 00:24:06,You bought Kawhi stock at the perfect time. Like investing in Google in the late 90s or Bitcoin in like 2010 😂😂😂. No player has ever boosted his legacy off one playoff run like Kawhi is rn. Not even Dirk in 2011.
